"open","open","otevřít","otevřít","pf"," It was some little while before I could bring myself to open the window, and ask Miss Golightly what she wanted."," Chvilku mi trvalo, než jsem se přiměl otevřít okno a zeptat se slečny Golightlyové, co si přeje."
"ask","ask","zeptat","zeptat","pf"," It was some little while before I could bring myself to open the window, and ask Miss Golightly what she wanted."," Chvilku mi trvalo, než jsem se přiměl otevřít okno a zeptat se slečny Golightlyové, co si přeje."
"wanted","want","přeje","přát","impf"," It was some little while before I could bring myself to open the window, and ask Miss Golightly what she wanted."," Chvilku mi trvalo, než jsem se přiměl otevřít okno a zeptat se slečny Golightlyové, co si přeje."
"said","say","řekla","říci","pf"," “ I ’ ve got the most terrifying man downstairs, ” she said, stepping off the fire escape into the room."," "" Mám dole příšerného chlapa, "" řekla a z požárního žebříku sestoupila do okna."
"expected","expect","Čeká","čekat","impf"," “ You expected? ”"," "" Čeká vás? """
"come","come","Chodí","chodit","impf"," “ A lot of characters come here, they ’ re not expected."," "" Chodí sem spousta všelijakých nečekaných lidí."
"live","live","Bydlím","bydlet","impf"," “ I live upstairs. ”"," "" Bydlím o patro výš. """
"tapped","tap","Zaklepal","zaklepat","pf"," He tapped on the door gently, then louder;"," Zaklepal na dveře, nejdřív mírně, potom hlučněji;"
"opened","open","otevřely","otevřít","pf"," Just as he reached the bottom, the door of the girl ’ s apartment opened and she poked out her head."," Jakmile byl až dole, dveře bytu se otevřely a dívka z nich vystrčila hlavu."
"called","call","říká","říkat","impf"," It seems to carry such cachet later on to be called Mrs. Something Another."," Ženská tím zřejmě dostane punc, když se jí pak říká paní Ta a Ta."
"said","say","řekla","říci","pf"," “ My God, ” she said, and sat down again with a moan."," "" Proboha! "" řekla a s hlasitým povzdechem si znovu sedla."
"sat","sit","sedla","sednout","pf"," “ My God, ” she said, and sat down again with a moan."," "" Proboha! "" řekla a s hlasitým povzdechem si znovu sedla."
"straightened","straighten","vyrovnali","vyrovnat","pf"," They straightened their spines, sucked in their stomachs; there was a general contest to match her swaying height."," Honem napřímili páteř a vtáhli břicho ve všeobecném závodění, aby se výškou vyrovnali její klátivé postavě."
"match","match","vyrovnali","vyrovnat","pf"," They straightened their spines, sucked in their stomachs; there was a general contest to match her swaying height."," Honem napřímili páteř a vtáhli břicho ve všeobecném závodění, aby se výškou vyrovnali její klátivé postavě."
"said","say","řekla","říci","pf"," “ Incidentally, ” she said, “ do you happen to know any nice lesbians?"," "" Ale mimochodem, "" řekla, "" neznáš se s nějakou příjemnou lesbičkou?"
"looking","look","Hledám","hledat","impf"," I ’ m looking for a roommate."," Hledám si spolubydlící."
"do","do","dělají","dělat","impf"," and really, dykes are wonderful home-makers, they love to do all the work, you never have to bother about brooms and defrosting and sending out the laundry."," Lesby jsou opravdu báječné hospodyně, dělají rády všechnu práci, člověk se vůbec nemusí obtěžovat zametáním a rozmrazováním a starostmi se špinavým prádlem."
"bother","bother","obtěžovat","obtěžovat","impf"," and really, dykes are wonderful home-makers, they love to do all the work, you never have to bother about brooms and defrosting and sending out the laundry."," Lesby jsou opravdu báječné hospodyně, dělají rády všechnu práci, člověk se vůbec nemusí obtěžovat zametáním a rozmrazováním a starostmi se špinavým prádlem."
"played","play","hrála","hrát","impf"," I had a roommate in Hollywood, she played in Westerns, they called her the Lone Ranger;"," V Hollywoodu jsem bydlela s takovou holkou, hrála ve westernech, říkali jí Ztracená varta."
"called","call","říkali","říkat","impf"," I had a roommate in Hollywood, she played in Westerns, they called her the Lone Ranger;"," V Hollywoodu jsem bydlela s takovou holkou, hrála ve westernech, říkali jí Ztracená varta."
"saw","see","uviděl","uvidět","pf"," The little Jap knew it was her the minute he saw her. ”"," Ten Japončík věděl hned, že to je ona, jakmile ji uviděl. """
"saw","see","viděl","vidět","impf"," “ He saw her?"," "" On ji viděl?"
"Read","read","Přečtěte","přečíst","pf"," Read the facts for yourself, ” he said, turning over one of the photographs."," Přečtěte si sám, co tady stojí, "" řekl a ukázal mi rub jedné fotografie."
"said","say","řekl","říci","pf"," Read the facts for yourself, ” he said, turning over one of the photographs."," Přečtěte si sám, co tady stojí, "" řekl a ukázal mi rub jedné fotografie."
"cheered","cheer","potěšilo","potěšit","pf"," He seemed cheered to learn that I saw no reason for a “ scandal ”;"," Zřejmě ho potěšilo, když slyšel, že nevidím důvod, proč by z toho měl být "" skandál "";"
"saw","see","nevidím","vidět","impf"," He seemed cheered to learn that I saw no reason for a “ scandal ”;"," Zřejmě ho potěšilo, když slyšel, že nevidím důvod, proč by z toho měl být "" skandál "";"
"declared","declare","prohlásil","prohlásit","pf"," “ It is only a question of grieving, ” he firmly declared."," "" Udělala to jen ze zármutku, "" prohlásil důrazně."
"came","come","přišla","přijít","pf"," “ When the sadness came, first she throws the drink she is drinking."," "" Když přišla ta smutná zpráva, nejdřív praštila sklenicí s drinkem, co z ní pila."
"wanted","want","chtěl","chtít","impf"," “ But why? ” I wanted to know."," "" Ale proč? "" chtěl jsem vědět."
"rubbed","rub","třel","třít","impf"," The red cat jumped off its crate and rubbed against his leg."," Zrzavý kocour seskočil z bedny a třel se mu o nohu."
"hear","hear","slyšet","slyšet","impf"," I ’ d like to hear it myself. ”"," Sama bych to chtěla slyšet. """
"began","begin","začínal","začínat","impf"," It began :"," Dopis začínal :"
"interrupted","interrupt","přerušila","přerušit","pf"," Holly at once interrupted."," Holly mě honem přerušila."
"wanted","want","Chtěla","chtít","impf"," She wanted to know what I thought of the handwriting."," Chtěla vědět, co si myslím o rukopisu."
"thought","think","myslím","myslet","impf"," She wanted to know what I thought of the handwriting."," Chtěla vědět, co si myslím o rukopisu."
"thought","think","Nemyslel","myslet","impf"," I thought nothing : a tight, highly legible, uneccentric script."," Nemyslel jsem si nic : úhledné, výtečně čitelné, nevýstřední písmo."
"declared","declare","prohlásila","prohlásit","pf"," Buttoned up and constipated, ” she declared."," Knoflíčky zapnuté až ke krku a zácpa, "" prohlásila."
"loved","love","miloval","milovat","impf"," “ My dearest little girl, I have loved you knowing you were not as others."," "" Má nejdražší holčičko, já jsem tě miloval v přesvědčení, že nejsi taková jako druhé."
"said","say","řekla","říci","pf"," Uncorking the brandy, she said :"," Odzátkovala koňak a řekla :"
"bought","buy","nenakoupila","nakoupit","pf"," Thank Jesus I never bought the chest."," Ale bohudík jsem si výbavu nenakoupila."
"need","need","potřebovat","potřebovat","impf"," “ You ’ ll only need two, ” he told her."," "" Budete potřebovat jen dvě, "" odbyl ji."
"replied","reply","Odpověděla","odpovědět","pf"," we ’ d traveled a block before she replied."," Odpověděla mi teprve u příštího nároží :"
"told","tell","říkala","říkat","impf"," “ I told you. We just met by the river one day : that ’ s all."," "" Vždyť jsem ti říkala, že jsme se tehdy spolu sčuchli u řeky."
"refused","refuse","odmítl","odmítnout","pf"," O ’ Shaughnessy, a burly red-haired man, refused comment and kicked one cameraman in the groin."," O ' Shaughnessy, statný muž s ryšavými vlasy, vůbec odmítl vypovídat a přítomného kameramana kopl do slabin."
"kicked","kick","kopl","kopnout","pf"," O ’ Shaughnessy, a burly red-haired man, refused comment and kicked one cameraman in the groin."," O ' Shaughnessy, statný muž s ryšavými vlasy, vůbec odmítl vypovídat a přítomného kameramana kopl do slabin."
"appeared","appear","zdála","zdát","impf"," But Miss Golightly, a fragile eyeful, even though attired like a tomboy in slacks and leather jacket, appeared relatively unconcerned."," Ale slečna Golightlyová, křehká a nápadně hezká, ačkoli oblečená klukovsky v džínsech a kožené větrovce, zdála se poměrně lhostejná."
"ask","ask","Neptejte","ptát","impf"," “ Don ’ t ask me what the hell this is about, ” she told reporters."," "" Neptejte se mě, co má tohle všechno znamenat, "" řekla reportérům."
"told","tell","řekla","říci","pf"," “ Don ’ t ask me what the hell this is about, ” she told reporters."," "" Neptejte se mě, co má tohle všechno znamenat, "" řekla reportérům."
"left","leave","odešla","odejít","pf"," ” She was emptying ashtrays, and after Mag Wildwood had left the room, she emptied another, then said, sighed rather :"," Vyprazdňovala popelníčky, a když Mag odešla z pokoje, vyklepla ještě jeden a pak řekla, spíš si povzdechla :"
"said","say","řekla","říci","pf"," ” She was emptying ashtrays, and after Mag Wildwood had left the room, she emptied another, then said, sighed rather :"," Vyprazdňovala popelníčky, a když Mag odešla z pokoje, vyklepla ještě jeden a pak řekla, spíš si povzdechla :"
"think","think","myslel","myslet","impf"," You ’ d think it would show more."," Člověk by myslel, že to na ní bude vidět víc."
"got","get","dostal","dostat","pf"," Soon as I got that letter from Fred, saying where she was, I bought myself a ticket on the Greyhound."," A tak hned, jak jsem dostal to psaní od Freda, kde sestra je, koupil jsem si lístek na Greyhound."
"got","get","koupil","koupit","pf"," Soon as I got that letter from Fred, saying where she was, I bought myself a ticket on the Greyhound."," A tak hned, jak jsem dostal to psaní od Freda, kde sestra je, koupil jsem si lístek na Greyhound."
"bought","buy","koupil","koupit","pf"," Soon as I got that letter from Fred, saying where she was, I bought myself a ticket on the Greyhound."," A tak hned, jak jsem dostal to psaní od Freda, kde sestra je, koupil jsem si lístek na Greyhound."
"said","say","řekl","říci","pf"," “ Them ’ s her churren, ” he said, almost shouted."," "" Tohle jsou její děti! "" řekl, málem vykřikl."
"shouted","shout","vykřikl","vykřiknout","pf"," “ Them ’ s her churren, ” he said, almost shouted."," "" Tohle jsou její děti! "" řekl, málem vykřikl."
"sitting","sit","seděli","sedět","impf"," Joe Bell, in whose bar we were sitting, accepted the order reluctantly."," Joe Bell, u něhož jsme seděli v baru, vyslechl její objednávku dost neochotně."
"told","tell","řekla","říci","pf"," Besides, I haven ’ t been to bed yet, ” she told him, and confided to me :"," A kromě toho, já jsem se ještě ani nedostala do postele, "" řekla mu, a mně se svěřila :"
"confided","confide","svěřila","svěřit","pf"," Besides, I haven ’ t been to bed yet, ” she told him, and confided to me :"," A kromě toho, já jsem se ještě ani nedostala do postele, "" řekla mu, a mně se svěřila :"
"seemed","seem","zdálo","zdát","impf"," while the wind pushed and the cat scratched, the cat screamed - but worse, I was frightened, a coward to equal José : those storming streets seemed aswarm with unseen presences waiting to trap,"," a vítr burácel a kocour škrábal a ječel - a co hůř, dostal jsem strach, najednou byl ze mne zbabělec jako José : zdálo se mi, že se v zaplavených ulicích rojí přízraky, které jen číhají, aby mě polapily a uvěznily za to, že provinilci pomáhám uprchnout před zákonem."
"bring","bring","Neseš","nést","impf"," Did you bring the brandy? ”"," Neseš ten koňak? """
"leaped","leap","skočil","skočit","pf"," And the cat, released, leaped and perched on her shoulder : his tail swung like a baton conducting rhapsodic music."," A vypuštěný kocour jí skočil na rameno a usadil se na něm : ohon mu komíhal sem a tam jako taktovka řídící rapsodickou hudbu."
"run","run","uteče","utéci","pf"," Until they ’ re strong enough to run into the woods."," Až je už tak silný, že vám uteče do lesa."
"Ask","ask","Ptejte","ptát","impf"," Ask for Mag Wildwood. ”"," Ptejte se na Mag Wildwoodovou. """
"gone","go","odešli","odejít","pf"," They were gone."," A odešli."
"solved","solve","vyřešila","vyřešit","pf"," But she solved the problem herself."," Ale tenhle problém vyřešila sama."
"run","run","běžet","běžet","impf"," My first thought was to run for a doctor."," Můj první nápad byl běžet pro doktora."
"drawn","draw","táhne","táhnout","impf"," I am always drawn back to places where I have lived, the houses and their neighborhoods."," Vždycky mě to táhne zpátky k místům, kde jsem bydlel, k těm domům a jejich nejbližšímu okolí."
"lived","live","bydlel","bydlet","impf"," I am always drawn back to places where I have lived, the houses and their neighborhoods."," Vždycky mě to táhne zpátky k místům, kde jsem bydlel, k těm domům a jejich nejbližšímu okolí."
"learned","learn","naučila","naučit","pf"," But there were moments when she played songs that made you wonder where she learned them, where indeed she came from."," Ale hrávala i takové, že se člověk musel podivit, kde se jim naučila a odkud vlastně pochází."
"came","come","pochází","pocházet","impf"," But there were moments when she played songs that made you wonder where she learned them, where indeed she came from."," Ale hrávala i takové, že se člověk musel podivit, kde se jim naučila a odkud vlastně pochází."
"lived","live","bydlela","bydlet","impf"," At one point, Madame Sapphia Spanella, the coloratura and roller-skating en husiast who lived on the first floor, circulated a petition among the brownstone ’ s other tenants asking them to join her in having Miss Golightly evicted : she was, said Madame Spanella, “ morally objectionable ” and the “ perpetrator of all-night gatherings that endanger the safety and sanity of her neighbors."," Madame Sapphia Spanella, koloraturní sopranistka nadšená pro bruslení na kolečkách, která v našem činžáku bydlela v prvním patře, dala jednoho dne mezi ostatními nájemníky kolovat výzvu, aby se připojili k její žádosti o vypovězení slečny Golightlyové z bytu : madame Spanella o ní prohlašovala, že je "" mravně závadná "" a že "" u sebe ustavičně pořádá schůzky, které trvají až do rána a ohrožují bezpečnost a zdraví jejích sousedů. """
"circulated","circulate","kolovat","kolovat","impf"," At one point, Madame Sapphia Spanella, the coloratura and roller-skating en husiast who lived on the first floor, circulated a petition among the brownstone ’ s other tenants asking them to join her in having Miss Golightly evicted : she was, said Madame Spanella, “ morally objectionable ” and the “ perpetrator of all-night gatherings that endanger the safety and sanity of her neighbors."," Madame Sapphia Spanella, koloraturní sopranistka nadšená pro bruslení na kolečkách, která v našem činžáku bydlela v prvním patře, dala jednoho dne mezi ostatními nájemníky kolovat výzvu, aby se připojili k její žádosti o vypovězení slečny Golightlyové z bytu : madame Spanella o ní prohlašovala, že je "" mravně závadná "" a že "" u sebe ustavičně pořádá schůzky, které trvají až do rána a ohrožují bezpečnost a zdraví jejích sousedů. """
"join","join","připojili","připojit","pf"," At one point, Madame Sapphia Spanella, the coloratura and roller-skating en husiast who lived on the first floor, circulated a petition among the brownstone ’ s other tenants asking them to join her in having Miss Golightly evicted : she was, said Madame Spanella, “ morally objectionable ” and the “ perpetrator of all-night gatherings that endanger the safety and sanity of her neighbors."," Madame Sapphia Spanella, koloraturní sopranistka nadšená pro bruslení na kolečkách, která v našem činžáku bydlela v prvním patře, dala jednoho dne mezi ostatními nájemníky kolovat výzvu, aby se připojili k její žádosti o vypovězení slečny Golightlyové z bytu : madame Spanella o ní prohlašovala, že je "" mravně závadná "" a že "" u sebe ustavičně pořádá schůzky, které trvají až do rána a ohrožují bezpečnost a zdraví jejích sousedů. """
"endanger","endanger","ohrožují","ohrožovat","impf"," At one point, Madame Sapphia Spanella, the coloratura and roller-skating en husiast who lived on the first floor, circulated a petition among the brownstone ’ s other tenants asking them to join her in having Miss Golightly evicted : she was, said Madame Spanella, “ morally objectionable ” and the “ perpetrator of all-night gatherings that endanger the safety and sanity of her neighbors."," Madame Sapphia Spanella, koloraturní sopranistka nadšená pro bruslení na kolečkách, která v našem činžáku bydlela v prvním patře, dala jednoho dne mezi ostatními nájemníky kolovat výzvu, aby se připojili k její žádosti o vypovězení slečny Golightlyové z bytu : madame Spanella o ní prohlašovala, že je "" mravně závadná "" a že "" u sebe ustavičně pořádá schůzky, které trvají až do rána a ohrožují bezpečnost a zdraví jejích sousedů. """
"refused","refuse","Odmítl","odmítnout","pf"," ” Though I refused to sign, secretly I felt Madame Spanella had cause to complain."," Odmítl jsem to podepsat, ale v duchu jsem uznával, že madame Spanella má důvod si stěžovat."
"sign","sign","podepsat","podepsat","pf"," ” Though I refused to sign, secretly I felt Madame Spanella had cause to complain."," Odmítl jsem to podepsat, ale v duchu jsem uznával, že madame Spanella má důvod si stěžovat."
"complain","complain","stěžovat","stěžovat","impf"," ” Though I refused to sign, secretly I felt Madame Spanella had cause to complain."," Odmítl jsem to podepsat, ale v duchu jsem uznával, že madame Spanella má důvod si stěžovat."
"told","tell","mluvit","mluvit","impf"," “ They never told me not to tell anyone."," "" Nikdy mi sice nezakázali o něm mluvit."
"tell","tell","mluvit","mluvit","impf"," “ They never told me not to tell anyone."," "" Nikdy mi sice nezakázali o něm mluvit."
"kiss","kiss","políbit","políbit","pf"," Perhaps contortionists can kiss their elbow; she had to accept an approximation."," Někdo snad se dovede tak zkroutit, aby si mohl políbit loket, ale u mne se musela spokojit jen přibližným gestem."
"run","run","utéct","utéci","pf"," Well, you can ’ t really run off and leave everybody. ”"," Vždyť nemůžeš takhle utéct a všechny nás opustit. """
"leave","leave","opustit","opustit","pf"," Well, you can ’ t really run off and leave everybody. ”"," Vždyť nemůžeš takhle utéct a všechny nás opustit. """
"said","say","řekla","říci","pf"," “ I loved old Sally, ” she said, and sighed."," "" Měla jsem starého Sallyho ráda, "" řekla s povzdechem."
"told","tell","řekla","říci","pf"," When I told him I was going away, he was an angel."," Byl úplný anděl, když jsem mu řekla, že jedu pryč."
"going","go","jedu","jet","impf"," When I told him I was going away, he was an angel."," Byl úplný anděl, když jsem mu řekla, že jedu pryč."
"suppose","suppose","myslíš","myslet","impf"," “ I suppose you think I ’ m very brazen."," "" Jistě si myslíš, že jsem nestyda."
"think","think","myslíš","myslet","impf"," “ I suppose you think I ’ m very brazen."," "" Jistě si myslíš, že jsem nestyda."
"said","say","odpověděl","odpovědět","pf"," “ No, sir, ” he said, clearing his throat."," "" Kdepak, "" odpověděl a odkašlal si."
"took","take","nevzali","vzít","pf"," “ Fred was with us right till they took him in the Army."," "" Fred u nás zůstal, dokud ho nevzali na vojnu."
"left","leave","opustila","opustit","pf"," He didn ’ t know what got into Lulamae, how come she left her brother and husband and"," Nevěděl, co to do Lulamae vjelo, že opustila bratra a muže a děti."
"asked","ask","zeptal","zeptat","pf"," He squeezed her arm, as though to admire her muscle, and asked her if she could use a drink."," Popadl ji za paži, jako by jí s obdivem ohmatával sval, a zeptal se jí, jestli by se chtěla něčeho napít."
"said","say","řekla","říci","pf"," “ I surely could, ” she said."," "" To se ví, že jo, "" řekla."
"told","tell","řekla","říci","pf"," Holly told her,"," Holly jí řekla :"
"suggested","suggest","nabídl","nabídnout","pf"," “ There isn ’ t any. ” Whereupon the Air Force colonel suggested he run out for a bottle."," "" Tu tady nemáme, "" načež se plukovník letectva nabídl, že doběhne pro láhev režné."
"accepted","accept","vzal","vzít","pf"," The Carey chauffeur was a worldly specimen who accepted our slapdash luggage most civilly and remained rock-faced when, as the limousine swished uptown through a lessening rain, Holly stripped off her clothes, the riding costume she ’ d never had a chance to substitute, and struggled into a slim black dress."," Šofér od Careyho byl světem protřelý - naše halabala zavazadla vzal na vědomí velice zdvořile a v obličeji se mu nepohnul ani sval, když Holly, jakmile se limuzína v polevujícím dešti svištivě rozjela směrem z města, honem svlékla svůj jezdecký kostým ( vždyť neměla doposud možnost se převléknout ) a vsoukala se do přiléhavých černých šatů."
"stripped","strip","svlékla","svléknout","pf"," The Carey chauffeur was a worldly specimen who accepted our slapdash luggage most civilly and remained rock-faced when, as the limousine swished uptown through a lessening rain, Holly stripped off her clothes, the riding costume she ’ d never had a chance to substitute, and struggled into a slim black dress."," Šofér od Careyho byl světem protřelý - naše halabala zavazadla vzal na vědomí velice zdvořile a v obličeji se mu nepohnul ani sval, když Holly, jakmile se limuzína v polevujícím dešti svištivě rozjela směrem z města, honem svlékla svůj jezdecký kostým ( vždyť neměla doposud možnost se převléknout ) a vsoukala se do přiléhavých černých šatů."
"led","lead","vést","vést","impf"," We didn ’ t talk : talk could have only led to argument; and also, Holly seemed too preoccupied for conversation."," Vůbec jsme nemluvili : hovor mohl jedině vést k hádce, a mimoto se Holly zdála tolik něčím zaujatá, že neměla ani pomyšlení na konverzaci."
"seemed","seem","zdála","zdát","impf"," We didn ’ t talk : talk could have only led to argument; and also, Holly seemed too preoccupied for conversation."," Vůbec jsme nemluvili : hovor mohl jedině vést k hádce, a mimoto se Holly zdála tolik něčím zaujatá, že neměla ani pomyšlení na konverzaci."
"seem","seem","zdálo","zdát","impf"," But there were no quarreling voices inside the uproar, which made it seem unnatural."," Ale v lomozu se neozývaly hádavé hlasy, a to se zdálo nepřirozené."
"subsided","subside","přestalo","přestat","pf"," Pounding on it had one result : the racket subsided."," Zabouchal jsem na ně, ale jen s tím výsledkem, že řádění přestalo."
"said","say","řekl","říci","pf"," “ Kid ’ s in the shower, ” he said, motioning a cigar toward a sound of water hissing in another room."," "" Malá je pod sprchou, "" řekl a doutníkem ukázal ke dveřím, odkud se ozývalo crčení vody."
"put","put","Položila","položit","pf"," She put her hand over mine and pressed it with sudden immense sincerity."," Položila ruku na mou a stiskla mi ji v návalu nezměrné upřímnosti."
"pressed","press","stiskla","stisknout","pf"," She put her hand over mine and pressed it with sudden immense sincerity."," Položila ruku na mou a stiskla mi ji v návalu nezměrné upřímnosti."
"talked","talk","Mluvila","mluvit","impf"," I talked it over with the lawyer : Oh, I didn ’ t tell him anything re Rio - he ’ d tip the badgers himself, rather than lose his fee, to say nothing of the nickels O. J. put up for bail."," Mluvila jsem o tom s advokátem : ne, ve věci Rio jsem před ním ani nemukla - sám by dal echo fízlům, aby nepřišel o honorář, nehledě na ty prachy, co O. J. Berman složil jako kauci."
"tell","tell","Mluvila","mluvit","impf"," I talked it over with the lawyer : Oh, I didn ’ t tell him anything re Rio - he ’ d tip the badgers himself, rather than lose his fee, to say nothing of the nickels O. J. put up for bail."," Mluvila jsem o tom s advokátem : ne, ve věci Rio jsem před ním ani nemukla - sám by dal echo fízlům, aby nepřišel o honorář, nehledě na ty prachy, co O. J. Berman složil jako kauci."
"say","say","Mluvila","mluvit","impf"," I talked it over with the lawyer : Oh, I didn ’ t tell him anything re Rio - he ’ d tip the badgers himself, rather than lose his fee, to say nothing of the nickels O. J. put up for bail."," Mluvila jsem o tom s advokátem : ne, ve věci Rio jsem před ním ani nemukla - sám by dal echo fízlům, aby nepřišel o honorář, nehledě na ty prachy, co O. J. Berman složil jako kauci."
