"meant","mean","myslím","myslet","impf"," “ But Doc knew what I meant."," "" Ale doktůrek věděl, jak to myslím."
"explained","explain","vysvětlila","vysvětlit","pf"," I explained it to him very carefully, and it was something he could understand."," Pečlivě jsem mu to vysvětlila, a nakonec to přece pochopil."
"understand","understand","pochopil","pochopit","pf"," I explained it to him very carefully, and it was something he could understand."," Pečlivě jsem mu to vysvětlila, a nakonec to přece pochopil."
"wished","wish","popřál","popřát","pf"," We shook hands and held on to each other and he wished me luck. ”"," Podali jsme si ruce, padli jsme si do náručí a popřál mi štěstí. """
"glanced","glance","Pohlédla","pohlédnout","pf"," She glanced at the clock."," Pohlédla na hodiny."
"altered","alter","proměnil","proměnit","pf"," the smile altered his face, made something gentle happen."," obličej se mu proměnil, nějak mu zvlídněl."
"told","tell","říkal","říkat","impf"," Like I told you, ” he said, and now it sounded true, “ I sincerely like the kid. ”"," Jak jsem vám říkal, mám tu malou upřímně rád, "" dodal a znělo to pravdivě."
"said","say","říkal","říkat","impf"," Like I told you, ” he said, and now it sounded true, “ I sincerely like the kid. ”"," Jak jsem vám říkal, mám tu malou upřímně rád, "" dodal a znělo to pravdivě."
"sounded","sound","znělo","znít","impf"," Like I told you, ” he said, and now it sounded true, “ I sincerely like the kid. ”"," Jak jsem vám říkal, mám tu malou upřímně rád, "" dodal a znělo to pravdivě."
"added","add","dodala","dodat","pf"," ” Then she added, censoriously :"," Pak dodala přísně :"
"withdrew","withdraw","odvolala","odvolat","pf"," Mag withdrew her complaint; she accepted the comment as flattery reflecting on herself."," Mag svou stížnost odvolala : přijala tu poznámku jako lichotku, která dopadá i na ni."
"accepted","accept","přijala","přijmout","pf"," Mag withdrew her complaint; she accepted the comment as flattery reflecting on herself."," Mag svou stížnost odvolala : přijala tu poznámku jako lichotku, která dopadá i na ni."
"rescue","rescue","zachránily","zachránit","pf"," Nursemaids rushed to rescue their charges from our awesome approach;"," Chůvy se s hrůzou vrhaly ke svým svěřencům, aby je před námi zachránily;"
"yelled","yell","křičeli","křičet","impf"," men, bums and others, yelled :"," muži, pobudové i ostatní, křičeli :"
"Pull","pull","Přitáhněte","přitáhnout","pf"," “ Pull in the reins! ” and “ Whoa, boy, whoa! ” and “ Jump! ”"," "" Přitáhněte otěže! "" a "" Prr, chlape, prr! "" a "" Seskoč! """
"put","put","nedá","dát","pf"," Maybe the older you grow and the less easy it is to put thought into action, maybe that ’ s why it gets all locked up in your head and becomes a burden."," Možná proto, že čím je člověk starší a čím je těžší přejít od myšlení k činu, snad se mu to všechno nakupí v hlavě a nedá mu to pokoj."
"read","read","čtu","číst","impf"," Whenever I read in the paper about an old man disgracing himself, I know it ’ s because of this burden."," Když čtu v novinách o takovém starém člověku, jak se zostudil, vždycky si řeknu, že mu tohle nedá pokoj."
"poured","pour","nalil","nalít","pf"," But ” - he poured himself a jigger of whiskey and swallowed it neat - “ I ’ ll never disgrace myself."," Ale "" - nalil si náprstek whisky a polkl ji naráz - "" já si nikdy neudělám tuhle ostudu."
"swallowed","swallow","polkl","polknout","pf"," But ” - he poured himself a jigger of whiskey and swallowed it neat - “ I ’ ll never disgrace myself."," Ale "" - nalil si náprstek whisky a polkl ji naráz - "" já si nikdy neudělám tuhle ostudu."
"swear","swear","přísahám","přísahat","impf"," And I swear, it never crossed my mind about Holly."," A přísahám, že na tohle jsem nikdy nepomyslel ani s Holly."
"said","say","Řekl","říci","pf"," And I said, certain it was so :"," Řekl jsem tedy s jistotou, že to tak je :"
"send","send","Poslal","poslat","pf"," “ Did Mr. Ybarra-Jaegar send you? ”"," "" Poslal vás pan Ybarra - Jaegar? """
"said","say","odpověděl","odpovědět","pf"," “ I am the cousin, ” he said with a wary grin and just-penetrable accent."," "" Jsem jeho bratranec, "" odpověděl s obezřetným úsměvem a téměř nepostižitelným cizím přízvukem."
"repeated","repeat","Opakoval","opakovat","impf"," He repeated the question, as though translating it into another language."," Opakoval mou otázku, jako by si ji překládal do nějaké jiné řeči."
"translating","translate","překládal","překládat","impf"," He repeated the question, as though translating it into another language."," Opakoval mou otázku, jako by si ji překládal do nějaké jiné řeči."
"come","come","přijel","přijet","pf"," So I come to get her."," A tak jsem si pro ni přijel."
"get","get","přijel","přijet","pf"," So I come to get her."," A tak jsem si pro ni přijel."
"wants","want","chce","chtít","impf"," I know she wants to go home."," Já vím, že se chce vrátit domů. """
"asking","ask","žádal","žádat","impf"," ” He seemed to be asking me to agree with him."," Jako by mě žádal, abych mu to potvrdil."
"told","tell","Řekl","říci","pf"," I told him that I thought he ’ d find Holly, or Lulamae, somewhat changed."," Řekl jsem mu, že se mu Holly, nebo Lulamae, asi bude zdát poněkud změněná."
"thought","think","zdát","zdát","impf"," I told him that I thought he ’ d find Holly, or Lulamae, somewhat changed."," Řekl jsem mu, že se mu Holly, nebo Lulamae, asi bude zdát poněkud změněná."
"waiting","wait","Čeká","čekat","impf"," She is waiting, ” he said and, seeming to dismiss me, resumed his valet activities."," Čeká na mě, "" řekl, a jako by tím bylo všechno vyřízeno, pokračoval ve svých lokajských službách."
"said","say","řekl","říci","pf"," She is waiting, ” he said and, seeming to dismiss me, resumed his valet activities."," Čeká na mě, "" řekl, a jako by tím bylo všechno vyřízeno, pokračoval ve svých lokajských službách."
"resumed","resume","pokračoval","pokračovat","impf"," She is waiting, ” he said and, seeming to dismiss me, resumed his valet activities."," Čeká na mě, "" řekl, a jako by tím bylo všechno vyřízeno, pokračoval ve svých lokajských službách."
"understood","understand","porozuměl","porozumět","pf"," The cousin giggled, I ’ m sure he understood me."," Bratranec se uchichtl, jistě mi porozuměl."
"shut","shut","Zavřel","zavřít","pf"," He shut the suitcase and produced a letter."," Zavřel kufr a vytáhl dopis."
"see","see","chápeš","chápat","impf"," Now do you see why I went crazy and broke everything? ”"," A tak chápeš, proč jsem všechno rozmlátila jako pominutá? """
"allowed","allow","směl","smět","impf"," Except for the lawyer O. J. Berman had hired, I was the only visitor she had been allowed."," Kromě advokáta najatého O. J. Bermanem jsem byl jediný, kdo směl Holly navštívit."
"explained","explain","vysvětlila","vysvětlit","pf"," Holly explained that :"," Holly mi to vysvětlila :"
"think","think","Myslí","myslet","impf"," “ They think you ’ re my downfall, darling. The fellow what done me wrong ”; and, to a suggestion that she set them straight, replied :"," "" Myslí si, drahoušku, že ty jsi má zkáza, žes mě přivedl do maléru, "" a na můj návrh, aby je tedy vyvedla z omylu, odpověděla :"
"set","set","přivedl","přivést","pf"," “ They think you ’ re my downfall, darling. The fellow what done me wrong ”; and, to a suggestion that she set them straight, replied :"," "" Myslí si, drahoušku, že ty jsi má zkáza, žes mě přivedl do maléru, "" a na můj návrh, aby je tedy vyvedla z omylu, odpověděla :"
"replied","reply","odpověděla","odpovědět","pf"," “ They think you ’ re my downfall, darling. The fellow what done me wrong ”; and, to a suggestion that she set them straight, replied :"," "" Myslí si, drahoušku, že ty jsi má zkáza, žes mě přivedl do maléru, "" a na můj návrh, aby je tedy vyvedla z omylu, odpověděla :"
"earning","earn","vydělávat","vydělávat","impf"," Rusty Trawler is too hard a way of earning it. ”"," Je to jistě dřina vydělávat si je na Rustym Trawlerovi. """
"take","take","dostat","dostat","pf"," “ It should take you about four seconds to walk from here to the door."," "" Odtud ke dveřím by ses měl dostat za čtyři vteřiny."
"give","give","dám","dát","pf"," I ’ ll give you two. ”"," Já ti dám dvě. """
"went","go","Šel","jít","impf"," I went straight upstairs, got the bird cage, took it down and left it in front of her door."," Šel jsem rovnou nahoru, popadl ptačí klec, snesl jsem ji dolů a nechal před jejími dveřmi."
"took","take","popadl","popadnout","pf"," I went straight upstairs, got the bird cage, took it down and left it in front of her door."," Šel jsem rovnou nahoru, popadl ptačí klec, snesl jsem ji dolů a nechal před jejími dveřmi."
"took","take","snesl","snést","pf"," I went straight upstairs, got the bird cage, took it down and left it in front of her door."," Šel jsem rovnou nahoru, popadl ptačí klec, snesl jsem ji dolů a nechal před jejími dveřmi."
"left","leave","nechal","nechat","pf"," I went straight upstairs, got the bird cage, took it down and left it in front of her door."," Šel jsem rovnou nahoru, popadl ptačí klec, snesl jsem ji dolů a nechal před jejími dveřmi."
"Let","let","dovolte","dovolit","pf"," Let me build you a drink."," Ale dovolte, namíchám vám drink."
"call","call","říkají","říkat","impf"," Something new. They call it a White Angel, ” he said, mixing one-half vodka, one-half gin, no vermouth."," Je to novinka, říkají mu Bílý anděl, "" dodal a namíchal mi jej napůl z vodky a napůl z džinu, bez vermutu."
"said","say","říkají","říkat","impf"," Something new. They call it a White Angel, ” he said, mixing one-half vodka, one-half gin, no vermouth."," Je to novinka, říkají mu Bílý anděl, "" dodal a namíchal mi jej napůl z vodky a napůl z džinu, bez vermutu."
"tell","tell","povědět","povědět","pf"," While I drank the result, Joe Bell stood sucking on a Tums and turning over in his mind what he had to tell me."," Zvolna jsem popíjel, co z toho vzniklo, a Joe Bell stál za pultem, cucal magneziové cukrátko a rozmýšlel se, co mi vlastně chce povědět."
"said","say","řekl","říci","pf"," “ From California, ” I said, recalling Mr. Yunioshi perfectly."," "" Z Kalifornie, "" řekl jsem - moc dobře jsem se na něho pamatoval."
"recalling","recall","pamatoval","pamatovat","impf"," “ From California, ” I said, recalling Mr. Yunioshi perfectly."," "" Z Kalifornie, "" řekl jsem - moc dobře jsem se na něho pamatoval."
"expecting","expect","očekával","očekávat","impf"," It happened to fall on the 30th of September, my birthday, a fact which had no effect on events, except that, expecting some form of monetary remembrance from my family, I was eager for the postman ’ s morning visit."," Připadl na 30. září, den mých narozenin, což ovšem vůbec neovlivnilo události, až na to, že jsem od své rodiny očekával nějakou vzpomínku v peněžité podobě a ráno jsem dychtivě vyhlížel listonoše."
"waited","wait","čekal","čekat","impf"," Indeed, I went downstairs and waited for him."," Dokonce jsem na něho čekal dole v domě."
"asked","ask","vyzvala","vyzvat","pf"," If I had not been loitering in the vestibule, then Holly would not have asked me to go horseback riding; and would not, consequently, have had the opportunity to save my life."," Kdybych nebyl okouněl ve vestibulu, nebyla by mě Holly vyzvala, abych se s ní projel na koni, a tak by nebyla měla příležitost zachránit mi život."
"save","save","zachránit","zachránit","pf"," If I had not been loitering in the vestibule, then Holly would not have asked me to go horseback riding; and would not, consequently, have had the opportunity to save my life."," Kdybych nebyl okouněl ve vestibulu, nebyla by mě Holly vyzvala, abych se s ní projel na koni, a tak by nebyla měla příležitost zachránit mi život."
"think","think","máš","mít","impf"," “ If you ask me, I think you ’ re l-l-lucky."," "" Jestli chceš vědět, máš d - d - doopravdy štěstí."
"say","say","říct","říci","pf"," At least there ’ s one thing you can say for Rusty. He ’ s an American. ”"," O Rustym se aspoň může říct, že je Američan. """
"seen","see","neuvidíš","uvidět","pf"," “ And when it ’ s over, you ’ ve seen the last of me, boy. ”",", A až bude po ní, tak mě tady víckrát neuvidíš. """
"reached","reach","došli","dojít","pf"," When they reached her door she rummaged her purse in search of a key, and took no notice of the fact that his thick lips were nuzzling the nape of her neck."," Když došli ke dveřím, chvíli se hrabala v kabelce, hledala klíč a vůbec si nevšímala, jak jí tlustými rty jezdí vzadu po krku."
"rummaged","rummage","hledala","hledat","impf"," When they reached her door she rummaged her purse in search of a key, and took no notice of the fact that his thick lips were nuzzling the nape of her neck."," Když došli ke dveřím, chvíli se hrabala v kabelce, hledala klíč a vůbec si nevšímala, jak jí tlustými rty jezdí vzadu po krku."
"closing","close","zavíraly","zavírat","impf"," “ Hey, baby! ” he said, for the door was closing in his face."," "" Copak, copak, baby? "" vykřikl, protože se mu dveře zavíraly před nosem."
"want","want","chceš","chtít","impf"," Actually, except for Doc, if you want to count Doc, José is my first non-rat romance."," Vlastně kromě doktora, jestli chceš počítat doktora, je José můj první negaunerský případ."
"count","count","počítat","počítat","impf"," Actually, except for Doc, if you want to count Doc, José is my first non-rat romance."," Vlastně kromě doktora, jestli chceš počítat doktora, je José můj první negaunerský případ."
"takes","take","dělá","dělat","impf"," He tells little lies and he worries what people think and he takes about fifty baths a day : men ought to smell some what."," Sem tam si zalže a pořád si dělá starosti, co si lidi pomyslí, a padesátkrát za den se koupá : mužský má přece aspoň trošku zavánět."
"think","think","pomyslí","pomyslit","pf"," He tells little lies and he worries what people think and he takes about fifty baths a day : men ought to smell some what."," Sem tam si zalže a pořád si dělá starosti, co si lidi pomyslí, a padesátkrát za den se koupá : mužský má přece aspoň trošku zavánět."
"think","think","má","mít","impf"," He tells little lies and he worries what people think and he takes about fifty baths a day : men ought to smell some what."," Sem tam si zalže a pořád si dělá starosti, co si lidi pomyslí, a padesátkrát za den se koupá : mužský má přece aspoň trošku zavánět."
"woke","wake","probudil","probudit","pf"," One night, it was long past twelve, I woke up at the sound of Mr. Yunioshi calling down the stairs."," Jednou v noci, dávno po dvanácté, mě probudil pan Yunioši - volal dolů ze schodů."
"calling","call","volal","volat","impf"," One night, it was long past twelve, I woke up at the sound of Mr. Yunioshi calling down the stairs."," Jednou v noci, dávno po dvanácté, mě probudil pan Yunioši - volal dolů ze schodů."
"lived","live","Bydlel","bydlet","impf"," Since he lived on the top floor, his voice fell through the whole house, exasperated and stern."," Bydlel v nejvyšším patře, takže se jeho hlas rozlehl po celém domě, podrážděný a přísný :"
"made","make","udělal","udělat","pf"," But really, darling, you made such a tragedy out of your childhood I didn ’ t feel I should compete. ”"," Vždyť ty jsi, drahoušku, udělal ze svého dětství takovou tragédii, že jsem si netroufla konkurovat. """
"compete","compete","konkurovat","konkurovat","impf"," But really, darling, you made such a tragedy out of your childhood I didn ’ t feel I should compete. ”"," Vždyť ty jsi, drahoušku, udělal ze svého dětství takovou tragédii, že jsem si netroufla konkurovat. """
"reminds","remind","připomnělo","připomenout","pf"," “ Anyway, it reminds me : I ought to send Fred some peanut butter."," "" Ale tohle mi připomnělo, že bych měla Fredovi poslat burákovou pomazánku. """
"send","send","poslat","poslat","pf"," “ Anyway, it reminds me : I ought to send Fred some peanut butter."," "" Ale tohle mi připomnělo, že bych měla Fredovi poslat burákovou pomazánku. """
"nabbed","nab","zatkla","zatknout","pf"," At the same time, 2 P.M., police nabbed Oliver O ’ Shaughnessy, 52, of the Hotel Seabord, W. 49th St., as he exited from a Hamburg Heaven on Madison Ave."," Současně, ve 2 hod. odp., zatkla policie Olivera O ' Shaughnessyho, 52 letého, bytem v hotelu Seabord, Západní 43. ulice, když vycházel z Ráje karbanátků na Madison avenue."
"said","say","řekla","říci","pf"," “ But you haven ’ t any pulse, ” she said, feeling my wrist.",", Ale vůbec ti nejde tep! "" řekla, prst přitisknutý na mém zápěstí."
"Look","look","Podívej","podívat","pf"," Look at me. ”"," Podívej se na mě! """
"see","see","neviděl","vidět","impf"," The trouble was, I couldn ’ t see her;"," Jenže já jsem ji neviděl;"
"saw","see","viděl","vidět","impf"," rather, I saw several Hollys, a trio of sweaty faces so white with concern that I was both touched and embarrassed."," totiž viděl jsem několik Holly, trio zpocených obličejů, tak bledých a ustrašených, až mě to dojalo a přivedlo do rozpaků."
"touched","touch","dojalo","dojmout","pf"," rather, I saw several Hollys, a trio of sweaty faces so white with concern that I was both touched and embarrassed."," totiž viděl jsem několik Holly, trio zpocených obličejů, tak bledých a ustrašených, až mě to dojalo a přivedlo do rozpaků."
"loves","love","miluje","milovat","impf"," Doc really loves me, you know."," Vždyť doktor mě opravdu miluje."
"love","love","miluju","milovat","impf"," And I love him."," A já ho taky miluju."
"go","go","Jeďte","jet","impf"," Let ’ s go. ”"," "" Jeďte. """
"FLEEING","flee","uprchla","uprchnout","pf"," FLEEING PLAYGIRL TRACED TO RIO."," Playgirl uprchla : stopy vedou do Ria."
"say","say","povědět","povědět","pf"," With something smart to say on every subject : better than the radio."," O všem dovedla povědět něco chytrého : líp než v rádiu."
"taught","teach","naučil","naučit","pf"," I tamed her a crow and taught it to say her name."," Ochočil jsem jí vránu a naučil jsem ji říkat její jméno."
"say","say","říkat","říkat","impf"," I tamed her a crow and taught it to say her name."," Ochočil jsem jí vránu a naučil jsem ji říkat její jméno."
"showed","show","Ukázal","ukázat","pf"," I showed her how to play the guitar."," Ukázal jsem jí, jak se hraje na kytaru."
"play","play","hraje","hrát","impf"," I showed her how to play the guitar."," Ukázal jsem jí, jak se hraje na kytaru."
"look","look","podívat","podívat","pf"," Just to look at her made the tears spring to my eyes."," Stačilo mi jen se na ni podívat a hned mi vstoupily slzy do očí."
"cried","cry","plakal","plakat","impf"," The night I proposed, I cried like a baby."," Ten večer, co jsem ji požádal o ruku, plakal jsem jako dítě."
"cry","cry","pláčete","plakat","impf"," She said : “ What you want to cry for, Doc? ”"," Zeptala se mě :, Proč vlastně pláčete, doktůrku?"
"remembered","remember","pamatuju","pamatovat","impf"," I ’ ve always remembered Doc in my prayers."," Já na doktora vždycky pamatuju v modlitbách."
"seem","seem","zdálo","zdát","impf"," worse, when I did seem to have her interest, there was actually a telltale frost over her eyes, as if she were wondering whether to buy a pair of shoes she ’ d seen in some window."," a ke všemu, když se mi už zdálo, že jsem ji zaujal, vyzradily mi její ledově lhostejné oči, že možná myslí na to, má - li si koupit střevíce, které viděla někde ve výkladní skříni."
"buy","buy","koupit","koupit","pf"," worse, when I did seem to have her interest, there was actually a telltale frost over her eyes, as if she were wondering whether to buy a pair of shoes she ’ d seen in some window."," a ke všemu, když se mi už zdálo, že jsem ji zaujal, vyzradily mi její ledově lhostejné oči, že možná myslí na to, má - li si koupit střevíce, které viděla někde ve výkladní skříni."
"seen","see","viděla","vidět","impf"," worse, when I did seem to have her interest, there was actually a telltale frost over her eyes, as if she were wondering whether to buy a pair of shoes she ’ d seen in some window."," a ke všemu, když se mi už zdálo, že jsem ji zaujal, vyzradily mi její ledově lhostejné oči, že možná myslí na to, má - li si koupit střevíce, které viděla někde ve výkladní skříni."
"asked","ask","zeptala","zeptat","pf"," “ Is that the end? ” she asked, waking up."," "" A tohle je konec? "" zeptala se jako náhle probuzená."
"say","say","říct","říci","pf"," She floundered for something more to say."," Zřejmě v mysli tápala, co by ještě mohla říct."
"hand","hand","podej","podat","pf"," Oh, screw it, cookie - hand me my guitar and I ’ ll sing you a fada in the most perfect Portuguese. ”"," Ach, nechme toho zlatíčko - podej mi kytaru, zazpívám ti brazilskou fada nejdokonalejší portugalštinou. """
"sing","sing","zazpívám","zazpívat","pf"," Oh, screw it, cookie - hand me my guitar and I ’ ll sing you a fada in the most perfect Portuguese. ”"," Ach, nechme toho zlatíčko - podej mi kytaru, zazpívám ti brazilskou fada nejdokonalejší portugalštinou. """
"sit","sit","Sedí","sedět","impf"," They sit so quiet watching the river go by."," Sedí tam tak zticha a jen se dívají na řeku podle trati. """
"watching","watch","dívají","dívat","impf"," They sit so quiet watching the river go by."," Sedí tam tak zticha a jen se dívají na řeku podle trati. """
"keeping","keep","nenechám","nechat","pf"," “ I ’ m keeping you awake."," "" Jenže já tě nenechám usnout."
"sleep","sleep","Spi","spát","impf"," Go to sleep. ”"," Spi, prosím tě. """
"want","want","chci","chtít","impf"," That ’ s why I want you to go to sleep."," A proto chci, abys usnul."
"sleep","sleep","usnul","usnout","pf"," That ’ s why I want you to go to sleep."," A proto chci, abys usnul."
"tell","tell","povídat","povídat","impf"," Because if I keep on, I ’ ll tell you about Sally."," Protože jestli budu povídat dál, řekla bych ti třeba o Sallym."
"tell","tell","řekla","říci","pf"," Because if I keep on, I ’ ll tell you about Sally."," Protože jestli budu povídat dál, řekla bych ti třeba o Sallym."
"played","play","hrála","hrát","impf"," Also, she had a cat and she played the guitar."," Mimoto měla kocoura a hrála na kytaru."
"wash","wash","umyla","umýt","pf"," On days when the sun was strong, she would wash her hair, and together with the cat, a red tiger-striped tom, sit out on the fire escape thumbing a guitar while her hair dried."," Když slunce pálilo, umyla si vlasy a s kocourem rezavě žíhaným jako tygr sedávala na požárním žebříku a drnkala na kytaru, než jí vlasy uschly."
"heard","hear","slyšel","slyšet","impf"," Whenever I heard the music, I would go stand quietly by my window."," Jakmile jsem ji slyšel hrát, vždycky jsem si potichu stoupl k oknu."
"said","say","řekla","říci","pf"," “ But what about me? ” she said, whispered, and shivered again."," "" Ale co bude se mnou? "" řekla šeptem a znovu se roztřásla."
"go","go","jít","jít","impf"," Because it could go on forever."," Protože by to takhle mohlo jít věčně."
"thrown","throw","nezahodím","zahodit","pf"," Not knowing what ’ s yours until you ’ ve thrown it away."," Nevědět, co je moje, dokud to nezahodím."
"sat","sit","Posadil","posadit","pf"," I sat down on Holly ’ s bed, and hugged Holly ’ s cat to me, and felt as badly for Holly, every iota, as she could feel for herself."," Posadil jsem se na Hollyinu postel, kocoura jsem vzal do náručí a bylo mi Holly tak strašně líto, že by ani jí nemohlo být víc líto sebe."
"wanting","want","nechtělo","chtít","impf"," And I did : without the least wanting to."," A byl jsem, ačkoli se mi vůbec nechtělo."
"placing","place","zařadit","zařadit","pf"," Perhaps, like most of us in a foreign country, he was incapable of placing people, selecting a frame for their picture, as he would at home;"," Možná že si tak jako mnozí z nás v cizině nedovedl správně zařadit lidi a zvolit pro ně rámec, do něhož zapadají, jako to uměl doma;"
"selecting","select","zvolit","zvolit","pf"," Perhaps, like most of us in a foreign country, he was incapable of placing people, selecting a frame for their picture, as he would at home;"," Možná že si tak jako mnozí z nás v cizině nedovedl správně zařadit lidi a zvolit pro ně rámec, do něhož zapadají, jako to uměl doma;"
"explain","explain","vysvětlilo","vysvětlit","pf"," That would explain much; Holly ’ s determination explains the rest."," Tohle by vysvětlilo hodně - a ostatní vysvětlí Hollyino odhodlání."
"explains","explain","vysvětlilo","vysvětlit","pf"," That would explain much; Holly ’ s determination explains the rest."," Tohle by vysvětlilo hodně - a ostatní vysvětlí Hollyino odhodlání."
