"thinking","think","myslí","myslet","impf"," Even if you pretend not to have heard what it tells you, it will always be there inside you, repeating to you what you ’ re thinking about life and about the world. """," A i kdybys dělal, že neposloucháš, co ti říká, bude ti v prsou ustavičně opakovat, co si myslí o životě a o světě. """
"said","say","řekl","říci","pf"," "" Take these, "" said the old man, holding out a white stone and a black stone that had been embedded at the center of the breastplate."," "" Na, "" řekl stařec a zprostřed zlatého náprsníku vyndal jeden kamínek bílý a jeden černý a podával mu je."
"Take","take","vyndal","vyndat","pf"," "" Take these, "" said the old man, holding out a white stone and a black stone that had been embedded at the center of the breastplate."," "" Na, "" řekl stařec a zprostřed zlatého náprsníku vyndal jeden kamínek bílý a jeden černý a podával mu je."
"need","need","nemusí","muset","impf"," That was what made traveling appeal to him he always made new friends, and he didn ’ t need to spend all of his time with them."," Člověk pořád nachází nové přátele, a přitom s nimi nemusí být každý den."
"sees","see","vidíme","vidět","impf"," When someone sees the same people every day, as had happened with him at the seminary, they wind up becoming a part of that person ’ s life."," Když ale vidíme stále stejné lidi - jako třeba v semináři -, stanou se nakonec součástí našeho života."
"want","want","chtějí","chtít","impf"," And then they want the person to change."," A jen co k tomu dojde, chtějí nám do toho života také mluvit."
"asked","ask","zeptal","zeptat","pf"," "" What is it you ’ re looking for? "" asked the old merchant."," "" O co ti vlastně jde? "" zeptal se starý Sklenář."
"told","tell","říkal","říkat","impf"," "" I ’ ve already told you."," "" Už jsem vám to říkal."
"told","tell","povídal","povídat","impf"," The shepherd told her of the Andalusian countryside, and related the news from the other towns where he had stopped."," On zas jí povídal o andaluské krajině a o tom, co nového viděl ve městech, kde byl naposled."
"talking","talk","rozmlouvat","rozmlouvat","impf"," It was a pleasant change from talking to his sheep."," Těšilo ho, že může rozmlouvat s někým jiným než s ovcemi."
"learn","learn","naučil","naučit","pf"," "" How did you learn to read? "" the girl asked at one point."," "" Kde ses vlastně naučil číst? "" zeptala se ho v jednu chvíli dívka."
"read","read","číst","číst","impf"," "" How did you learn to read? "" the girl asked at one point."," "" Kde ses vlastně naučil číst? "" zeptala se ho v jednu chvíli dívka."
"asked","ask","zeptala","zeptat","pf"," "" How did you learn to read? "" the girl asked at one point."," "" Kde ses vlastně naučil číst? "" zeptala se ho v jednu chvíli dívka."
"vanished","vanish","zmizela","zmizet","pf"," The vision vanished immediately, but it had shaken him."," Vidina ihned zmizela, ale vylekala ho."
"heard","hear","Slyšel","slyšet","impf"," He had heard people speak of mirages, and had already seen some himself : they were desires that, because of their intensity, materialized over the sands of the desert."," Slyšel vyprávět o přeludech a sám už nějaké viděl : jsou to přání, která se zhmotní na písku pouště."
"seen","see","viděl","vidět","impf"," He had heard people speak of mirages, and had already seen some himself : they were desires that, because of their intensity, materialized over the sands of the desert."," Slyšel vyprávět o přeludech a sám už nějaké viděl : jsou to přání, která se zhmotní na písku pouště."
"invade","invade","napadlo","napadnout","pf"," But he certainly didn ’ t desire that an army invade the oasis."," On ale si přece nepřeje, aby nějaké vojsko napadlo oázu."
"walked","walk","kráčeli","kráčet","impf"," He was able to do so only after they had walked through the center of the camp."," Promluvil až za nějakou chvíli, když už kráčeli táborem."
"gave","give","Dal","dát","pf"," "" You gave them everything I had! "" the boy said."," "" Dal jste jim celý můj poklad! "" řekl chlapec."
"said","say","řekl","říci","pf"," "" You gave them everything I had! "" the boy said."," "" Dal jste jim celý můj poklad! "" řekl chlapec."
"keeping","keep","pokračoval","pokračovat","impf"," "" And this is for me, "" said the alchemist, keeping one of the parts."," "" Tahle část je pro mě, "" pokračoval Alchymista a schoval si ji."
"took","take","vzal","vzít","pf"," He took the fourth part and handed it to the monk."," Pak vzal čtvrtý díl a ten opět podal mnichovi."
"handed","hand","podal","podat","pf"," He took the fourth part and handed it to the monk."," Pak vzal čtvrtý díl a ten opět podal mnichovi."
"needs","need","potřeboval","potřebovat","impf"," If he ever needs it. """," Pro případ, že by to potřeboval. """
"told","tell","Vyprávělo","vyprávět","impf"," It told of destiny, and of the many men who had wandered in search of distant lands or beautiful women, confronting the people of their times with their preconceived notions."," Vyprávělo o Osobním příběhu a o mnoha mužích, kteří učinili totéž a vydali se hledat daleké země nebo krásné ženy a čelili lidem své doby s jejich názory a předsudky."
"confronting","confront","čelili","čelit","impf"," It told of destiny, and of the many men who had wandered in search of distant lands or beautiful women, confronting the people of their times with their preconceived notions."," Vyprávělo o Osobním příběhu a o mnoha mužích, kteří učinili totéž a vydali se hledat daleké země nebo krásné ženy a čelili lidem své doby s jejich názory a předsudky."
"spoke","speak","mluvilo","mluvit","impf"," It spoke of journeys, discoveries, books, and change."," Ustavičně mluvilo o cestách, objevech, knihách a velkých změnách."
"climbed","climb","stoupal","stoupat","impf"," The boy climbed the dune slowly."," Santiago pomalu stoupal vzhůru."
"said","say","řekla","říci","pf"," "" The desert takes our men from us, and they don ’ t always return, "" she said."," "" Poušť nám odvádí naše muže a ne vždy je přivádí zpátky, "" řekla."
"hide","hide","ukrývají","ukrývat","impf"," Those who don ’ t return become a part of the clouds, a part of the animals that hide in the ravines and of the water that comes from the earth."," Oni pak dál existují v oblacích, z nichž neprší, ve zvířatech, ukrývají se mezi kameny, ve vodě, která štědře prýští ze země."
"listening","listen","Poslouchaje","poslouchat","impf"," The wind was listening closely, and wanted to tell every corner of the world that the sun ’ s wisdom had its limitations."," Poslouchaje vítr, a ten po celém světě roznese, že jeho moudrost je omezená."
"spoke","speak","mluví","mluvit","impf"," That it was unable to deal with this boy who spoke the Language of the World."," Není však možné tohohle chlapce, který mluví Řečí světa, nějak odbýt."
"wrote","write","napsala","napsat","pf"," "" Speak to the hand that wrote all, "" said the sun."," "" Promluv si s Rukou, která všechno napsala, "" rozhodlo Slunce."
"said","say","řekla","říci","pf"," "" The tribesmen are always in search of treasure, "" the girl said, as if she had guessed what he was thinking."," "" Bojovníci hledají své poklady, "" řekla dívka, jako by mu četla myšlenky."
"left","leave","odešla","odejít","pf"," She refilled her vessel and left."," Pak si znovu nabrala do džbánu vodu a odešla."
"said","say","řekl","říci","pf"," "" I ’ m the king of Salem, "" the old man had said."," "" Já jsem v Sálemě Král, "" řekl mu předtím stařec."
"asked","ask","zeptal","zeptat","pf"," "" Why would a king be talking with a shepherd? "" the boy asked, awed and embarrassed."," "" Jak to, že si král povídá s pastýřem, "" zeptal se zahanbený a ohromený Santiago."
"seen","see","viděni","vidět","impf"," "" You were seen at the enemy camp three days ago."," "" Před třemi dny jste byli viděni v nepřátelském táboře."
"talking","talk","mluvili","mluvit","impf"," And you were talking with one of the troops there. """," A mluvili jste s jedním z jejich bojovníků. """
"wanders","wander","putuje","putovat","impf"," "" I ’ m just a man who wanders the desert and knows the stars, "" said the alchemist."," "" Jsem člověk, který putuje pouští a zná hvězdy, "" řekl Alchymista."
"said","say","řekl","říci","pf"," "" I ’ m just a man who wanders the desert and knows the stars, "" said the alchemist."," "" Jsem člověk, který putuje pouští a zná hvězdy, "" řekl Alchymista."
"asked","ask","zeptal","zeptat","pf"," "" Who is your friend? "" the chief asked."," "" Kdo je tvůj přítel? "" zeptal se velitel."
"said","say","odpověděl","odpovědět","pf"," "" An alchemist, "" said the alchemist."," "" Alchymista, "" odpověděl Alchymista."
"awaits","await","čeká","čekat","impf"," "" Everyone on earth has a treasure that awaits him, "" his heart said."," - Každý člověk na Zemi má poklad, který na něj čeká, - řeklo mu srdce."
"said","say","řeklo","říci","pf"," "" Everyone on earth has a treasure that awaits him, "" his heart said."," - Každý člověk na Zemi má poklad, který na něj čeká, - řeklo mu srdce."
"say","say","nemluvíme","mluvit","impf"," "" We, people ’ s hearts, seldom say much about those treasures, because people no longer want to go in search of them."," - My o těch pokladech ani moc nemluvíme, protože lidé už je netouží najít."
"want","want","netouží","toužit","impf"," "" We, people ’ s hearts, seldom say much about those treasures, because people no longer want to go in search of them."," - My o těch pokladech ani moc nemluvíme, protože lidé už je netouží najít."
"speak","speak","Říkáme","říkat","impf"," We speak of them only to children."," Říkáme o nich jenom dětem."
"let","let","necháme","nechat","pf"," Later, we simply let life proceed, in its own direction, toward its own fate."," Pak už necháme na životě, aby vedl každého k jeho osudu."
"pay","pay","zaplatil","zaplatit","pf"," He got up to pay the bill, but the owner grabbed him and began to speak to him in an angry stream of words."," Vstal, aby zaplatil, ale hospodský ho popadl a začal něco drmolit."
"grabbed","grab","popadl","popadnout","pf"," He got up to pay the bill, but the owner grabbed him and began to speak to him in an angry stream of words."," Vstal, aby zaplatil, ale hospodský ho popadl a začal něco drmolit."
"began","begin","začal","začít","pf"," He got up to pay the bill, but the owner grabbed him and began to speak to him in an angry stream of words."," Vstal, aby zaplatil, ale hospodský ho popadl a začal něco drmolit."
"pushed","push","odstrčil","odstrčit","pf"," His new friend pushed the owner aside, and pulled the boy outside with him."," Jeho nový přítel však hospodského odstrčil a vytáhl Santiaga ven."
"pulled","pull","vytáhl","vytáhnout","pf"," His new friend pushed the owner aside, and pulled the boy outside with him."," Jeho nový přítel však hospodského odstrčil a vytáhl Santiaga ven."
"wanted","want","Chtěl","chtít","impf"," "" He wanted your money, "" he said."," "" Chtěl tvoje peníze, "" řekl."
"said","say","řekl","říci","pf"," "" He wanted your money, "" he said."," "" Chtěl tvoje peníze, "" řekl."
"trusted","trust","důvěřovat","důvěřovat","impf"," The boy trusted his new friend."," Může tedy svému novému příteli důvěřovat."
"opened","open","začali","začít","pf"," Other shops were opened that served tea in crystal, but they weren ’ t at the top of a hill, and they had little business."," I jiní obchodníci začali prodávat čaj ve sklenicích, ale protože nesídlili na kopci, byl jejich krám pořád prázdný."
"began","begin","začal","začít","pf"," He began to import enormous quantities of tea, along with his crystal, and his shop was sought out by men and women with a thirst for things new."," Kromě skla začal dovážet ohromné spousty čaje, který pak denně popíjeli muži i ženy žádostiví novinek."
"import","import","dovážet","dovážet","impf"," He began to import enormous quantities of tea, along with his crystal, and his shop was sought out by men and women with a thirst for things new."," Kromě skla začal dovážet ohromné spousty čaje, který pak denně popíjeli muži i ženy žádostiví novinek."
"awoke","awake","probudil","probudit","pf"," The boy awoke before dawn."," Santiago se probudil ještě před úsvitem."
"learned","learn","poznal","poznat","pf"," "" I learned the alchemist ’ s secrets in my travels."," "" Zatímco jsem s tebou bloudil po světě, poznal jsem tajemství Alchymie."
"created","create","stvořeno","stvořit","pf"," I have inside me the winds, the deserts, the oceans, the stars, and everything created in the universe."," Mám v sobě větry, pouště, oceány, hvězdy a všecko, co bylo ve Vesmíru stvořeno."
"made","make","Učinila","učinit","pf"," We were all made by the same hand, and we have the same soul."," Učinila nás táž Ruka a máme touž Duši."
"want","want","Chci","chtít","impf"," I want to be like you, able to reach every corner of the world, cross the seas, blow away the sands that cover my treasure, and carry the voice of the woman I love. """," Chci být jako ty, všude proniknout, křižovat moře, odvát písek, který zakrývá můj poklad, přinést si hlas své milé. """
"reach","reach","proniknout","proniknout","pf"," I want to be like you, able to reach every corner of the world, cross the seas, blow away the sands that cover my treasure, and carry the voice of the woman I love. """," Chci být jako ty, všude proniknout, křižovat moře, odvát písek, který zakrývá můj poklad, přinést si hlas své milé. """
"carry","carry","přinést","přinést","pf"," I want to be like you, able to reach every corner of the world, cross the seas, blow away the sands that cover my treasure, and carry the voice of the woman I love. """," Chci být jako ty, všude proniknout, křižovat moře, odvát písek, který zakrývá můj poklad, přinést si hlas své milé. """
"die","die","umřít","umřít","pf"," "" Well, what good would it be to you if you had to die? "" the alchemist answered."," "" A co by ti to bylo platné, kdybys musel umřít? "" odpověděl Alchymista."
"answered","answer","odpověděl","odpovědět","pf"," "" Well, what good would it be to you if you had to die? "" the alchemist answered."," "" A co by ti to bylo platné, kdybys musel umřít? "" odpověděl Alchymista."
"saved","save","zachránily","zachránit","pf"," "" Your money saved us for three days."," "" Tvé peníze tě zachránily na tři dny."
"listen","listen","poslouchat","poslouchat","impf"," But the boy was too frightened to listen to words of wisdom."," Chlapec byl však příliš vyděšený, než aby mohl poslouchat moudrá slova."
"transform","transform","proměnit","proměnit","pf"," He had no idea how he was going to transform himself into the wind."," Nevěděl, jak se proměnit ve vítr."
"asked","ask","požádal","požádat","pf"," The alchemist asked one of the soldiers for some tea, and poured some on the boy ’ s wrists."," Alchymista požádal jednoho bojovníka o čaj a dal trochu Santiagovi na zápěstí."
"told","tell","pověděly","povědět","pf"," But the stones had told him that the old man was still with him, and that made him feel more confident."," Kamínky urim a thumim mu však pověděly, že stařec při něm pořád stojí, a to mu dodalo sebedůvěry."
"feeling","feel","necítil","cítit","impf"," He looked around at the empty plaza again, feeling less desperate than before."," Znova se rozhlédl po prázdném tržišti a už se necítil tak zoufalý."
"wanted","want","chtěl","chtít","impf"," After all, what he had always wanted was just that : to know new places."," A to je vlastně přesně to, co odjakživa chtěl : poznat nové světy."
"return","return","vrátit","vrátit","pf"," He was no longer a shepherd, and he had nothing, not even the money to return and start everything over."," Už není pastýř a nic nemá, ba ani peníze, aby se mohl vrátit a začít znova."
"start","start","začít","začít","pf"," He was no longer a shepherd, and he had nothing, not even the money to return and start everything over."," Už není pastýř a nic nemá, ba ani peníze, aby se mohl vrátit a začít znova."
"thought","think","pomyslel","pomyslet","pf"," All this happened between sunrise and sunset, the boy thought."," - A to všecko od východu do západu téhož slunce, - pomyslel si."
"lamenting","lament","litoval","litovat","impf"," He was feeling sorry for himself, and lamenting the fact that his life could have changed so suddenly and so drastically."," A litoval sám sebe, protože někdy se celý život změní v tak kratičké chvíli, že si člověk nestačí zvyknout."
"changed","change","změní","změnit","pf"," He was feeling sorry for himself, and lamenting the fact that his life could have changed so suddenly and so drastically."," A litoval sám sebe, protože někdy se celý život změní v tak kratičké chvíli, že si člověk nestačí zvyknout."
"cry","cry","plakat","plakat","impf"," He was so ashamed that he wanted to cry."," Styděl se plakat."
"wept","weep","neplakal","plakat","impf"," He had never even wept in front of his own sheep."," Před svými ovcemi neplakal nikdy."
"said","say","řekl","říci","pf"," "" There ’ s life here, "" the boy said to the alchemist."," "" Tady je život, "" řekl Santiago Alchymistovi."
"stopped","stop","zůstal","zůstat","pf"," The alchemist stopped abruptly, and bent to the ground."," Náhle zůstal stát a opatrně se sehnul."
"said","say","řekl","říci","pf"," "" I am proud of you, "" he said."," "" Jsem na tebe pyšný, "" řekl."
"going","go","nepůjdeš","jít","impf"," Just as you know that you ’ re not going to buy your sheep. """," Stejně jako víš, že nepůjdeš zpátky koupit si ovce. """
"buy","buy","koupit","koupit","pf"," Just as you know that you ’ re not going to buy your sheep. """," Stejně jako víš, že nepůjdeš zpátky koupit si ovce. """
"startled","startle","polekal","polekat","pf"," "" Who told you that? "" asked the boy, startled."," "" Jak to víte? "" polekal se Santiago."
"said","say","řekl","říci","pf"," "" Maktub "" said the old crystal merchant."," "" Maktub, "" řekl prostě Sklenář."
"remove","remove","zbaví","zbavit","pf"," As soon as the wind stopped, he was going to remove them from their commands, because true men of the desert are not afraid."," Jakmile vítr utichne, zbaví je velení, protože mužové z pouště strach necítí."
"told","tell","pověděl","povědět","pf"," "" The wind told me that you know about love "" the boy said to the sun."," "" Vítr mi pověděl, že znáš Lásku, "" řekl chlapec Slunci."
"said","say","pověděl","povědět","pf"," "" The wind told me that you know about love "" the boy said to the sun."," "" Vítr mi pověděl, že znáš Lásku, "" řekl chlapec Slunci."
"told","tell","řekl","říci","pf"," "" The wind told me that you know about love "" the boy said to the sun."," "" Vítr mi pověděl, že znáš Lásku, "" řekl chlapec Slunci."
"said","say","řekl","říci","pf"," "" The wind told me that you know about love "" the boy said to the sun."," "" Vítr mi pověděl, že znáš Lásku, "" řekl chlapec Slunci."
"made","make","učiněna","učinit","pf"," "" If you know about love, you must also know about the Soul of the World, because it ’ s made of love. """," "" Jestliže znáš Lásku, znáš také Duši světa, která je učiněna z Lásky. """
"said","say","pravilo","pravit","pf"," "" From where I am, "" the sun said, "" I can see the Soul of the World."," "" Z místa, kde jsem, "" pravilo Slunce, "" mohu vidět Duši světa."
"see","see","vidět","vidět","impf"," "" From where I am, "" the sun said, "" I can see the Soul of the World."," "" Z místa, kde jsem, "" pravilo Slunce, "" mohu vidět Duši světa."
"told","tell","pověděl","povědět","pf"," He told her about the morning ’ s meeting."," Santiago se odpoledne znovu sešel s Fátimou a pověděl jí o shromáždění."
"met","meet","setkali","setkat","pf"," "" The day after we met, "" Fatima said, "" you told me that you loved me."," "" Když jsme se setkali podruhé, "" řekla Fátima, "" pověděl jsi mi o své lásce."
"said","say","řekla","říci","pf"," "" The day after we met, "" Fatima said, "" you told me that you loved me."," "" Když jsme se setkali podruhé, "" řekla Fátima, "" pověděl jsi mi o své lásce."
"told","tell","řekla","říci","pf"," "" The day after we met, "" Fatima said, "" you told me that you loved me."," "" Když jsme se setkali podruhé, "" řekla Fátima, "" pověděl jsi mi o své lásce."
"said","say","pověděl","povědět","pf"," "" The day after we met, "" Fatima said, "" you told me that you loved me."," "" Když jsme se setkali podruhé, "" řekla Fátima, "" pověděl jsi mi o své lásce."
"told","tell","pověděl","povědět","pf"," "" The day after we met, "" Fatima said, "" you told me that you loved me."," "" Když jsme se setkali podruhé, "" řekla Fátima, "" pověděl jsi mi o své lásce."
"thinking","think","měl","mít","impf"," But many times you ’ ll walk the sands of the desert, thinking that maybe you could have left... that you could have trusted more in your love for Fatima."," Ale mnoho nocí prochodíš po písku pouště a mezi datlovníky a budeš říkat, žes možná měl jít dál, víc věřit své lásce k Fátimě."
"walk","walk","jít","jít","impf"," But many times you ’ ll walk the sands of the desert, thinking that maybe you could have left... that you could have trusted more in your love for Fatima."," Ale mnoho nocí prochodíš po písku pouště a mezi datlovníky a budeš říkat, žes možná měl jít dál, víc věřit své lásce k Fátimě."
"thinking","think","věřit","věřit","impf"," But many times you ’ ll walk the sands of the desert, thinking that maybe you could have left... that you could have trusted more in your love for Fatima."," Ale mnoho nocí prochodíš po písku pouště a mezi datlovníky a budeš říkat, žes možná měl jít dál, víc věřit své lásce k Fátimě."
"trusted","trust","věřit","věřit","impf"," But many times you ’ ll walk the sands of the desert, thinking that maybe you could have left... that you could have trusted more in your love for Fatima."," Ale mnoho nocí prochodíš po písku pouště a mezi datlovníky a budeš říkat, žes možná měl jít dál, víc věřit své lásce k Fátimě."
"kept","keep","zdrželo","zdržet","pf"," Because what kept you at the oasis was your own fear that you might never come back."," Protože to, co tě zdrželo v oáze, byl tvůj vlastní strach, že by ses už nevrátil."
"buried","bury","pohřben","pohřbít","pf"," At that point, the omens will tell you that your treasure is buried forever."," V té době ti znamení ukážou, že tvůj poklad je pohřben navždy."
"abandon","abandon","opustí","opustit","pf"," "" Then, sometime during the fourth year, the omens will abandon you, because you ’ ve stopped listening to them."," Čtvrtý rok tě znamení opustí, protože jsi je nechtěl poslechnout."
"listening","listen","poslechnout","poslechnout","pf"," "" Then, sometime during the fourth year, the omens will abandon you, because you ’ ve stopped listening to them."," Čtvrtý rok tě znamení opustí, protože jsi je nechtěl poslechnout."
"working","work","pracuje","pracovat","impf"," We are part of that soul, so we rarely recognize that it is working for us."," Jsme součástí této Duše a málokdy si uvědomujeme, že ona vždy pracuje v náš prospěch."
"prepares","prepare","Připravují","připravovat","impf"," It prepares your spirit and your will, because there is one great truth on this planet : whoever you are, or whatever it is that you do, when you really want something, it ’ s because that desire originated in the soul of the universe."," Připravují tvého ducha a tvou vůli, protože na této planetě platí jedna veliká pravda : ať jsi kdokoli a děláš cokoli, když něco doopravdy chceš, je to proto, že se toto přání zrodilo v duši Vesmíru."
"do","do","děláš","dělat","impf"," It prepares your spirit and your will, because there is one great truth on this planet : whoever you are, or whatever it is that you do, when you really want something, it ’ s because that desire originated in the soul of the universe."," Připravují tvého ducha a tvou vůli, protože na této planetě platí jedna veliká pravda : ať jsi kdokoli a děláš cokoli, když něco doopravdy chceš, je to proto, že se toto přání zrodilo v duši Vesmíru."
"want","want","chceš","chtít","impf"," It prepares your spirit and your will, because there is one great truth on this planet : whoever you are, or whatever it is that you do, when you really want something, it ’ s because that desire originated in the soul of the universe."," Připravují tvého ducha a tvou vůli, protože na této planetě platí jedna veliká pravda : ať jsi kdokoli a děláš cokoli, když něco doopravdy chceš, je to proto, že se toto přání zrodilo v duši Vesmíru."
"travel","travel","chodit","chodit","impf"," "" Even when all you want to do is travel?"," "" I kdyby to třeba bylo jen chodit po světě?"
