"find","find","najdeš","najít","pf"," "" But I want one-tenth of the treasure, if you find it. """," "" Ale jestli ten poklad najdeš, chci z něj desátek. """
"want","want","chci","chtít","impf"," "" But I want one-tenth of the treasure, if you find it. """," "" Ale jestli ten poklad najdeš, chci z něj desátek. """
"save","save","ušetří","ušetřit","pf"," He was going to be able to save the little money he had because of a dream about hidden treasure!"," Kvůli snu o zakopaném pokladu ušetří i to málo, co má!"
"swear","swear","přísahej","přísahat","impf"," "" First, swear to me."," "" Napřed přísahej."
"Swear","swear","Přísahej","přísahat","impf"," Swear that you will give me one-tenth of your treasure in exchange for what I am going to tell you. """," Přísahej, že za to, co ti povím, mi dáš desetinu svého pokladu. """
"tell","tell","povím","povědět","pf"," Swear that you will give me one-tenth of your treasure in exchange for what I am going to tell you. """," Přísahej, že za to, co ti povím, mi dáš desetinu svého pokladu. """
"give","give","dáš","dát","pf"," Swear that you will give me one-tenth of your treasure in exchange for what I am going to tell you. """," Přísahej, že za to, co ti povím, mi dáš desetinu svého pokladu. """
"swore","swear","přísahal","přísahat","impf"," The shepherd swore that he would."," Chlapec přísahal."
"wanted","want","Chtěl","chtít","impf"," He wanted to forget about the vision, and return to his meditation."," Chtěl na to zapomenout a vrátit se ke svému rozjímání."
"forget","forget","zapomenout","zapomenout","pf"," He wanted to forget about the vision, and return to his meditation."," Chtěl na to zapomenout a vrátit se ke svému rozjímání."
"return","return","vrátit","vrátit","pf"," He wanted to forget about the vision, and return to his meditation."," Chtěl na to zapomenout a vrátit se ke svému rozjímání."
"tried","try","Snažil","snažit","impf"," He tried again to concentrate on the pink shades of the desert, and its stones."," Snažil se znovu soustředit na růžovou poušť a na kamení."
"concentrate","concentrate","soustředit","soustředit","pf"," He tried again to concentrate on the pink shades of the desert, and its stones."," Snažil se znovu soustředit na růžovou poušť a na kamení."
"said","say","řekl","říci","pf"," "" Always heed the omens, "" the old king had said."," "" Neustále sleduj znamení, "" řekl mu starý král."
"recalled","recall","Vzpomněl","vzpomenout","pf"," The boy recalled what he had seen in the vision, and sensed that it was actually going to occur."," Vzpomněl si na to, co viděl, a tušil, že k tomu má brzy dojít."
"seen","see","viděl","vidět","impf"," The boy recalled what he had seen in the vision, and sensed that it was actually going to occur."," Vzpomněl si na to, co viděl, a tušil, že k tomu má brzy dojít."
"sensed","sense","tušil","tušit","impf"," The boy recalled what he had seen in the vision, and sensed that it was actually going to occur."," Vzpomněl si na to, co viděl, a tušil, že k tomu má brzy dojít."
"occur","occur","dojít","dojít","pf"," The boy recalled what he had seen in the vision, and sensed that it was actually going to occur."," Vzpomněl si na to, co viděl, a tušil, že k tomu má brzy dojít."
"rose","rise","Vstal","vstát","pf"," He rose, and made his way back toward the palm trees."," Vstal a pustil se směrem k datlovníkům."
"called","call","Říká","říkat","impf"," "" It ’ s called the principle of favorability."," "" Říká se tomu Příznivý začátek."
"win","win","vyhrál","vyhrát","pf"," When you play cards the first time, you are almost sure to win."," Napoprvé bys v kartách skoro určitě vyhrál."
"wants","want","chce","chtít","impf"," "" Because there is a force that wants you to realize your destiny;"," "" Protože život chce, abys prožil svůj Osobní příběh. """
"began","begin","začal","začít","pf"," Then the old man began to inspect the sheep, and he saw that one was lame."," Pak si stařec začal prohlížet těch šest ovcí a zjistil, že jedna kulhá."
"inspect","inspect","prohlížet","prohlížet","impf"," Then the old man began to inspect the sheep, and he saw that one was lame."," Pak si stařec začal prohlížet těch šest ovcí a zjistil, že jedna kulhá."
"mounted","mount","Nasedli","nasednout","pf"," They mounted their horses."," Nasedli na koně."
"want","want","Chci","chtít","impf"," "" I want to tell you a story about dreams, "" said the alchemist."," "" Chci ti povědět příběh o snech, "" řekl Alchymista."
"tell","tell","povědět","povědět","pf"," "" I want to tell you a story about dreams, "" said the alchemist."," "" Chci ti povědět příběh o snech, "" řekl Alchymista."
"said","say","povědět","povědět","pf"," "" I want to tell you a story about dreams, "" said the alchemist."," "" Chci ti povědět příběh o snech, "" řekl Alchymista."
"tell","tell","řekl","říci","pf"," "" I want to tell you a story about dreams, "" said the alchemist."," "" Chci ti povědět příběh o snech, "" řekl Alchymista."
"said","say","řekl","říci","pf"," "" I want to tell you a story about dreams, "" said the alchemist."," "" Chci ti povědět příběh o snech, "" řekl Alchymista."
"show","show","ukázat","ukázat","pf"," And, just as she was about to show me the exact location, I woke up."," A jakmile mi chtělo ukázat přesné místo, tak jsem se probudil."
"woke","wake","probudil","probudit","pf"," And, just as she was about to show me the exact location, I woke up."," A jakmile mi chtělo ukázat přesné místo, tak jsem se probudil."
"took","take","vzala","vzít","pf"," Then she again took his hands and studied them carefully."," Pak vzala pastýře za ruce a pozorně je prohlížela."
"said","say","řekla","říci","pf"," "" I ’ m not going to charge you anything now, "" she said."," "" Teď od tebe nic chtít nebudu, "" řekla."
"said","say","řekl","říci","pf"," One of them, a cobbler who made his living mending boots, said that he had traveled for almost a year through the desert, but that he got more tired when he had to walk through the streets of Tangier buying his leather. """," Jeden z nich, švec, který se živil tím, že spravoval cizí boty, mi řekl, že skoro rok putoval pouští, ale mnohem unavenější prý býval, když musel v Tangeru obejít pár bloků, aby nakoupil kůži. """
"buying","buy","nakoupil","nakoupit","pf"," One of them, a cobbler who made his living mending boots, said that he had traveled for almost a year through the desert, but that he got more tired when he had to walk through the streets of Tangier buying his leather. """," Jeden z nich, švec, který se živil tím, že spravoval cizí boty, mi řekl, že skoro rok putoval pouští, ale mnohem unavenější prý býval, když musel v Tangeru obejít pár bloků, aby nakoupil kůži. """
"thought","think","uvažoval","uvažovat","impf"," I don ’ t know why these things have to be transmitted by word of mouth, he thought."," - Nevím, proč tyhle věci musejí být sdělovány ústně, - uvažoval."
"made","make","učiněny","učinit","pf"," He had only one explanation for this fact : things have to be transmitted this way because they were made up from the pure life, and this kind of life cannot be captured in pictures or words."," Měl pro tuto skutečnost jediné vysvětlení : snad je třeba sdělovat je tak proto, že jsou učiněny z ryzího Života, a ten lze těžko zachytit obrazem nebo slovy."
"captured","capture","zachytit","zachytit","pf"," He had only one explanation for this fact : things have to be transmitted this way because they were made up from the pure life, and this kind of life cannot be captured in pictures or words."," Měl pro tuto skutečnost jediné vysvětlení : snad je třeba sdělovat je tak proto, že jsou učiněny z ryzího Života, a ten lze těžko zachytit obrazem nebo slovy."
"forgetting","forget","zapomenou","zapomenout","pf"," Because people become fascinated with pictures and words, and wind up forgetting the Language of the World."," Lidé se totiž obrazy a slovy nadchnou a nakonec zapomenou na Řeč světa."
"remembered","remember","Vzpomněl","vzpomenout","pf"," He remembered that he had a number of things he had to take care of : he went to the market for something to eat, he traded his book for one that was thicker, and he found a bench in the plaza where he could sample the new wine he had bought."," Vzpomněl si, že musí ještě něco vyřídit : zašel si do krámu obstarat nějaké jídlo, knížku vyměnit za tlustší, a pak si sedl na náměstí na lavičku, aby ochutnal víno, které si koupil."
"found","find","obstarat","obstarat","pf"," He remembered that he had a number of things he had to take care of : he went to the market for something to eat, he traded his book for one that was thicker, and he found a bench in the plaza where he could sample the new wine he had bought."," Vzpomněl si, že musí ještě něco vyřídit : zašel si do krámu obstarat nějaké jídlo, knížku vyměnit za tlustší, a pak si sedl na náměstí na lavičku, aby ochutnal víno, které si koupil."
"traded","trade","vyměnit","vyměnit","pf"," He remembered that he had a number of things he had to take care of : he went to the market for something to eat, he traded his book for one that was thicker, and he found a bench in the plaza where he could sample the new wine he had bought."," Vzpomněl si, že musí ještě něco vyřídit : zašel si do krámu obstarat nějaké jídlo, knížku vyměnit za tlustší, a pak si sedl na náměstí na lavičku, aby ochutnal víno, které si koupil."
"sample","sample","ochutnal","ochutnat","pf"," He remembered that he had a number of things he had to take care of : he went to the market for something to eat, he traded his book for one that was thicker, and he found a bench in the plaza where he could sample the new wine he had bought."," Vzpomněl si, že musí ještě něco vyřídit : zašel si do krámu obstarat nějaké jídlo, knížku vyměnit za tlustší, a pak si sedl na náměstí na lavičku, aby ochutnal víno, které si koupil."
"bought","buy","koupil","koupit","pf"," He remembered that he had a number of things he had to take care of : he went to the market for something to eat, he traded his book for one that was thicker, and he found a bench in the plaza where he could sample the new wine he had bought."," Vzpomněl si, že musí ještě něco vyřídit : zašel si do krámu obstarat nějaké jídlo, knížku vyměnit za tlustší, a pak si sedl na náměstí na lavičku, aby ochutnal víno, které si koupil."
"find","find","objevil","objevit","pf"," You ’ ve got to find the treasure, so that everything you have learned along the way can make sense."," A že tvůj poklad musí být nalezen, aby všechno to, co jsi cestou objevil, mohlo mít smysl."
"buy","buy","kup","koupit","pf"," "" Tomorrow, sell your camel and buy a horse."," Zítra prodej velblouda a kup si koně."
"said","say","řekla","říci","pf"," "" The falcon ’ s beak carries bits of me, myself, "" the desert said."," "" Sokolí zobák si ze mě pořád něco bere, "" řekla poušť."
"care","care","starám","starat","impf"," "" For years, I care for his game, feeding it with the little water that I have, and then I show him where the game is."," "" Po celé roky se starám o jeho lovnou zvěř, napájím ji tou trochou vody, co mám, ukazuji, kde je potrava."
"feeding","feed","napájím","napájet","impf"," "" For years, I care for his game, feeding it with the little water that I have, and then I show him where the game is."," "" Po celé roky se starám o jeho lovnou zvěř, napájím ji tou trochou vody, co mám, ukazuji, kde je potrava."
"show","show","ukazuji","ukazovat","impf"," "" For years, I care for his game, feeding it with the little water that I have, and then I show him where the game is."," "" Po celé roky se starám o jeho lovnou zvěř, napájím ji tou trochou vody, co mám, ukazuji, kde je potrava."
"said","say","řekl","říci","pf"," "" That ’ s right, "" said the old man, able to read the boy ’ s thoughts."," "" Správně, "" řekl stařec, který mu četl myšlenky."
"read","read","četl","číst","impf"," "" That ’ s right, "" said the old man, able to read the boy ’ s thoughts."," "" Správně, "" řekl stařec, který mu četl myšlenky."
"said","say","říká","říkat","impf"," "" That ’ s a good luck omen, "" the Englishman said, after the fat Arab had gone out."," "" On říká znamením "" štěstí ', "" podotkl Angličan, jakmile Arab odešel."
"gone","go","odešel","odejít","pf"," "" That ’ s a good luck omen, "" the Englishman said, after the fat Arab had gone out."," "" On říká znamením "" štěstí ', "" podotkl Angličan, jakmile Arab odešel."
"write","write","napsal","napsat","pf"," "" If I could, I ’ d write a huge encyclopedia just about the words luck and coincidence."," "" Kdybych mohl, napsal bych o slovech, štěstí ' a, náhoda ' velikou encyklopedii."
"written","write","píše","psát","impf"," It ’ s with those words that the universal language is written. """," Těmito slovy se píše Univerzální řeč. """
"met","meet","potkal","potkat","pf"," He told the boy it was no coincidence that he had met him with Urim and Thummim in his hand."," A není žádná náhoda, že tu Santiaga potkal s kamínky urim a thumim, dodal."
"asked","ask","zeptal","zeptat","pf"," And he asked the boy if he, too, were in search of the alchemist."," Ještě se ho zeptal, jestli také hledá alchymistu."
"read","read","číst","číst","impf"," "" Who dares to read the meaning of the flight of the hawks? "" he demanded, so loudly that his words seemed to echo through the fifty thousand palm trees of Al-Fayoum."," "" Kdo se to opovážil číst z letu krahujců? "" ozval se hlas tak mocný, že se to snad rozlehlo mezi všemi padesáti tisíci datlovníky Al - Fajjúmu."
"rush","rush","spěchají","spěchat","impf"," The times rush past, and so do the caravans, thought the alchemist, as he watched the hundreds of people and animals arriving at the oasis."," - Když čas ubíhá rychle, i karavany spěchají, - říkal si Alchymista a díval se, jak do Oázy vstupují stovky lidí a zvířat."
"saw","see","sledoval","sledovat","impf"," The alchemist saw the tribal chiefs greet the leader of the caravan, and converse with him at length."," Alchymista sledoval, jak se kmenoví vůdci blíží k Vůdci karavany a dlouze s ním hovoří."
"said","say","odpověděl","odpovědět","pf"," "" Good-bye, "" said the boy."," "" Sbohem, "" odpověděl chlapec."
"rode","ride","jel","jet","impf"," The boy rode along through the desert for several hours, listening avidly to what his heart had to say."," Santiago už jel dvě a půl hodiny pouští a snažil se pozorně naslouchat svému srdci."
"listening","listen","naslouchat","naslouchat","impf"," The boy rode along through the desert for several hours, listening avidly to what his heart had to say."," Santiago už jel dvě a půl hodiny pouští a snažil se pozorně naslouchat svému srdci."
"told","tell","řekl","říci","pf"," "" Where your treasure is, there also will be your heart, "" the alchemist had told him."," "" Tam, kde bude tvůj poklad, bude i tvé srdce, "" řekl Alchymista."
"speaking","speak","mluvilo","mluvit","impf"," But his heart was speaking of other things."," Santiagovo srdce však mluvilo o něčem jiném."
"told","tell","vyprávělo","vyprávět","impf"," With pride, it told the story of a shepherd who had left his flock to follow a dream he had on two different occasions."," S hrdostí vyprávělo o pastýři, který opustil své ovce a šel za snem, který se mu zdál po dvě noci."
"left","leave","opustil","opustit","pf"," With pride, it told the story of a shepherd who had left his flock to follow a dream he had on two different occasions."," S hrdostí vyprávělo o pastýři, který opustil své ovce a šel za snem, který se mu zdál po dvě noci."
"move","move","jet","jet","impf"," They were silent for a moment, and then agreed that the boy and the alchemist could move along."," Chvíli mlčeli a potom řekli, že mohou jet dál."
"dominated","dominate","Ovládl","ovládnout","pf"," "" You dominated those horsemen with the way you looked at them, "" he said."," "" Ovládl jste strážce pohledem, "" poznamenal."
"show","show","ukazují","ukazovat","impf"," "" Your eyes show the strength of your soul, "" answered the alchemist."," "" Oči ukazují sílu duše, "" odpověděl Alchymista."
"answered","answer","odpověděl","odpovědět","pf"," "" Your eyes show the strength of your soul, "" answered the alchemist."," "" Oči ukazují sílu duše, "" odpověděl Alchymista."
"thought","think","pomyslel","pomyslet","pf"," That ’ s true, the boy thought."," Je to pravda, pomyslel si Santiago."
"find","find","najdu","najít","pf"," "" When I have been truly searching for my treasure, every day has been luminous, because I ’ ve known that every hour was a part of the dream that I would find it."," - Při hledání pokladu jsou všechny dny skvělé, protože vím, že každá chvíle naplňuje sen o tom, že jej najdu."
"discovered","discover","objevil","objevit","pf"," When I have been truly searching for my treasure, I ’ ve discovered things along the way that I never would have seen had I not had the courage to try things that seemed impossible for a shepherd to achieve. """," Při hledání pokladu jsem cestou objevil věci, které bych byl nikdy nedoufal najít, kdybych neměl odvahu pokusit se o něco, co je pastýřům nedostupné."
"discovered","discover","najít","najít","pf"," When I have been truly searching for my treasure, I ’ ve discovered things along the way that I never would have seen had I not had the courage to try things that seemed impossible for a shepherd to achieve. """," Při hledání pokladu jsem cestou objevil věci, které bych byl nikdy nedoufal najít, kdybych neměl odvahu pokusit se o něco, co je pastýřům nedostupné."
"try","try","pokusit","pokusit","pf"," When I have been truly searching for my treasure, I ’ ve discovered things along the way that I never would have seen had I not had the courage to try things that seemed impossible for a shepherd to achieve. """," Při hledání pokladu jsem cestou objevil věci, které bych byl nikdy nedoufal najít, kdybych neměl odvahu pokusit se o něco, co je pastýřům nedostupné."
"returned","return","vrátil","vrátit","pf"," The old man returned the book to the boy."," Stařec vrátil Santiagovi jeho knihu."
"bring","bring","přiveď","přivést","pf"," "" Tomorrow, at this same time, bring me a tenth of your flock."," "" Zítra v tuhle hodinu mi přiveď desetinu svého stáda."
"tell","tell","Řeknu","říci","pf"," And I will tell you how to find the hidden treasure."," Řeknu ti, jak najdeš ten zakopaný poklad."
"find","find","najdeš","najít","pf"," And I will tell you how to find the hidden treasure."," Řeknu ti, jak najdeš ten zakopaný poklad."
"vanished","vanish","zmizel","zmizet","pf"," And he vanished around the corner of the plaza."," A zmizel na rohu náměstí."
"concentrate","concentrate","soustředit","soustředit","pf"," The boy began again to read his book, but he was no longer able to concentrate."," Pastýř se dal do čtení, ale už se nedokázal soustředit."
"saw","see","neviděly","vidět","impf"," The children had been kept at the other side of a grove of palm trees, and saw nothing of what had happened."," Děti byly na druhém konci datlovníkového háje a nic neviděly."
"praying","pray","modlily","modlit","impf"," The women had remained in their tents, praying for the safekeeping of their husbands, and saw nothing of the battle, either."," Ženy se modlily za své muže ve stanech a také nic neviděly."
"saw","see","neviděly","vidět","impf"," The women had remained in their tents, praying for the safekeeping of their husbands, and saw nothing of the battle, either."," Ženy se modlily za své muže ve stanech a také nic neviděly."
"cures","cure","léčí","léčit","impf"," Find out who it is who cures the people ’ s illnesses! """," Zeptejte se na člověka, který v oáze léčí všechny nemocné! """
"came","come","přišlo","přijít","pf"," Several women dressed in black came to the well for water, but the boy would speak to none of them, despite the Englishman ’ s insistence."," Několik dalších černě oblečených žen přišlo ke studni pro vodu, ale Santiago se přes Angličanovo naléhání s žádnou nedal do řeči."
"cures","cure","léčí","léčit","impf"," "" Do you know someone here who cures people ’ s illnesses? "" the boy asked."," "" Znáte někoho, kdo tu léčí nemocné? "" zeptal se Santiago."
"asked","ask","zeptal","zeptat","pf"," "" Do you know someone here who cures people ’ s illnesses? "" the boy asked."," "" Znáte někoho, kdo tu léčí nemocné? "" zeptal se Santiago."
"cures","cure","léčí","léčit","impf"," "" Allah cures our illnesses, "" said the man, clearly frightened of the strangers."," "" Všechny nemocné léčí Alláh, "" odpověděl muž a bylo vidět, že má z cizinců strach."
"said","say","odpověděl","odpovědět","pf"," "" Allah cures our illnesses, "" said the man, clearly frightened of the strangers."," "" Všechny nemocné léčí Alláh, "" odpověděl muž a bylo vidět, že má z cizinců strach."
"told","tell","pověděl","povědět","pf"," The boy told the younger man what he had seen, and the man asked him to wait there."," Santiago mu pověděl všechno, co viděl."
"seen","see","viděl","vidět","impf"," The boy told the younger man what he had seen, and the man asked him to wait there."," Santiago mu pověděl všechno, co viděl."
"discovered","discover","zjistili","zjistit","pf"," They discovered that the purification of the metals had led to a purification of themselves. """," A jednoho krásného dne zjistili, že nakonec očistili sami sebe. """
"thought","think","vzpomněl","vzpomenout","pf"," The boy thought about the crystal merchant."," Santiago si vzpomněl na Sklenáře."
"said","say","Řekl","říci","pf"," He had said that it was a good thing for the boy to clean the crystal pieces, so that he could free himself from negative thoughts."," Řekl mu tenkrát, že jim vyčištění sklenic prospělo, protože oba se při tom také zbavili špatných myšlenek."
"free","free","zbavili","zbavit","pf"," He had said that it was a good thing for the boy to clean the crystal pieces, so that he could free himself from negative thoughts."," Řekl mu tenkrát, že jim vyčištění sklenic prospělo, protože oba se při tom také zbavili špatných myšlenek."
"learned","learn","naučit","naučit","pf"," The boy was becoming more and more convinced that alchemy could be learned in one ’ s daily life."," Chlapec byl stále víc přesvědčen, že alchymii je možné se naučit v každodenním životě."
"put","put","dal","dát","pf"," He put a sign on the door, and they went to a small café nearby."," Na dveře dal cedulku a zašli spolu do maličké hospůdky nedaleko krámu."
"sat","sit","usedli","usednout","pf"," As they sat down at the only table in the place, the crystal merchant laughed."," Sotva usedli k jedinému stolu, který tam byl, Sklenář se usmál."
"let","let","nechal","nechat","pf"," "" Well then, why did you let me do it? "" the boy asked."," "" Proč jste mě to nechal dělat? "" zeptal se chlapec."
"did","do","dělat","dělat","impf"," "" Well then, why did you let me do it? "" the boy asked."," "" Proč jste mě to nechal dělat? "" zeptal se chlapec."
"do","do","dělat","dělat","impf"," "" Well then, why did you let me do it? "" the boy asked."," "" Proč jste mě to nechal dělat? "" zeptal se chlapec."
"asked","ask","zeptal","zeptat","pf"," "" Well then, why did you let me do it? "" the boy asked."," "" Proč jste mě to nechal dělat? "" zeptal se chlapec."
"needed","need","potřebovali","potřebovat","impf"," And both you and I needed to cleanse our minds of negative thoughts. """," A stejně tak ty jako já jsme si potřebovali vyčistit hlavu od špatných myšlenek. """
"came","come","vstoupil","vstoupit","pf"," The boy told them about his life as a shepherd, and was about to tell them of his experiences at the crystal shop when the Englishman came into the tent."," Santiago jim vykládal, co zažil jako pastýř, a zrovna chtěl začít o svých zkušenostech z práce ve sklenářství, když do stanu vstoupil Angličan."
"looking","look","hledám","hledat","impf"," "" I ’ ve been looking for you all morning, "" he said, as he led the boy outside."," "" Celé ráno vás hledám, "" řekl a táhl ho ven."
"said","say","řekl","říci","pf"," "" I ’ ve been looking for you all morning, "" he said, as he led the boy outside."," "" Celé ráno vás hledám, "" řekl a táhl ho ven."
"raise","raise","chovat","chovat","impf"," Someone might one day plant trees in the desert, and even raise sheep there, but never would they harness the wind."," Jednou se budou moci v poušti sázet stromy, ba i chovat ovce, ale vítr ovládnout nedokáže nikdo."
"said","say","odpověděl","odpovědět","pf"," "" That ’ s not true, "" the boy said."," "" To není pravda, "" odpověděl chlapec."
"approached","approach","Přistoupil","přistoupit","pf"," The owner of the bar approached him, and the boy pointed to a drink that had been served at the next table."," Přistoupil k němu hospodský a Santiago ukázal na nápoj, který pili u vedlejšího stolu."
