"gave","give","poskytlo","poskytnout","pf"," A somewhat grudging acquiescence from the old man gave me a clear day in which to make my observations."," Starý pán vyjádřil trochu neochotně souhlas, a to mi poskytlo další den na pátrání."
"convinced","convince","přesvědčen","přesvědčit","pf"," I was already perfectly convinced that Godfrey was in hiding somewhere near, but where and why remained to be solved."," Byl jsem skálopevně přesvědčen, že se Godfrey skrývá někde nablízku, avšak zbývalo rozřešit hádanku, kde se skrývá a proč."
"hiding","hide","skrývá","skrývat","impf"," I was already perfectly convinced that Godfrey was in hiding somewhere near, but where and why remained to be solved."," Byl jsem skálopevně přesvědčen, že se Godfrey skrývá někde nablízku, avšak zbývalo rozřešit hádanku, kde se skrývá a proč."
"remained","remain","zbývalo","zbývat","impf"," I was already perfectly convinced that Godfrey was in hiding somewhere near, but where and why remained to be solved."," Byl jsem skálopevně přesvědčen, že se Godfrey skrývá někde nablízku, avšak zbývalo rozřešit hádanku, kde se skrývá a proč."
"hiding","hide","skrývá","skrývat","impf"," I was already perfectly convinced that Godfrey was in hiding somewhere near, but where and why remained to be solved."," Byl jsem skálopevně přesvědčen, že se Godfrey skrývá někde nablízku, avšak zbývalo rozřešit hádanku, kde se skrývá a proč."
"prevented","prevent","nezabránilo","zabránit","pf"," Since then I have been honoured by his confidence, which has not prevented most of his plans going subtly wrong and five of his best agents being in prison."," Časem mne poctil svou důvěrou, což nezabránilo tomu, aby se jeho záměry většinou trochu nějak pokazily a pět jeho nejlepších lidí skončilo ve vězení."
"watched","watch","Pozoroval","pozorovat","impf"," I watched them, Watson, and I picked them as they ripened."," Pozoroval jsem je, Watsone, a sbíral je, jakmile dozrál čas."
"picked","pick","sbíral","sbírat","impf"," I watched them, Watson, and I picked them as they ripened."," Pozoroval jsem je, Watsone, a sbíral je, jakmile dozrál čas."
"hope","hope","doufám","doufat","impf"," Well, sir, I hope that you are none the worse! ”"," Nu, pane, doufám, že jste to přežil bez úhony! """
"lain","lie","ležel","ležet","impf"," The last remark was addressed to Von Bork himself, who after much gasping and blinking had lain quietly listening to Holmes ’ s statement."," Poslední věta patřila už von Borkovi, který nejprv hojně lapal po dechu a mžikal očima a pak už jen tiše ležel a naslouchal."
"listening","listen","naslouchal","naslouchat","impf"," The last remark was addressed to Von Bork himself, who after much gasping and blinking had lain quietly listening to Holmes ’ s statement."," Poslední věta patřila už von Borkovi, který nejprv hojně lapal po dechu a mžikal očima a pak už jen tiše ležel a naslouchal."
"bring","bring","vyvolat","vyvolat","pf"," All my hot words could not bring one tinge of colour to those ivory cheeks or one gleam of emotion to those abstracted eyes."," A veškerá moje procítěná slova nedokázala vyvolat ani sebeslabší záblesk na těch mramorových lících, ani záblesk pohnutí v těch do dáli přených očích."
"thought","think","Vzpomněl","vzpomenout","pf"," I thought of what the rascal had said about a post-hypnotic influence."," Vzpomněl jsem si, co ten darebák říkal o posthypnotickém vlivu."
"said","say","říkal","říkat","impf"," I thought of what the rascal had said about a post-hypnotic influence."," Vzpomněl jsem si, co ten darebák říkal o posthypnotickém vlivu."
"believe","believe","uvěřil","uvěřit","pf"," One could really believe that she was living above the earth in some ecstatic dream."," Člověk by skutečně uvěřil, že se ta dívka vznáší nad zemí v jakési snové extázi."
"go","go","vodjedete","odjet","pf"," You ’ ll go off and he, poor devil, will have to stand the racket, and lucky if he gets off with his life."," Vy si kliďánko vodjedete a von chudák to má na krku a může mluvit vo štěstí, jestli vyfásne doživotí."
"stand","stand","má","mít","impf"," You ’ ll go off and he, poor devil, will have to stand the racket, and lucky if he gets off with his life."," Vy si kliďánko vodjedete a von chudák to má na krku a může mluvit vo štěstí, jestli vyfásne doživotí."
"want","want","chci","chtít","impf"," That ’ s why I want to get over the water as soon as you do. ”"," Proto chci bejt za vodou stejně s váma. """
"shaken","shake","otřásla","otřást","pf"," Von Bork was a strong, self-contained man, but it was easy to see that the news had shaken him."," Von Bork byl silný muž a měl železné nervy, avšak tato zpráva jím viditelně otřásla."
"write","write","psal","psát","impf"," If I ’ d known that any letter of mine was goin ’ to lie loose in a thing like that I ’ d have been a mug to write to you at all. ”"," Vědět, že tu některej můj dopis necháte takhle povalovat, nebyl bych takovej cvok, abych vám vůbec psal. """
"said","say","řekl","říci","pf"," “ Search me, ” said the American."," "" Nemám páru, "" řekl Američan."
"turn","turn","otočil","otočit","pf"," Only when all these precautions had been taken and tested did he turn his sunburned aquiline face to his guest."," Teprve když se takto opatrně pojistil a znovu všechno přezkoušel, otočil snědou tvář s orlím nosem k hostu."
"took","take","vzala","vzít","pf"," “ When my wife and the household left yesterday for Flushing they took the less important with them."," Moje paní vzala s sebou ty méně důležité, když včera odjížděla s rodinou a služebnictvem do Flushingu."
"left","leave","odjížděla","odjíždět","impf"," “ When my wife and the household left yesterday for Flushing they took the less important with them."," Moje paní vzala s sebou ty méně důležité, když včera odjížděla s rodinou a služebnictvem do Flushingu."
"listened","listen","naslouchal","naslouchat","impf"," These quivered with amusement as he listened, and he finally broke into a gentle chuckle."," Ty se pobaveně zachvívaly, dokud mi naslouchal, až se nakonec tlumeně rozesmál."
"trying","try","snažíte","snažit","impf"," ‘ Excuse my amusement, Mr. Holmes, ’ said he, ‘ but it is really funny to see you trying to play a hand with no cards in it."," ' Omluvte mé veselí, pane Holmesi, připadá mi však vskutku komické, jak se snažíte sehrát karetní partii bez trumfů."
"play","play","sehrát","sehrát","pf"," ‘ Excuse my amusement, Mr. Holmes, ’ said he, ‘ but it is really funny to see you trying to play a hand with no cards in it."," ' Omluvte mé veselí, pane Holmesi, připadá mi však vskutku komické, jak se snažíte sehrát karetní partii bez trumfů."
"heard","hear","Slyšel","slyšet","impf"," “ Have you ever heard of Baron Gruner? ”"," "" Slyšel jste někdy o baronu Grunerovi? """
"mean","mean","Myslíte","myslet","impf"," “ You mean the Austrian murderer? ”"," "" Myslíte onoho rakouského vraha? """
"spend","spend","věnujte","věnovat","impf"," “ Well, then, spend the next twenty-four hours in an intensive study of Chinese pottery. ”"," "" Dobrá, tak se tedy příštích čtyřiadvacet hodin věnujte intenzívnímu studiu čínského porculánu. """
"gave","give","Neposkytl","poskytnout","pf"," He gave no explanations and I asked for none."," Neposkytl mi k tomu žádné vysvětlení a já je ani nežádal."
"asked","ask","nežádal","žádat","impf"," He gave no explanations and I asked for none."," Neposkytl mi k tomu žádné vysvětlení a já je ani nežádal."
"learned","learn","naučila","naučit","pf"," By long experience I had learned the wisdom of obedience."," Dlouholetá zkušenost mne naučila vždy moudře poslechnout."
"walked","walk","kráčel","kráčet","impf"," But when I had left his room I walked down Baker Street, revolving in my head how on earth I was to carry out so strange an order."," Avšak když jsem vyšel z jeho ložnice a kráčel po Baker Street, přemítal jsem v duchu, jak u všech všudy splnit tak podivný příkaz."
"meet","meet","setkáte","setkat","pf"," Perhaps you may meet her before we are through, and you can use your own gift of words."," Možná že se s ní setkáte, než dovedeme tu záležitost do konce, a pak budete moci využít vlastního spisovatelského talentu k jejímu zobrazení."
"use","use","využít","využít","pf"," Perhaps you may meet her before we are through, and you can use your own gift of words."," Možná že se s ní setkáte, než dovedeme tu záležitost do konce, a pak budete moci využít vlastního spisovatelského talentu k jejímu zobrazení."
"seen","see","Viděl","vidět","impf"," I have seen such faces in the pictures of the old masters of the Middle Ages."," Viděl jsem takové tváře na obrazech středověkých mistrů."
"narrow","narrow","omezil","omezit","pf"," I now proceeded, using my familiar method of logical analysis, to narrow down the possible solutions."," Jal jsem se tedy podle své známé metody logické analýzy vylučovat možná řešení, abych omezil jejich počet."
"see","see","Vidíte","vidět","impf"," “ You can see that the piece is genuine, and, as to the value, I am content to take an expert ’ s valuation. ”"," "" Vidíte, že ten kus je pravý, a co se ceny týká, spokojím se s odhadem znalce. """
"said","say","řekl","říci","pf"," “ Very mysterious, ” said he with a quick, suspicious flash of his dark eyes."," "" Velice záhadné, "" řekl a v temných očích mu krátce blesklo podezření."
"wishes","wish","přeje","přát","impf"," “ In dealing with objects of such value, one naturally wishes to know all about the transaction."," "" U tak drahocenné věci si člověk přirozeně přeje znát všechny osobnostní transakce."
"desires","desire","přeje","přát","impf"," Sir James begs to say that the matter upon which he desires to consult Mr. Holmes is very delicate and also very important."," Sir James si přeje zdůraznit, že se hodlá obrátit na pana Holmese v záležitosti velice naléhavé, která vyžaduje mimořádný takt."
"desires","desire","vyžaduje","vyžadovat","impf"," Sir James begs to say that the matter upon which he desires to consult Mr. Holmes is very delicate and also very important."," Sir James si přeje zdůraznit, že se hodlá obrátit na pana Holmese v záležitosti velice naléhavé, která vyžaduje mimořádný takt."
"trusts","trust","Doufá","doufat","impf"," He trusts, therefore, that Mr. Holmes will make every effort to grant this interview, and that he will confirm it over the telephone to the Carlton Club."," Doufá proto, že pan Holmes učiní vše, co je v jeho silách, aby se schůzka uskutečnila, a že ji předem telefonicky potvrdí v klubu Carlton."
"make","make","učiní","učinit","pf"," He trusts, therefore, that Mr. Holmes will make every effort to grant this interview, and that he will confirm it over the telephone to the Carlton Club."," Doufá proto, že pan Holmes učiní vše, co je v jeho silách, aby se schůzka uskutečnila, a že ji předem telefonicky potvrdí v klubu Carlton."
"make","make","potvrdí","potvrdit","pf"," He trusts, therefore, that Mr. Holmes will make every effort to grant this interview, and that he will confirm it over the telephone to the Carlton Club."," Doufá proto, že pan Holmes učiní vše, co je v jeho silách, aby se schůzka uskutečnila, a že ji předem telefonicky potvrdí v klubu Carlton."
"confirm","confirm","potvrdí","potvrdit","pf"," He trusts, therefore, that Mr. Holmes will make every effort to grant this interview, and that he will confirm it over the telephone to the Carlton Club."," Doufá proto, že pan Holmes učiní vše, co je v jeho silách, aby se schůzka uskutečnila, a že ji předem telefonicky potvrdí v klubu Carlton."
"given","give","předal","předat","pf"," When I had given Johnson his instructions I took a cab out to Kingston and found the Baron in a most affable mood. ”"," Jakmile jsem předal Johnsonovi příslušné pokyny, vzal jsem si drožku do Kingstonu a zastal jsem barona v nadobyčej vlídném rozpoložení. """
"took","take","vzal","vzít","pf"," When I had given Johnson his instructions I took a cab out to Kingston and found the Baron in a most affable mood. ”"," Jakmile jsem předal Johnsonovi příslušné pokyny, vzal jsem si drožku do Kingstonu a zastal jsem barona v nadobyčej vlídném rozpoložení. """
"recognize","recognize","Poznal","poznat","pf"," “ Did he recognize you? ”"," "" Poznal vás? """
"found","find","zjistil","zjistit","pf"," I have said that it was heavily curtained, but now I found that the windows were shuttered as well."," Zmínil jsem se už, že v oknech visely těžké záclony, ale teď jsem zjistil, že jsou tu navíc ještě okenice."
"concentrated","concentrate","soustředil","soustředit","pf"," Some light, however, was breaking through one of them, so I concentrated my attention upon this."," Jednou okenicí však prosvítalo světlo, a tam jsem tedy soustředil pozornost."
"see","see","viděl","vidět","impf"," I was in luck, for the curtain had not been quite closed, and there was a crack in the shutter, so that I could see the inside of the room."," Měl jsem štěstí, protože záclony nebyly stažené až k sobě a okenice měla škvíru, takže jsem viděl dovnitř."
"watched","watch","pozoroval","pozorovat","impf"," Behold the fruit of pensive nights and laborious days when I watched the little working gangs as once I watched the criminal world of London. ”"," Je to plod nocí věnovaných úvahám a dnů věnovaných pilné práci, kdy jsem pozoroval, co se děje v úle, se stejným zaujetím, jako jsem kdysi pozoroval, co se děje v londýnském podsvětí. """
"watched","watch","pozoroval","pozorovat","impf"," Behold the fruit of pensive nights and laborious days when I watched the little working gangs as once I watched the criminal world of London. ”"," Je to plod nocí věnovaných úvahám a dnů věnovaných pilné práci, kdy jsem pozoroval, co se děje v úle, se stejným zaujetím, jako jsem kdysi pozoroval, co se děje v londýnském podsvětí. """
"watched","watch","pozoroval","pozorovat","impf"," Behold the fruit of pensive nights and laborious days when I watched the little working gangs as once I watched the criminal world of London. ”"," Je to plod nocí věnovaných úvahám a dnů věnovaných pilné práci, kdy jsem pozoroval, co se děje v úle, se stejným zaujetím, jako jsem kdysi pozoroval, co se děje v londýnském podsvětí. """
"watched","watch","pozoroval","pozorovat","impf"," Behold the fruit of pensive nights and laborious days when I watched the little working gangs as once I watched the criminal world of London. ”"," Je to plod nocí věnovaných úvahám a dnů věnovaných pilné práci, kdy jsem pozoroval, co se děje v úle, se stejným zaujetím, jako jsem kdysi pozoroval, co se děje v londýnském podsvětí. """
"act","act","jednáte","jednat","impf"," Possibly you mean well, though I learn that you are a paid agent who would have been equally willing to act for the Baron as against him."," Snad jednáte v dobrém úmyslu, ačkoli mi bylo řečeno, že jste za své služby placen, a hájil byste patrně stejně ochotně baronovy zájmy jako vystupoval proti němu."
"paid","pay","placen","platit","impf"," Possibly you mean well, though I learn that you are a paid agent who would have been equally willing to act for the Baron as against him."," Snad jednáte v dobrém úmyslu, ačkoli mi bylo řečeno, že jste za své služby placen, a hájil byste patrně stejně ochotně baronovy zájmy jako vystupoval proti němu."
"describes","describe","popisuje","popisovat","impf"," “ But if these injuries are as terrible as Dr. Watson describes, then surely our purpose of thwarting the marriage is sufficiently gained without the use of this horrible book. ”"," "" Je - - li však jeho poranění tak strašlivé, jak je doktor Watson popisuje, jistě dosáhneme bezpečně svého cíle a odvrátíme ten sňatek, aniž bychom museli použít jeho odporného deníku. """
"gained","gain","dosáhneme","dosáhnout","pf"," “ But if these injuries are as terrible as Dr. Watson describes, then surely our purpose of thwarting the marriage is sufficiently gained without the use of this horrible book. ”"," "" Je - - li však jeho poranění tak strašlivé, jak je doktor Watson popisuje, jistě dosáhneme bezpečně svého cíle a odvrátíme ten sňatek, aniž bychom museli použít jeho odporného deníku. """
"love","love","milovala","milovat","impf"," She would love him the more as a disfigured martyr."," Znetvořeného mučedníka by milovala ještě vroucněji."
"destroy","destroy","zničit","zničit","pf"," It is his moral side, not his physical, which we have to destroy."," Je třeba ho zničit po morální stránce, ne po fyzické."
"left","leave","opustil","opustit","pf"," Then I left that house of gloom and terror."," Poté jsem opustil ten dům hrůzy a beznaděje."
"learn","learn","naučit","naučit","pf"," “ They have strange limits and one must learn to observe them."," "" Mají takové zvláštní hranice a člověk se musí naučit je respektovat."
"observe","observe","respektovat","respektovat","impf"," “ They have strange limits and one must learn to observe them."," "" Mají takové zvláštní hranice a člověk se musí naučit je respektovat."
"adapt","adapt","přizpůsobit","přizpůsobit","pf"," Then one comes suddenly upon something very hard, and you know that you have reached the limit and must adapt yourself to the fact."," Pak nečekaně narazí na tvrdou hradbu a ví, že se dál nedostane ani o krok, a musí se tomu faktu přizpůsobit."
"observed","observe","zachovávat","zachovávat","impf"," They have, for example, their insular conventions which simply MUST be observed. ”"," Kupříkladu některé jejich osobité ostrovní zvyklosti je bezpodmínečně nutné zachovávat. """
"shutting","shut","zavírám","zavírat","impf"," Here it is, and I ’ m shutting down to-morrow morning. ”"," Naše chvíle nadešla a já to tu zítra ráno zavírám. """
"see","see","Koukám","koukat","impf"," In a week or less, from what I see, John Bull will be on his hind legs and fair ramping."," Koukám, že do tejdna anebo ještě dřív pomele John Bull z posledního."
"watch","watch","koukat","koukat","impf"," I ’ d rather watch him from over the water. ”"," Budu se na to radši koukat přes tu velkou louži. """
"marry","marry","provdat","provdat","pf"," To sum up, she proposes to marry him next month."," Zkrátka : hodlá se za něho příští měsíc provdat."
"prevent","prevent","zabránit","zabránit","pf"," As she is of age and has a will of iron, it is hard to know how to prevent her. ”"," A jelikož je plnoletá a tvrdohlavě prosazuje svou vůli, je těžké najít způsob, jak jí v tom zabránit. """
"told","tell","vyprávěl","vyprávět","impf"," “ The cunning devil has told her every unsavoury public scandal of his past life, but always in such a way as to make himself out to be an innocent martyr."," "" Ten úskočný ďábel jí vyprávěl o všech nechutných veřejných skandálech ze své minulosti, avšak vylíčil je vždy tak, aby se jevil jako nevinný mučedník."
"listen","listen","slyšet","slyšet","impf"," She absolutely accepts his version and will listen to no other. ”"," A ona bezvýhradně věří jeho verzi a o jiné nechce ani slyšet. """
"say","say","Říkáte","říkat","impf"," “ You say he was affable? ”"," "" Říkáte, že vás přijal vlídně? """
"purring","purr","Předl","příst","impf"," “ A purring cat who thinks he sees prospective mice."," "" Předl spokojeně jako kocour, který spatří myš a považuje ji za svou kořist."
"sees","see","spatří","spatřit","pf"," “ A purring cat who thinks he sees prospective mice."," "" Předl spokojeně jako kocour, který spatří myš a považuje ji za svou kořist."
"thinks","think","považuje","považovat","impf"," “ A purring cat who thinks he sees prospective mice."," "" Předl spokojeně jako kocour, který spatří myš a považuje ji za svou kořist."
"sees","see","považuje","považovat","impf"," “ A purring cat who thinks he sees prospective mice."," "" Předl spokojeně jako kocour, který spatří myš a považuje ji za svou kořist."
"endeavouring","endeavour","snažíme","snažit","impf"," It is this daughter, this lovely, innocent girl, whom we are endeavouring to save from the clutches of a fiend. ”"," A právě tuto dceru, toto půvabné nevinné stvoření se snažíme zachránit ze spárů netvora. """
"save","save","zachránit","zachránit","pf"," It is this daughter, this lovely, innocent girl, whom we are endeavouring to save from the clutches of a fiend. ”"," A právě tuto dceru, toto půvabné nevinné stvoření se snažíme zachránit ze spárů netvora. """
"said","say","řekl","říci","pf"," “ Those are the lights of Harwich, I suppose, ” said the secretary, pulling on his dust coat."," "" To jsou světla z Harwiche, nemýlím - li se, "" řekl rada, zatímco si navlékal ochranný plášť."
"say","say","říci","říci","pf"," I have nothing more to say, sir, save that I have no wish ever to see you again. ’"," Nemám k tomu už co říci, pane, leda snad to, že vás už nikdy nechci spatřit. '"
"see","see","spatřit","spatřit","pf"," I have nothing more to say, sir, save that I have no wish ever to see you again. ’"," Nemám k tomu už co říci, pane, leda snad to, že vás už nikdy nechci spatřit. '"
"lost","lose","ztratil","ztratit","pf"," At this I lost my temper, Mr. Holmes, and I spoke with some warmth."," Nato jsem ztratil hlavu a řekl jsem mu to pěkně od plic."
"spoke","speak","řekl","říci","pf"," At this I lost my temper, Mr. Holmes, and I spoke with some warmth."," Nato jsem ztratil hlavu a řekl jsem mu to pěkně od plic."
"seen","see","Viděl","vidět","impf"," ‘ I have seen your son, and I am convinced that for some reason of your own you are concealing him from the world."," ' Viděl jsem vašeho syna a jsem přesvědčen, že ho z nějakých osobních důvodů skrýváte před světem."
"convinced","convince","přesvědčen","přesvědčit","pf"," ‘ I have seen your son, and I am convinced that for some reason of your own you are concealing him from the world."," ' Viděl jsem vašeho syna a jsem přesvědčen, že ho z nějakých osobních důvodů skrýváte před světem."
"concealing","conceal","skrýváte","skrývat","impf"," ‘ I have seen your son, and I am convinced that for some reason of your own you are concealing him from the world."," ' Viděl jsem vašeho syna a jsem přesvědčen, že ho z nějakých osobních důvodů skrýváte před světem."
"hit","hit","zasáhla","zasáhnout","pf"," Then he was hit with a bullet from an elephant gun in the action near Diamond Hill outside-Pretoria."," A pak zasáhla Godfreye střela z kulovnice na slony při bojích u Diamantové hory nedaleko Pretorie."
"wrote","write","napsal","napsat","pf"," Well, when the war was over, and we all got back, I wrote to his father and asked where Godfrey was."," Nu a pak válka skončila, všichni jsme se vrátili a já napsal jeho otci, kde je Godfrey."
"waited","wait","vyčkával","vyčkávat","impf"," I waited a bit and then I wrote again."," Nějaký čas jsem vyčkával a pak jsem napsal znovu."
"wrote","write","napsal","napsat","pf"," I waited a bit and then I wrote again."," Nějaký čas jsem vyčkával a pak jsem napsal znovu."
"got","get","dostat","dostat","pf"," On the other hand, this constraint could not be severe or the young man could not have got loose and come down to have a look at his friend."," Na druhou stranu ovšem tato opatření nemohla být příliš důsledná, jinak by se mladý muž nebyl mohl dostat ven a přijít se podívat na přítele."
"got","get","přijít","přijít","pf"," On the other hand, this constraint could not be severe or the young man could not have got loose and come down to have a look at his friend."," Na druhou stranu ovšem tato opatření nemohla být příliš důsledná, jinak by se mladý muž nebyl mohl dostat ven a přijít se podívat na přítele."
"come","come","přijít","přijít","pf"," On the other hand, this constraint could not be severe or the young man could not have got loose and come down to have a look at his friend."," Na druhou stranu ovšem tato opatření nemohla být příliš důsledná, jinak by se mladý muž nebyl mohl dostat ven a přijít se podívat na přítele."
"remember","remember","vzpomenete","vzpomenout","pf"," You will remember, Mr. Dodd, that I felt round for points, asking you, for example, about the paper which Mr. Kent was reading."," Snad si vzpomenete, pane Dodde, že jsem hledal opěrné body a ptal se vás například, jaký časopis pan Kent četl."
"asking","ask","ptal","ptát","impf"," You will remember, Mr. Dodd, that I felt round for points, asking you, for example, about the paper which Mr. Kent was reading."," Snad si vzpomenete, pane Dodde, že jsem hledal opěrné body a ptal se vás například, jaký časopis pan Kent četl."
"reading","read","četl","číst","impf"," You will remember, Mr. Dodd, that I felt round for points, asking you, for example, about the paper which Mr. Kent was reading."," Snad si vzpomenete, pane Dodde, že jsem hledal opěrné body a ptal se vás například, jaký časopis pan Kent četl."
