"paid","pay","nezaplatil","zaplatit","pf"," Then I have a confused recollection of snatching at a paper, of the remonstrance of the man, whom I had not paid, and, finally, of standing in the doorway of a chemist ’ s shop while I turned up the fateful paragraph."," Nejasně si rozpomínám, že jsem kamelotovi vytrhl jeden výtisk, ten se začal rozčilovat, jelikož jsem ho nezaplatil, až jsem konečně stanul ve dveřích nějaké lékárny a hledal očima osudný sloupek."
"standing","stand","nezaplatil","zaplatit","pf"," Then I have a confused recollection of snatching at a paper, of the remonstrance of the man, whom I had not paid, and, finally, of standing in the doorway of a chemist ’ s shop while I turned up the fateful paragraph."," Nejasně si rozpomínám, že jsem kamelotovi vytrhl jeden výtisk, ten se začal rozčilovat, jelikož jsem ho nezaplatil, až jsem konečně stanul ve dveřích nějaké lékárny a hledal očima osudný sloupek."
"left","leave","zanechal","zanechat","pf"," We learn with regret that Mr. Sherlock Holmes, the well-known private detective, was the victim this morning of a murderous assault which has left him in a precarious position."," S politováním se dovídáme, že pan Sherlock Holmes, proslulý soukromý detektiv, se stal dnes kolem poledního obětí vražedného útoku, který zanechal neblahé následky."
"looked","look","pohlédl","pohlédnout","pf"," The Baron looked at his watch and gave a guttural exclamation of disappointment."," Baron pohlédl na hodinky a z hrdla se mu vydral hlasitý projev zklamání."
"wait","wait","čekat","čekat","impf"," “ Well, I really can wait no longer."," "" Nemohu skutečně už déle čekat."
"imagine","imagine","představit","představit","pf"," You can imagine that things are moving at present in Carlton Terrace and that we have all to be at our posts."," Jistě si umíte představit, že v politickém klubu na Carlton Terrace dostávají události spád a že všichni musíme být k dispozici."
"hoped","hope","Doufal","doufat","impf"," I had hoped to be able to bring news of your great coup."," Doufal jsem, že přivezu zprávu o vašem slavném činu."
"bring","bring","přivezu","přivézt","pf"," I had hoped to be able to bring news of your great coup."," Doufal jsem, že přivezu zprávu o vašem slavném činu."
"name","name","Nestanovil","stanovit","pf"," Did Altamont name no hour? ”"," Nestanovil Altamont přesnou hodinu? """
"mastered","master","ovládl","ovládnout","pf"," Von Bork had mastered his anger."," Rozhněvaný von Bork se ovládl."
"said","say","řekl","říci","pf"," “ We have been allies too long to quarrel now at the very hour of victory, ” he said."," "" Spolupracovali jsme tak dlouho, že se přece nerozkmotříme právě ve chvíli velkého vítězství, "" řekl."
"forget","forget","nezapomenu","zapomenout","pf"," “ You ’ ve done splendid work and taken risks, and I can ’ t forget it."," "" Osvědčil jste se skvěle, riskoval jste a já vám to nezapomenu."
"go","go","jeďte","jet","impf"," By all means go to Holland, and you can get a boat from Rotterdam to New York."," Samozřejmě, jen jeďte do Holandska a v Rotterdamu můžete nasednout na parník do New Yorku."
"stared","stare","Zíral","zírat","impf"," He stared at the writing with a face from which every expression save amazement had vanished."," Zíral na to napsané slovo a úžas zapudil z jeho tváře vše ostatní."
"sat","sit","Seděl","sedět","impf"," He sat in deep thought, his gaunt hand tugging at his straggling beard."," Seděl v hlubokém zamyšlení, vyhublá ruka se probírala ježatým vousem."
"forced","force","donutili","donutit","pf"," It is no doing of mine, but you have forced my hand."," Svoluji k tomu nerad, ale donutili jste mne."
"persist","persist","trvat","trvat","impf"," It is over, and you are now in smooth waters, but if you persist in this marriage you will raise up a swarm of powerful enemies who will never leave you alone until they have made England too hot to hold you."," budete - li však trvat na tom sňatku, znepřátelíte si četné vlivné osobnosti a nebude vám dopřán klid, dokud neshledáte, že půda v Anglii je pro vás příliš horká."
"left","leave","přestal","přestat","pf"," Surely you would be wiser if you left the lady alone."," Je nabíledni, že byste učinil moudře, kdybyste se s tou dámou přestal stýkat."
"held","hold","máte","mít","impf"," You are a connoisseur and collector with a very valuable piece in your collection, and yet you have never troubled to consult the one book which would have told you of the real meaning and value of what you held."," Jste znalec a sběratel, máte ve své sbírce mimořádně cenný kousek, a přitom jste se nenamáhal nahlédnout do jediného díla, kde byste se byl mohl poučit o skutečném významu a hodnotě svého vlastnictví."
"explain","explain","vysvětlit","vysvětlit","pf"," How do you explain that? ”"," Jak si to mám vysvětlit? """
"love","love","miluji","milovat","impf"," But in any case I wish you to understand once for all that I love him and that he loves me, and that the opinion of all the world is no more to me than the twitter of those birds outside the window."," Ať tak či onak, sděluji vám jednou provždy, že ho miluji a on miluje mne, a co si o tom myslí okolní svět, to mne nezajímá o nic víc než švitoření těchto ptáčátek pod oknem."
"loves","love","miluji","milovat","impf"," But in any case I wish you to understand once for all that I love him and that he loves me, and that the opinion of all the world is no more to me than the twitter of those birds outside the window."," Ať tak či onak, sděluji vám jednou provždy, že ho miluji a on miluje mne, a co si o tom myslí okolní svět, to mne nezajímá o nic víc než švitoření těchto ptáčátek pod oknem."
"love","love","miluje","milovat","impf"," But in any case I wish you to understand once for all that I love him and that he loves me, and that the opinion of all the world is no more to me than the twitter of those birds outside the window."," Ať tak či onak, sděluji vám jednou provždy, že ho miluji a on miluje mne, a co si o tom myslí okolní svět, to mne nezajímá o nic víc než švitoření těchto ptáčátek pod oknem."
"loves","love","miluje","milovat","impf"," But in any case I wish you to understand once for all that I love him and that he loves me, and that the opinion of all the world is no more to me than the twitter of those birds outside the window."," Ať tak či onak, sděluji vám jednou provždy, že ho miluji a on miluje mne, a co si o tom myslí okolní svět, to mne nezajímá o nic víc než švitoření těchto ptáčátek pod oknem."
"turned","turn","obrátila","obrátit","pf"," I am not clear ’ - here she turned eyes upon my companion - ‘ who this young lady may be. ’"," Není mi však jasné - ' tu obrátila pohled k mé společnici - ' kdo je tato slečna. '"
"vanished","vanish","zmizel","zmizet","pf"," He sprang back when he saw that I was looking at him, and he vanished into the darkness."," Uskočil, když zjistil, že na něho hledím, a zmizel ve tmě."
"trying","try","pokoušeli","pokoušet","impf"," In a cold way I felt pretty furious myself, Watson, for there was something indescribably annoying in the calm aloofness and supreme self-complaisance of the woman whom we were trying to save."," Jistým chladným způsobem jsem se hluboce rozzuřil i já, Watsone, protože v klidné povznesenosti a naprosté sebejistotě té dívky, kterou jsme se pokoušeli zachránit, bylo cosi nepopsatelně dráždivého."
"save","save","zachránit","zachránit","pf"," In a cold way I felt pretty furious myself, Watson, for there was something indescribably annoying in the calm aloofness and supreme self-complaisance of the woman whom we were trying to save."," Jistým chladným způsobem jsem se hluboce rozzuřil i já, Watsone, protože v klidné povznesenosti a naprosté sebejistotě té dívky, kterou jsme se pokoušeli zachránit, bylo cosi nepopsatelně dráždivého."
"foresaw","foresee","Předvídal","předvídat","impf"," “ I foresaw this situation, ” I explained, “ and I have brought with me a friend whose discretion may absolutely be trusted."," "" Předvídal jsem takovou situaci, "" vysvětloval jsem, "" a proto jsem s sebou přivezl přítele, na jehož diskrétnost je možno se naprosto spolehnout."
"explained","explain","vysvětloval","vysvětlovat","impf"," “ I foresaw this situation, ” I explained, “ and I have brought with me a friend whose discretion may absolutely be trusted."," "" Předvídal jsem takovou situaci, "" vysvětloval jsem, "" a proto jsem s sebou přivezl přítele, na jehož diskrétnost je možno se naprosto spolehnout."
"brought","bring","přivezl","přivézt","pf"," “ I foresaw this situation, ” I explained, “ and I have brought with me a friend whose discretion may absolutely be trusted."," "" Předvídal jsem takovou situaci, "" vysvětloval jsem, "" a proto jsem s sebou přivezl přítele, na jehož diskrétnost je možno se naprosto spolehnout."
"trusted","trust","spolehnout","spolehnout","pf"," “ I foresaw this situation, ” I explained, “ and I have brought with me a friend whose discretion may absolutely be trusted."," "" Předvídal jsem takovou situaci, "" vysvětloval jsem, "" a proto jsem s sebou přivezl přítele, na jehož diskrétnost je možno se naprosto spolehnout."
"advise","advise","poradit","poradit","pf"," I was able once to do him a professional service, and he is ready to advise as a friend rather than as a specialist."," Měl jsem kdysi možnost prokázat mu odbornou službu a on je nyní na oplátku ochoten poradit spíše jako přítel než specialista."
"call","call","neříkejte","říkat","impf"," “ No, no, don ’ t call it a pose."," "" Ne, ne, neříkejte tomu role."
"enjoy","enjoy","Těší","těšit","impf"," I enjoy it. ”"," Těší mne to. """
"play","play","hrajete","hrát","impf"," You yacht against them, you hunt with them, you play polo, you match them in every game, your four-in-hand takes the prize at Olympia."," Závodíte s nimi na jejich regatě, účastníte se jejich honů, hrajete pólo, vyrovnáte se jim v každém sportu, vaše čtyřspřeží získá na olympiádě cenu."
"match","match","vyrovnáte","vyrovnat","pf"," You yacht against them, you hunt with them, you play polo, you match them in every game, your four-in-hand takes the prize at Olympia."," Závodíte s nimi na jejich regatě, účastníte se jejich honů, hrajete pólo, vyrovnáte se jim v každém sportu, vaše čtyřspřeží získá na olympiádě cenu."
"takes","take","získá","získat","pf"," You yacht against them, you hunt with them, you play polo, you match them in every game, your four-in-hand takes the prize at Olympia."," Závodíte s nimi na jejich regatě, účastníte se jejich honů, hrajete pólo, vyrovnáte se jim v každém sportu, vaše čtyřspřeží získá na olympiádě cenu."
"asked","ask","zeptal","zeptat","pf"," “ Well? ” asked Von Bork eagerly, running forward to meet his visitor."," "" Tak co? "" zeptal se von Bork dychtivě, když doběhl k návštěvníkovi."
"waved","wave","zamával","zamávat","pf"," For answer the man waved a small brown-paper parcel triumphantly above his head."," Ten místo odpovědi zamával vítězoslavně nad hlavou malým balíčkem v hnědém papíru."
"cried","cry","zvolal","zvolat","pf"," “ You can give me the glad hand to-night, mister, ” he cried."," "" Dneska mi můžete zatleskat, vašnosti, "" zvolal."
"bringing","bring","Nesu","nést","impf"," “ I ’ m bringing home the bacon at last. ”"," "" Nesu si pěknou vejslužku. """
"said","say","slíbil","slíbit","pf"," “ Same as I said in my cable."," "" Jak jsem to slíbil v telegramu."
"set","set","dát","dát","pf"," There was a good deal of tidying up to do inside his study and he set himself to do it until his keen, handsome face was flushed with the heat of the burning papers."," Musel dát v pracovně do pořádku ještě mnoho věcí a pustil se do díla, až jeho bystrý, hezký obličej celý zrudl od žáru spalovaných listin."
"stood","stand","měl","mít","impf"," A leather valise stood beside his table, and into this he began to pack very neatly and systematically the precious contents of his safe."," U stolu měl připravený kožený kufr, a do něho se teď jal úhledně a systematicky skládat drahocenný obsah sejfu."
"started","start","začal","začít","pf"," He had hardly got started with the work, however, when his quick ears caught the sounds of a distant car."," Sotva však začal, už svým jemným sluchem zachytil zdáli hukot automobilu."
"caught","catch","zachytil","zachytit","pf"," He had hardly got started with the work, however, when his quick ears caught the sounds of a distant car."," Sotva však začal, už svým jemným sluchem zachytil zdáli hukot automobilu."
"follow","follow","Sleduji","sledovat","impf"," “ It is my business to follow the details of Continental crime."," "" Sleduji z odborných důvodů dopodrobna zločiny na kontinentě."
"read","read","přečetl","přečíst","pf"," Who could possibly have read what happened at Prague and have any doubts as to the man ’ s guilt!"," Kdo si přečetl, co se odehrálo v Praze, sotva mohl zůstat na pochybách, zda je ten člověk vinen."
"happened","happen","odehrálo","odehrát","pf"," Who could possibly have read what happened at Prague and have any doubts as to the man ’ s guilt!"," Kdo si přečetl, co se odehrálo v Praze, sotva mohl zůstat na pochybách, zda je ten člověk vinen."
"saved","save","Zachránila","zachránit","pf"," It was a purely technical legal point and the suspicious death of a witness that saved him!"," Zachránila ho pouze právnická firma a podezřelé úmrtí jistého svědka."
"killed","kill","zabil","zabít","pf"," I am as sure that he killed his wife when the socalled ‘ accident ’ happened in the Splugen Pass as if I had seen him do it."," Jsem tak skálopevně přesvědčen, že při takzvané ' nehodě ' v Splugenském průsmyku svou choť zabil, jako kdybych ho byl pozoroval při činu."
"seen","see","pozoroval","pozorovat","impf"," I am as sure that he killed his wife when the socalled ‘ accident ’ happened in the Splugen Pass as if I had seen him do it."," Jsem tak skálopevně přesvědčen, že při takzvané ' nehodě ' v Splugenském průsmyku svou choť zabil, jako kdybych ho byl pozoroval při činu."
"observed","observe","poznamenal","poznamenat","pf"," “ I have the ordinary knowledge of the educated medical man, ” he observed with some stiffness."," "" Vím o nich tolik, co každý vzdělaný lékař, "" poznamenal pan Kent poněkud škrobeně."
"agree","agree","souhlasit","souhlasit","impf"," “ I have no doubt, sir, that you are fully competent, but I am sure that you will agree that in such a case a second opinion is valuable."," "" Vůbec nepochybuji o vaší odborné způsobilosti, milý pane, ale budete se mnou zajisté souhlasit, že v takovýchto případech bývá užitečné vyslechnout další názor."
"avoided","avoid","Vyhnuli","vyhnout","pf"," You have avoided this, I understand, for fear that pressure should be put upon you to segregate the patient. ”"," Vyhnuli jste se tomu, jak jsem vyrozuměl, z obav před nátlakem, aby byl pacient přemístěn do izolace. """
"said","say","řekl","říci","pf"," “ That is so, ” said Colonel Emsworth."," "" Přesně tak, "" řekl plukovník Emsworth."
"dominated","dominate","ovládl","ovládnout","pf"," The big, masterful aristocrat dominated the little room."," Vysoký, energický, sebejistý aristokrat ovládl nevelkou místnost."
"turned","turn","obrátil","obrátit","pf"," Then he turned upon me, gazing at me in the utmost amazement."," Pak se obrátil a zahleděl se na mne s nesmírným úžasem."
"asked","ask","zeptal","zeptat","pf"," ‘ How in the world did you come here? ’ he asked in amazement."," ' Jak jste se sem, pro všechno na světě, dostal? ' zeptal se, jako by svým očím nevěřil."
"played","play","hrál","hrát","impf"," For a short time he played polo at Hurlingham, but then this Prague affair got noised about and he had to leave."," Krátký čas hrál pólo v Hurlinghamu, ale pak se začala přetřásat ta pražská aféra a on se musel odporoučet."
"collects","collect","Sbírá","sbírat","impf"," He collects books and pictures."," Sbírá knihy a obrazy."
"written","write","sepsal","sepsat","pf"," He is, I believe, a recognized authority upon Chinese pottery and has written a book upon the subject. ”"," Pokud vím, je uznávanou autoritou na čínský porcelán a sepsal na toto téma knihu. """
"said","say","řekl","říci","pf"," “ A complex mind, ” said Holmes."," "" Složitá duše, "" řekl Holmes."
"tell","tell","vyprávím","vyprávět","impf"," Alas, that I should have to show my hand so when I tell my own story!"," Běda mi, že musím tak odhalovat karty, když vyprávím vlastní příběh!"
"heard","hear","Slyšeli","slyšet","impf"," We heard his quick, heavy step in the passage."," Slyšeli jsme jeho rychlé těžké kroky na chodbě."
"seen","see","neviděl","vidět","impf"," The door was flung open and he rushed in with bristling beard and twisted features, as terrible an old man as ever I have seen."," Dveře se rozletěly a on vtrhl dovnitř, vousy celé naježené a tvář zkřivenou : hrozivějšího starce jsem snad ještě neviděl."
"shown","show","uvedl","uvést","pf"," I was shown straight into his study, and there I found him, a huge, bow-backed man with a smoky skin and a straggling gray beard, seated behind his littered desk."," Lokaj mne uvedl přímo k němu do pracovny, a tak jsem ho poznal osobně : rozložitý, nahrbený muž snědé pleti, s ježatými prošedivělými vousy, usazený za přeplněným psacím stolem."
"saying","say","nemluvil","mluvit","impf"," “ I could deceive you by saying so, Mr. Holmes, but it would not be true."," "" Mohl bych vás oklamat, kdybych přitakal, pane Holmesi, ale nemluvil bych pravdu."
"examine","examine","vyslýchat","vyslýchat","impf"," It is said that the barrister who crams up a case with such care that he can examine an expert witness upon the Monday has forgotten all his forced knowledge before the Saturday."," Říkává se, že advokát, který prostuduje nějaký případ s takovou péčí, že v pondělí může vyslýchat svědka předvolaného jako znalce, do soboty všechny ty zhltané vědomosti zapomene."
"forgotten","forget","zapomene","zapomenout","pf"," It is said that the barrister who crams up a case with such care that he can examine an expert witness upon the Monday has forgotten all his forced knowledge before the Saturday."," Říkává se, že advokát, který prostuduje nějaký případ s takovou péčí, že v pondělí může vyslýchat svědka předvolaného jako znalce, do soboty všechny ty zhltané vědomosti zapomene."
"like","like","nechtěl","chtít","impf"," Certainly I should not like now to pose as an authority upon ceramics."," Jistěže bych nikde nechtěl vystupovat jako znalec čínského porculánu."
"shown","show","Neukázal","ukázat","pf"," I ’ ve never shown you my little store."," Neukázal jsem vám dosud svůj archiv."
"adjusted","adjust","vyrovnal","vyrovnat","pf"," He then closed the door behind the bulky form which followed him and carefully adjusted the heavy curtain over the latticed window."," Zamkl pak za mohutnou postavou, která mu vstoupila v patách, a pečlivě vyrovnal těžký závěs na zamřížovaném okně."
"write","write","napsal","napsat","pf"," For a long time he has worried me to write an experience of my own."," Už dlouhý čas na mne naléhá, abych některé své zážitky napsal sám."
"accuse","accuse","obviňoval","obviňovat","impf"," Perhaps I have rather invited this persecution, since I have often had occasion to point out to him how superficial are his own accounts and to accuse him of pandering to popular taste instead of confining himself rigidly to facts and figures."," Snad jsem si toto pronásledování vysloužil, jelikož jsem si často našel důvod mu vytknout, že líčí události příliš povrchně, a obviňoval jsem ho, že se podřizuje líbivému vkusu, namísto aby se přísně přidržoval fakt a čísel."
"remain","remain","zbývá","zbývat","impf"," It may well be that several explanations remain, in which case one tries test after test until one or other of them has a convincing amount of support."," Stává se, že zbývá několik vysvětlení, v kterémžto případě je podrobíte dalším a dalším ověřovacím zkouškám, a pro to či ono získáte přesvědčivé důkazy."
"apply","apply","Použijme","použít","pf"," We will now apply this principle to the case in point."," Použijme nyní toho principu v daném případě."
"presented","present","předložena","předložit","pf"," As it was first presented to me, there were three possible explanations of the seclusion or incarceration of this gentleman in an outhouse of his father ’ s mansion."," Když mi byla poprvé předložena fakta, nabízely se tři možné výklady, proč je dotyčný pán nucen dlít v odloučení nebo ve vazbě v malém domku na otcově panství."
"meet","meet","setkávám","setkávat","impf"," I like to meet him eye to eye and read for myself the stuff that he is made of."," Rád se setkávám s protivníkem osobně, abych posoudil, co utváří jeho povahu."
"written","write","psal","psát","impf"," But the letter was written in the afternoon, and a good deal has happened since then."," Ale psal jsem ten dopis odpoledne, a od té doby se toho přihodilo ještě mnoho."
"glanced","glance","pohlédla","pohlédnout","pf"," She curtseyed with a smile to Mr. Holmes, but glanced with some apprehension at the figure upon the sofa."," Udělala panu Holmesovi pukrle a usmála se na něho, ale pohlédla úzkostlivě na postavu ležící na otomanu."
"hurt","hurt","neublížili","ublížit","pf"," He has not been hurt at all. ”"," Vůbec jsme mu neublížili. """
"wanted","want","Chtěl","chtít","impf"," He wanted me to go with his wife to Germany yesterday, but that would hardly have suited your plans, would it, sir? ”"," Chtěl, abych zůstala s jeho paní, když včera odjížděli do Německa, ale to by se vám asi nehodilo, viďte? """
"see","see","starat","starat","impf"," It ’ s up to you to see that they don ’ t fall down."," Takže se máte starat, aby se nedostali do maléru."
"sat","sit","seděl","sedět","impf"," He was out of bed now, though you would not have guessed it from the published reports, and he sat with his much-bandaged head resting upon his hand in the depth of his favourite armchair."," Vstal již z lůžka, ač by se toho podle novinových zpráv nikdo nenadál, a seděl zabořen v oblíbeném křesle, podpíraje si důkladně ovázanou hlavu rukou."
"said","say","řekl","říci","pf"," “ Why, Holmes, ” I said, “ if one believed the papers, you are dying. ”"," "" Ale, Holmesi, "" řekl jsem, "" podle novin máte ležet na smrtelné posteli. """
"intended","intend","hodlal","hodlat","impf"," “ That, ” said he, “ is the very impression which I intended to convey."," "" Přesně takový dojem, "" odvětil, "" jsem hodlal vzbudit."
"tried","try","snažil","snažit","impf"," “ At least I have tried to. ”"," "" Přinejmenším jsem se snažil. """
"said","say","pravil","pravit","pf"," ‘ I rather thought I should see you sooner or later, Mr. Holmes, ’ said he."," ' Tušil jsem, že se dříve či později sejdeme, pane Holmesi, ' pravil."
"engaged","engage","Najal","najmout","pf"," ‘ You have been engaged, no doubt by General de Merville, to endeavour to stop my marriage with his daughter, Violet."," ' Najal si vás bezpochyby generál de Merville, abyste se pokusil překazit můj sňatek s jeho dcerou Violet."
"succeed","succeed","uspět","uspět","pf"," It is not a case in which you can possibly succeed."," V tomto případě nemůžete uspět."
"told","tell","vyprávěl","vyprávět","impf"," Then I pursued him, as I have told you, but without result. ”"," Pak jsem za ním běžel, jak jsem vám vyprávěl, leč bezúspěšně. """
"described","describe","popsal","popsat","pf"," When, after a considerable drive, we arrived at the strange old rambling house which my client had described, it was Ralph, the elderly butler, who opened the door."," Když jsme po delší jízdě dospěli k podivnému rozlehlému starobylému sídlu, jež můj klient popsal, přišel nám otevřít onen starý lokaj Ralph."
"arrived","arrive","přišel","přijít","pf"," When, after a considerable drive, we arrived at the strange old rambling house which my client had described, it was Ralph, the elderly butler, who opened the door."," Když jsme po delší jízdě dospěli k podivnému rozlehlému starobylému sídlu, jež můj klient popsal, přišel nám otevřít onen starý lokaj Ralph."
"opened","open","otevřít","otevřít","pf"," When, after a considerable drive, we arrived at the strange old rambling house which my client had described, it was Ralph, the elderly butler, who opened the door."," Když jsme po delší jízdě dospěli k podivnému rozlehlému starobylému sídlu, jež můj klient popsal, přišel nám otevřít onen starý lokaj Ralph."
"looking","look","vyhlíží","vyhlížet","impf"," From below the two glowing ends of their cigars might have been the smouldering eyes of some malignant fiend looking down in the darkness."," Kdyby sem byl někdo vzhlédl zdola, mohl pokládat žhnoucí špičky jejich doutníků za ohnivé oči nějaké zlolajné nestvůry, která vyhlíží do tmy."
