"experienced","experience","měl","mít","impf"," For all my pleadings, the likes of Sasaki had little patience for the Tortoise 's difficulties and at times the atmosphere threatened to become as hostile for my companion as any he had experienced at Master Takeda 's firm."," Přes všechny mé přímluvy měl Sasaki a jemu podobní málo trpělivosti s Želvovými obtížemi a občas hrozilo, že se můj kolega ocitne v atmosféře stejně nepřátelské jako v podniku mistra Takedy."
"threatened","threaten","hrozilo","hrozit","impf"," For all my pleadings, the likes of Sasaki had little patience for the Tortoise 's difficulties and at times the atmosphere threatened to become as hostile for my companion as any he had experienced at Master Takeda 's firm."," Přes všechny mé přímluvy měl Sasaki a jemu podobní málo trpělivosti s Želvovými obtížemi a občas hrozilo, že se můj kolega ocitne v atmosféře stejně nepřátelské jako v podniku mistra Takedy."
"hide","hide","skrývat","skrývat","impf"," some family members making no attempts to hide their hostility towards us, and a less understanding buyer might well have taken offence and abandoned the whole matter."," Někteří členové rodiny se ani nenamáhali skrývat před námi nevraživost a méně ohleduplný zájemce by se zřejmě urazil a celou záležitost vzdal."
"encounter","encounter","potkal","potkat","pf"," Even in later years I would sometimes encounter by chance some member of the family who, instead of exchanging the usual kind of polite talk, would stand there in the street interrogating me as to the state of the house and any alterations I had made."," Když jsem ještě po několika letech náhodou někoho z nich potkal, zastavil mě a místo obvyklých zdvořilostí mě přímo na ulici vyslýchal, v jakém je dům stavu a jaké změny jsem v něm provedl."
"interrogating","interrogate","vyslýchal","vyslýchat","impf"," Even in later years I would sometimes encounter by chance some member of the family who, instead of exchanging the usual kind of polite talk, would stand there in the street interrogating me as to the state of the house and any alterations I had made."," Když jsem ještě po několika letech náhodou někoho z nich potkal, zastavil mě a místo obvyklých zdvořilostí mě přímo na ulici vyslýchal, v jakém je dům stavu a jaké změny jsem v něm provedl."
"made","make","provedl","provést","pf"," Even in later years I would sometimes encounter by chance some member of the family who, instead of exchanging the usual kind of polite talk, would stand there in the street interrogating me as to the state of the house and any alterations I had made."," Když jsem ještě po několika letech náhodou někoho z nich potkal, zastavil mě a místo obvyklých zdvořilostí mě přímo na ulici vyslýchal, v jakém je dům stavu a jaké změny jsem v něm provedl."
"ruined","ruin","Zkazil","zkazit","pf"," You 're saying I 've ruined others? '"," Zkazil jsem snad i jiné? """
"see","see","nechápu","chápat","impf"," ' Excuse me, Noriko, I do n't quite see your point."," "" Promiň, Noriko, ale nechápu, kam tím míříš."
"saying","say","říct","říci","pf"," You 're saying the azaleas are unbalanced too? '"," Chceš snad říct, že i azalky působí nevyváženě? """
"left","leave","nechat","nechat","pf"," ' You should have left things as they were. '"," "" Měl jste to nechat, jak to bylo. """
"pulled","pull","Zatáhl","zatáhnout","pf"," I pulled the bell rope repeatedly and shouted for someone to come and receive me, but there was no response."," Zatáhl jsem několikrát za šňůru od zvonku a volal jsem, ať mi někdo přijde otevřít, ale marně."
"come","come","přijde","přijít","pf"," I pulled the bell rope repeatedly and shouted for someone to come and receive me, but there was no response."," Zatáhl jsem několikrát za šňůru od zvonku a volal jsem, ať mi někdo přijde otevřít, ale marně."
"decided","decide","rozhodl","rozhodnout","pf"," Eventually I decided to let myself in, but as I pulled back the outer door, a uniformed policeman appeared in the entryway."," Nakonec jsem se rozhodl, že vejdu sám, ale sotva jsem otevřel venkovní dveře, objevil se v chodbičce uniformovaný policista."
"appeared","appear","objevil","objevit","pf"," Eventually I decided to let myself in, but as I pulled back the outer door, a uniformed policeman appeared in the entryway."," Nakonec jsem se rozhodl, že vejdu sám, ale sotva jsem otevřel venkovní dveře, objevil se v chodbičce uniformovaný policista."
"want","want","chcete","chtít","impf"," ' What do you want? ' he demanded."," "" Co chcete? "" vyštěkl."
"looking","look","Hledám","hledat","impf"," ' I came looking for Mr Kuroda."," "" Hledám pana Kurodu."
"advise","advise","Radím","radit","impf"," ' I advise you to go home, ' the officer said."," "" Radím vám, abyste se vrátil domů, "" vyzval mě policista."
"made","make","provedla","provést","pf"," No doubt, Mrs Kawakami could point out numerous changes - her little ' improvements ' - that she has made over the years."," Paní Kawakamiová by nepochybně vyjmenovala řadu změn - svých "" vylepšení "" -, co za ty roky provedla."
"came","come","přijela","přijet","pf"," Over this past year, however, I was able to make a certain amount of progress, and by the time Setsuko came down to visit us again last month, the veranda was more or less entirely restored."," Za poslední rok se mi přece jen podařilo s prací pokročit, a když Secuko před měsícem přijela podruhé, našla už verandu z větší části opravenou."
"taken","take","vzala","vzít","pf"," Noriko had taken time off work for her sister 's visit, and so, with the good weather continuing, my two daughters spent a lot of their time out there as of old."," Noriko si vzala na návštěvu sestry volno z práce, a protože se pěkné počasí udrželo, trávily hodně času venku jako dřív."
"laughed","laugh","zasmál","zasmát","pf"," ' Not at all, Sensei. ' I laughed self-consciously."," "" Ale vůbec ne, sensei, "" zasmál jsem se rozpačitě."
"talked","talk","hovořili","hovořit","impf"," For a little time after that, we talked of other matters, of anything which came to mind."," Chvíli jsme hovořili, o čem nás zrovna napadlo."
"do","do","vzalo","vzít","pf"," Why she should believe I am keeping something from her, I do not know."," Nevím, kde se v ní vzalo podezření, že před ní něco skrývám."
"withdrawing","withdraw","odvolali","odvolat","pf"," If the Miyakes had some special reason for withdrawing like that, it would stand to reason they would not confide in me about it."," Pokud Mijakovi odvolali svatbu z nějakého zvláštního důvodu, rozhodně se mi s ním nesvěřili."
"confide","confide","nesvěřili","svěřit","pf"," If the Miyakes had some special reason for withdrawing like that, it would stand to reason they would not confide in me about it."," Pokud Mijakovi odvolali svatbu z nějakého zvláštního důvodu, rozhodně se mi s ním nesvěřili."
"recall","recall","vzpomínám","vzpomínat","impf"," but then I do recall quite distinctly that when I threw a glance towards young Mitsuo, he was watching me with a peculiar intensity."," Mohlo se mi to samozřejmě docela dobře jen zdát, ale přesto si vzpomínám, že jsem si všiml, jak mě Micuo velmi napjatě pozoruje."
"watching","watch","pozoruje","pozorovat","impf"," but then I do recall quite distinctly that when I threw a glance towards young Mitsuo, he was watching me with a peculiar intensity."," Mohlo se mi to samozřejmě docela dobře jen zdát, ale přesto si vzpomínám, že jsem si všiml, jak mě Micuo velmi napjatě pozoruje."
"seem","seem","zdá","zdát","impf"," ' Feelings may well be running high, but people seem to be going too far now."," "" Lidé jsou možná opravdu roztrpčeni, ale mně se zdá, že zacházejí příliš daleko."
"looked","look","Díval","dívat","impf"," He looked down at the blank sheet thoughtfully, but made no move to start drawing."," Díval se zamyšleně na čistý papír, ale ani se nepohnul."
"try","try","zkusil","zkusit","pf"," ' Why do n't you try and draw something you saw yesterday? ' I suggested."," "" Co kdybys mi zkusil nakreslit, cos včera viděl? "" navrhl jsem."
"draw","draw","nakreslit","nakreslit","pf"," ' Why do n't you try and draw something you saw yesterday? ' I suggested."," "" Co kdybys mi zkusil nakreslit, cos včera viděl? "" navrhl jsem."
"saw","see","viděl","vidět","impf"," ' Why do n't you try and draw something you saw yesterday? ' I suggested."," "" Co kdybys mi zkusil nakreslit, cos včera viděl? "" navrhl jsem."
"suggested","suggest","navrhl","navrhnout","pf"," ' Why do n't you try and draw something you saw yesterday? ' I suggested."," "" Co kdybys mi zkusil nakreslit, cos včera viděl? "" navrhl jsem."
"saw","see","viděl","vidět","impf"," ' Something you saw when you first arrived in the city. '"," "" Něco, cos viděl, když jsi přijel do města. """
"arrived","arrive","přijel","přijet","pf"," ' Something you saw when you first arrived in the city. '"," "" Něco, cos viděl, když jsi přijel do města. """
"looking","look","hleděl","hledět","impf"," Ichiro went on looking at the sketchpad."," Ičiró dál hleděl na čistou stránku."
"say","say","říct","říci","pf"," ' I suppose you might say that."," "" Možná by to tak dalo říct."
"says","say","povídala","povídat","impf"," Is that what your mother says? '"," To ti povídala maminka? """
"see","see","vidím","vidět","impf"," However, I see I am drifting."," Ale jak vidím, nechávám se opět unášet proudem vzpomínek."
"drifting","drift","unášet","unášet","impf"," However, I see I am drifting."," Ale jak vidím, nechávám se opět unášet proudem vzpomínek."
"record","record","zaznamenat","zaznamenat","pf"," My intention had been to record here that conversation I had with Setsuko last month when she came into the reception room to change the flowers."," Měl jsem původně v úmyslu zaznamenat rozhovor, který jsme před měsícem vedli se Secuko, když přišla do přijímacího pokoje vyměnit květiny."
"came","come","přišla","přijít","pf"," My intention had been to record here that conversation I had with Setsuko last month when she came into the reception room to change the flowers."," Měl jsem původně v úmyslu zaznamenat rozhovor, který jsme před měsícem vedli se Secuko, když přišla do přijímacího pokoje vyměnit květiny."
"change","change","vyměnit","vyměnit","pf"," My intention had been to record here that conversation I had with Setsuko last month when she came into the reception room to change the flowers."," Měl jsem původně v úmyslu zaznamenat rozhovor, který jsme před měsícem vedli se Secuko, když přišla do přijímacího pokoje vyměnit květiny."
"think","think","nemyslí","myslet","impf"," Well, your mother for one does n't seem to think so."," No, například tvoje maminka si to nemyslí."
"said","say","řekl","říci","pf"," It was just something I said to your Uncle Taro once, Ichiro, it was nothing very serious."," Způsobil jsem to něčím, co jsem před časem trochu lehkomyslně řekl strýčku Tarovi."
"picked","pick","vzala","vzít","pf"," Your mother seems to have picked it up far too earnestly."," Maminka to zřejmě vzala příliš vážně."
"remember","remember","nevzpomínám","vzpomínat","impf"," I hardly remember what I was talking to Uncle Taro about at the time, but Oji just happened to suggest he had one or two things in common with people like Mr Naguchi."," Už si skoro ani nevzpomínám, o čem jsme tenkrát se strýčkem Tarem mluvili, ale prostě jsem naznačil, že jsem měl s lidmi jako pan Naguči trochu společného."
"talking","talk","mluvili","mluvit","impf"," I hardly remember what I was talking to Uncle Taro about at the time, but Oji just happened to suggest he had one or two things in common with people like Mr Naguchi."," Už si skoro ani nevzpomínám, o čem jsme tenkrát se strýčkem Tarem mluvili, ale prostě jsem naznačil, že jsem měl s lidmi jako pan Naguči trochu společného."
"suggest","suggest","naznačil","naznačit","pf"," I hardly remember what I was talking to Uncle Taro about at the time, but Oji just happened to suggest he had one or two things in common with people like Mr Naguchi."," Už si skoro ani nevzpomínám, o čem jsme tenkrát se strýčkem Tarem mluvili, ale prostě jsem naznačil, že jsem měl s lidmi jako pan Naguči trochu společného."
"entertain","entertain","baví","bavit","impf"," He and his dancers have been most kind to entertain us."," "" Je od něj a jeho tanečnic laskavé, že nás tak baví."
"visited","visit","navštěvují","navštěvovat","impf"," But then I cannot help thinking, Sensei, we have been visited by their like so often these past few months. '"," Ale pořád mě napadá, sensei, že nás posledních pár měsíců podobní lidé navštěvují dost často. """
"leaning","lean","opřel","opřít","pf"," At one point during the meal, I can recall Dr Saito leaning back comfortably in his chair, saying :"," V jednu chvíli se pan doktor Saitó na židli pohodlně opřel a prohodil :"
"sat","sit","Posadil","posadit","pf"," He sat next to me, so naturally I asked him if he was all right and advised him to visit the clinic."," Posadil se vedle mě, takže jsem se ho pochopitelně zeptal, jestli se cítí dobře, a radil jsem mu, aby zašel do nemocnice."
"asked","ask","zeptal","zeptat","pf"," He sat next to me, so naturally I asked him if he was all right and advised him to visit the clinic."," Posadil se vedle mě, takže jsem se ho pochopitelně zeptal, jestli se cítí dobře, a radil jsem mu, aby zašel do nemocnice."
"advised","advise","radil","radit","impf"," He sat next to me, so naturally I asked him if he was all right and advised him to visit the clinic."," Posadil se vedle mě, takže jsem se ho pochopitelně zeptal, jestli se cítí dobře, a radil jsem mu, aby zašel do nemocnice."
"mention","mention","zmínil","zmínit","pf"," Then she said : ' As a matter of fact, Father, it so happened that last night we were discussing one or two things, and Taro-san happened to mention a conversation he had had with you just last week. A conversation concerning the composer who recently committed suicide. '"," "" Včera večer se Taró - san jen tak mimochodem zmínil, že jste spolu minulý týden hovořili o nějakém skladateli, co před nedávnem spáchal sebevraždu. """
"discussing","discuss","hovořili","hovořit","impf"," Then she said : ' As a matter of fact, Father, it so happened that last night we were discussing one or two things, and Taro-san happened to mention a conversation he had had with you just last week. A conversation concerning the composer who recently committed suicide. '"," "" Včera večer se Taró - san jen tak mimochodem zmínil, že jste spolu minulý týden hovořili o nějakém skladateli, co před nedávnem spáchal sebevraždu. """
"committed","commit","spáchal","spáchat","pf"," Then she said : ' As a matter of fact, Father, it so happened that last night we were discussing one or two things, and Taro-san happened to mention a conversation he had had with you just last week. A conversation concerning the composer who recently committed suicide. '"," "" Včera večer se Taró - san jen tak mimochodem zmínil, že jste spolu minulý týden hovořili o nějakém skladateli, co před nedávnem spáchal sebevraždu. """
"remember","remember","pamatuji","pamatovat","impf"," Ah yes, I remember that conversation."," Ano, jistě, pamatuji se na ten rozhovor."
"mean","mean","Chtěl","chtít","impf"," ' But what I mean, Taro, is that it 's all the more pity since we knew each of other 's reputations in the art world all that time. '"," "" Chtěl jsem tím říci, Taró, oč je to větší škoda, když jsme přitom oba celou dobu věděli, co ten druhý v uměleckém světě znamená. """
"mean","mean","znamená","znamenat","impf"," ' But what I mean, Taro, is that it 's all the more pity since we knew each of other 's reputations in the art world all that time. '"," "" Chtěl jsem tím říci, Taró, oč je to větší škoda, když jsme přitom oba celou dobu věděli, co ten druhý v uměleckém světě znamená. """
"does","do","Dělá","dělat","impf"," He does that when he ca n't fall asleep. '"," Dělá to, když nemůže usnout. """
"fall","fall","usnout","usnout","pf"," He does that when he ca n't fall asleep. '"," Dělá to, když nemůže usnout. """
"take","take","brát","brát","impf"," It was so wicked of Father to take him to see a film like that. '"," To byla zlomyslnost, tatínku, brát ho na takový film. """
"enjoyed","enjoy","Líbilo","líbit","impf"," ' He enjoyed it. '"," "" Líbilo se mu to. """
"think","think","Myslím","myslet","impf"," ' I think Father just wanted to see it himself, ' Noriko said to her sister with a grin."," "" Myslím, že ho hlavně chtěl vidět sám tatínek, "" ušklíbla se Noriko na sestru."
"wanted","want","chtěl","chtít","impf"," ' I think Father just wanted to see it himself, ' Noriko said to her sister with a grin."," "" Myslím, že ho hlavně chtěl vidět sám tatínek, "" ušklíbla se Noriko na sestru."
"see","see","vidět","vidět","impf"," ' I think Father just wanted to see it himself, ' Noriko said to her sister with a grin."," "" Myslím, že ho hlavně chtěl vidět sám tatínek, "" ušklíbla se Noriko na sestru."
"dragged","drag","Tahat","tahat","impf"," Being dragged along to a nasty film like that. '"," Tahat ho na takový příšerný film. """
"mean","mean","chceš","chtít","impf"," Now what do you mean by that, Ichiro? '"," Co tím chceš říct, Ičiró? """
"sleep","sleep","usnout","usnout","pf"," Because if he worries, he wo n't get to sleep."," Protože jinak nebude moci usnout."
"sleep","sleep","nespí","spát","impf"," And if old people do n't sleep, they get ill. '"," A když starší lidé nespí, jsou z toho nemocní. """
"promises","promise","slibuje","slibovat","impf"," Oji promises not to worry."," Odží ti slibuje, že si nebude dělat žádné starosti."
"saw","see","viděl","vidět","impf"," I have retained a vivid picture of that first time I saw Matsuda."," Dosud mám živě před sebou Macudu, jak jsem ho tenkrát viděl poprvé."
"stopped","stop","ustal","ustat","pf"," The rain had stopped and the sun was out."," Déšť už ustal a vylézalo slunce."
"dressed","dress","oblečen","obléci","pf"," He was dressed too dandyishly to be a policeman;"," Na policistu byl oblečen příliš švihácky."
"heard","hear","slyšel","slyšet","impf"," I have heard much about you, sir. '"," Už jsem o vás mnoho slyšel, pane. """
"talking","talk","hovořili","hovořit","impf"," I believe we went on talking for several moments there outside my gateway, and I am sure I am not mistaken in recalling that Dr Saito, on that same occasion, made several more references to my work and career."," Určitě jsme spolu ještě nějakou chvíli hovořili a vzpomínám si mimo veškerou pochybnost, že se pan doktor Saitó několikrát zmínil o mé práci a umělecké dráze."
"recalling","recall","vzpomínám","vzpomínat","impf"," I believe we went on talking for several moments there outside my gateway, and I am sure I am not mistaken in recalling that Dr Saito, on that same occasion, made several more references to my work and career."," Určitě jsme spolu ještě nějakou chvíli hovořili a vzpomínám si mimo veškerou pochybnost, že se pan doktor Saitó několikrát zmínil o mé práci a umělecké dráze."
"doubt","doubt","Pochybuji","pochybovat","impf"," ' I doubt that, ' I said, with a laugh."," "" Pochybuji, "" zasmál jsem se."
"frighten","frighten","vyděsit","vyděsit","pf"," ' But it may well frighten your mother and your aunt. '"," "" Ale mámu a tetu by asi film vyděsit mohl. """
"laughed","laugh","smál","smát","impf"," He rolled over on to his back and laughed some more."," Převalil se na záda a smál se dál."
"shouted","shout","křičel","křičet","impf"," ' Mother and Aunt Noriko will be really scared! ' he shouted at the ceiling."," "" Máma a teta Noriko, ty se budou bát! "" křičel do stropu."
"enjoy","enjoy","líbit","líbit","impf"," ' But we men will enjoy it, wo n't we, Ichiro?"," "" Ale nám mužským se to líbit bude, ne, Ičiró?"
"go","go","Půjdeme","jít","impf"," We 'll go tomorrow."," Půjdeme zítra."
"like","like","Chtěl","chtít","impf"," Would you like that?"," Chtěl bys?"
"thought","think","myslet","myslet","impf"," And after the war, Mr Naguchi thought his songs had been - well - a sort of mistake."," Pan Naguči si začal myslet, že se těmi písničkami, abych tak řekl, dopustil chyby."
"write","write","napíše","napsat","pf"," Perhaps he will write to you. '"," Třeba vám napíše. """
"shouting","shout","křičeli","křičet","impf"," Out in the corridor, the children seemed to be banging their tricycle against the wall not far from us and shouting at each other."," Chlapci na chodbě naráželi tříkolkou do zdi nedaleko dveří a křičeli na sebe."
"saying","say","řeknu","říci","pf"," ' Forgive me for saying this, Mr Enchi, ' I said."," "" Promiňte mi, pane Enči, že to tak řeknu, "" začal jsem."
"said","say","řeknu","říci","pf"," ' Forgive me for saying this, Mr Enchi, ' I said."," "" Promiňte mi, pane Enči, že to tak řeknu, "" začal jsem."
"think","think","nemyslíte","myslet","impf"," We women are given so little time for such pursuits, do n't you think? '"," Ženám zbývá na takové záliby velmi málo času, nemyslíte? """
"gazing","gaze","hleděl","hledět","impf"," ' I have very poor appreciation of music myself, ' Taro Saito put in, gazing unflinchingly at Noriko."," "" Já hudbě pramálo rozumím, "" prohodil Taró Saitó a hleděl upřeně na Noriko."
"watched","watch","pozoroval","pozorovat","impf"," In fact, as I watched Ichiro that day, pressing his face against the glass to see the street below, I could see how much he was coming to resemble his father."," Jak jsem pozoroval Ičira, který měl tvář přilepenou na skle, aby mohl sledovat na ruch pod sebou, všiml jsem si, že se stále víc podobá otci."
"see","see","pozoroval","pozorovat","impf"," In fact, as I watched Ichiro that day, pressing his face against the glass to see the street below, I could see how much he was coming to resemble his father."," Jak jsem pozoroval Ičira, který měl tvář přilepenou na skle, aby mohl sledovat na ruch pod sebou, všiml jsem si, že se stále víc podobá otci."
"see","see","pozoroval","pozorovat","impf"," In fact, as I watched Ichiro that day, pressing his face against the glass to see the street below, I could see how much he was coming to resemble his father."," Jak jsem pozoroval Ičira, který měl tvář přilepenou na skle, aby mohl sledovat na ruch pod sebou, všiml jsem si, že se stále víc podobá otci."
"watched","watch","sledovat","sledovat","impf"," In fact, as I watched Ichiro that day, pressing his face against the glass to see the street below, I could see how much he was coming to resemble his father."," Jak jsem pozoroval Ičira, který měl tvář přilepenou na skle, aby mohl sledovat na ruch pod sebou, všiml jsem si, že se stále víc podobá otci."
"see","see","sledovat","sledovat","impf"," In fact, as I watched Ichiro that day, pressing his face against the glass to see the street below, I could see how much he was coming to resemble his father."," Jak jsem pozoroval Ičira, který měl tvář přilepenou na skle, aby mohl sledovat na ruch pod sebou, všiml jsem si, že se stále víc podobá otci."
"see","see","sledovat","sledovat","impf"," In fact, as I watched Ichiro that day, pressing his face against the glass to see the street below, I could see how much he was coming to resemble his father."," Jak jsem pozoroval Ičira, který měl tvář přilepenou na skle, aby mohl sledovat na ruch pod sebou, všiml jsem si, že se stále víc podobá otci."
"resemble","resemble","podobá","podobat","impf"," In fact, as I watched Ichiro that day, pressing his face against the glass to see the street below, I could see how much he was coming to resemble his father."," Jak jsem pozoroval Ičira, který měl tvář přilepenou na skle, aby mohl sledovat na ruch pod sebou, všiml jsem si, že se stále víc podobá otci."
"investigate","investigate","pátrají","pátrat","impf"," Let them investigate, they can only find things that will be to our advantage. '"," Jen ať si pátrají - zjistí jen dobré."
"find","find","zjistí","zjistit","pf"," Let them investigate, they can only find things that will be to our advantage. '"," Jen ať si pátrají - zjistí jen dobré."
"made","make","nedělají","dělat","impf"," And I made a point of adding : ' In any case, they 're doing no more than they would if we were negotiating a marriage with them."," Vždyť nedělají víc, než kdybychom s nimi jednali o sňatku."
"doing","do","nedělají","dělat","impf"," And I made a point of adding : ' In any case, they 're doing no more than they would if we were negotiating a marriage with them."," Vždyť nedělají víc, než kdybychom s nimi jednali o sňatku."
"doing","do","jednali","jednat","impf"," And I made a point of adding : ' In any case, they 're doing no more than they would if we were negotiating a marriage with them."," Vždyť nedělají víc, než kdybychom s nimi jednali o sňatku."
"negotiating","negotiate","jednali","jednat","impf"," And I made a point of adding : ' In any case, they 're doing no more than they would if we were negotiating a marriage with them."," Vždyť nedělají víc, než kdybychom s nimi jednali o sňatku."
