"admire","admire","obdivoval","obdivovat","impf"," I paused a moment to admire that view, as I had often done years before."," Na chvíli jsem se zastavil a jako před lety jsem obdivoval krajinu."
"renovated","renovate","opravili","opravit","pf"," I wondered to myself if the villa had been renovated, but it was impossible to ascertain from such a distance."," Nedokázal jsem na tu dálku rozeznat, zda budovy statku opravili."
"remained","remain","zůstal","zůstat","pf"," In fact, it is probably this very quality of Shintaro 's - this sense that he has remained somehow unscathed by things - which has led me to enjoy his company more and more over these recent years."," Právě tenhle Šintarův rys - že totiž zůstal nedotčen událostmi - způsobil, že mě v posledních letech jeho společnost těší stále víc."
"enjoy","enjoy","těší","těšit","impf"," In fact, it is probably this very quality of Shintaro 's - this sense that he has remained somehow unscathed by things - which has led me to enjoy his company more and more over these recent years."," Právě tenhle Šintarův rys - že totiž zůstal nedotčen událostmi - způsobil, že mě v posledních letech jeho společnost těší stále víc."
"denying","deny","popřít","popřít","pf"," As for Mrs Kawakami, although she will do her best not to allow the current mood to affect her, there is no denying she has been greatly aged by the war years."," Paní Kawakamiová se sice ze všech sil snaží nepodléhat dnešním náladám, ale nelze popřít, že během válečných let hodně zestárla."
"suppose","suppose","připustit","připustit","pf"," Then again, when I consider the sort of insinuations Setsuko had been making in Kawabe Park earlier that same day, I suppose I have to admit the possibility that she did say something along such lines. In any case, I recall Setsuko concluding by saying :"," Ale když si zase vybavím ty její narážky z dopolední procházky v parku Kawabe, musím přece jen připustit možnost, že něco takového opravdu podotkla."
"admit","admit","připustit","připustit","pf"," Then again, when I consider the sort of insinuations Setsuko had been making in Kawabe Park earlier that same day, I suppose I have to admit the possibility that she did say something along such lines. In any case, I recall Setsuko concluding by saying :"," Ale když si zase vybavím ty její narážky z dopolední procházky v parku Kawabe, musím přece jen připustit možnost, že něco takového opravdu podotkla."
"fear","fear","obávám","obávat","impf"," ' Besides, I fear Suichi would not wish Ichiro to drink sake until he is a little older."," "" A navíc se obávám, že by si Suiči nepřál, aby Ičiró pil saké, dokud nebude o něco starší."
"wish","wish","nepřál","přát","impf"," ' Besides, I fear Suichi would not wish Ichiro to drink sake until he is a little older."," "" A navíc se obávám, že by si Suiči nepřál, aby Ičiró pil saké, dokud nebude o něco starší."
"drink","drink","pil","pít","impf"," ' Besides, I fear Suichi would not wish Ichiro to drink sake until he is a little older."," "" A navíc se obávám, že by si Suiči nepřál, aby Ičiró pil saké, dokud nebude o něco starší."
"aspires","aspire","snaží","snažit","impf"," For indeed, a man who aspires to rise above the mediocre, to be something more than ordinary, surely deserves admiration, even if in the end he fails and loses a fortune on account of his ambitions."," Vždyť přece snaží - li se člověk pozvednout nad prostřednost, dosáhnout něčeho víc než průměrní lidé, zaslouží si určitě obdiv, i když nakonec neuspěje a své ctižádosti obětuje jmění."
"deserves","deserve","zaslouží","zasloužit","pf"," For indeed, a man who aspires to rise above the mediocre, to be something more than ordinary, surely deserves admiration, even if in the end he fails and loses a fortune on account of his ambitions."," Vždyť přece snaží - li se člověk pozvednout nad prostřednost, dosáhnout něčeho víc než průměrní lidé, zaslouží si určitě obdiv, i když nakonec neuspěje a své ctižádosti obětuje jmění."
"die","die","neumíral","umírat","impf"," It is my belief, furthermore, that Sugimura did not die an unhappy man."," Navíc věřím, že Sugimura neumíral jako nešťastný člověk."
"wished","wish","chtěla","chtít","impf"," ' I merely wished to say, ' she went on, ' once the negotiations begin in earnest, it may be as well if Father were to take certain precautionary steps. '"," "" Pouze jsem chtěla říci, "" pokračovala, "" že jakmile se začne jednat vážně, měl by tatínek předejít určitým nedorozuměním. """
"say","say","říci","říci","pf"," ' I merely wished to say, ' she went on, ' once the negotiations begin in earnest, it may be as well if Father were to take certain precautionary steps. '"," "" Pouze jsem chtěla říci, "" pokračovala, "" že jakmile se začne jednat vážně, měl by tatínek předejít určitým nedorozuměním. """
"went","go","pokračovala","pokračovat","impf"," ' I merely wished to say, ' she went on, ' once the negotiations begin in earnest, it may be as well if Father were to take certain precautionary steps. '"," "" Pouze jsem chtěla říci, "" pokračovala, "" že jakmile se začne jednat vážně, měl by tatínek předejít určitým nedorozuměním. """
"went","go","začne","začít","pf"," ' I merely wished to say, ' she went on, ' once the negotiations begin in earnest, it may be as well if Father were to take certain precautionary steps. '"," "" Pouze jsem chtěla říci, "" pokračovala, "" že jakmile se začne jednat vážně, měl by tatínek předejít určitým nedorozuměním. """
"begin","begin","začne","začít","pf"," ' I merely wished to say, ' she went on, ' once the negotiations begin in earnest, it may be as well if Father were to take certain precautionary steps. '"," "" Pouze jsem chtěla říci, "" pokračovala, "" že jakmile se začne jednat vážně, měl by tatínek předejít určitým nedorozuměním. """
"go","go","postupovat","postupovat","impf"," Naturally, we 'll go carefully."," Samozřejmě budeme postupovat opatrně."
"hire","hire","Najmeme","najmout","pf"," We 'll hire the same detective as last year."," Najmeme si téhož detektiva jako loni."
"understand","understand","pochopí","pochopit","pf"," But it is perhaps easier to understand the aloofness he displayed on such occasions if one has oneself been in a position in which one is constantly looked up to and admired."," Člověk možná snáz pochopí podobný odstup, pokud se sám ocitl v postavení, kdy ho ostatní neustále obdivují a vzhlížejí k němu."
"admired","admire","obdivují","obdivovat","impf"," But it is perhaps easier to understand the aloofness he displayed on such occasions if one has oneself been in a position in which one is constantly looked up to and admired."," Člověk možná snáz pochopí podobný odstup, pokud se sám ocitl v postavení, kdy ho ostatní neustále obdivují a vzhlížejí k němu."
"means","mean","nechce","chtít","impf"," For it is by no means desirable that one be always instructing and pronouncing to one 's pupils;"," Nikdo přece nechce své žáky neustále poučovat a opravovat."
"reflect","reflect","odrážela","odrážet","impf"," The decor would reflect the new spirit, and any patron incompatible with that spirit would be firmly encouraged to leave."," "" Tohoto ducha by odrážela výzdoba interiéru a hosté, kteří by podobné nadšení nesdíleli, budou vyzváni, aby okamžitě odešli."
"leave","leave","odešli","odejít","pf"," The decor would reflect the new spirit, and any patron incompatible with that spirit would be firmly encouraged to leave."," "" Tohoto ducha by odrážela výzdoba interiéru a hosté, kteří by podobné nadšení nesdíleli, budou vyzváni, aby okamžitě odešli."
"reflect","reflect","odrážejí","odrážet","impf"," Furthermore, it is the owner 's intention that the establishment be a place where this city 's artists and writers whose works most reflect the new spirit can gather and drink together."," Majitel se rovněž vynasnaží poskytnout prostor umělcům a spisovatelům, jejichž díla nejvíce odrážejí ducha nové doby, aby se zde mohli scházet a společně diskutovat."
"secured","secure","zajistil","zajistit","pf"," With respect to this last point, I have myself secured the support of various of my colleagues, among them the painter, Masayuki Harada; the playwright, Misumi;"," Právě proto jsem osobně zajistil podporu různých kolegů, mezi nimi malíře Masajukiho Harady, dramatika Misumiho a novinářů Šigea Ocudžiho a Eidžiho Nacukiho."
"lay","lie","leželo","ležet","impf"," The pond lay amidst sunshine at the far end of the garden and we proceeded with care along the stepping stones that ran across the smooth mounds of moss."," Na protějším konci leželo jezírko zalité sluncem a my jsme k němu opatrně přecházeli z kamene na kámen mezi oblými polštářky mechu."
"looking","look","hleděli","hledět","impf"," It was while we were standing at the edge of the pond, looking into the thick green water, that a sound made us both glance up."," Stáli jsme na okraji jezírka a hleděli do sytě zelené vody, když nás přiměl vzhlédnout přiměk šramot."
"made","make","přiměl","přimět","pf"," It was while we were standing at the edge of the pond, looking into the thick green water, that a sound made us both glance up."," Stáli jsme na okraji jezírka a hleděli do sytě zelené vody, když nás přiměl vzhlédnout přiměk šramot."
"see","see","nedíváme","dívat","impf"," ' You know full well, Ono, we do not see things so simply."," "" Víš velice dobře, že se na věci nedíváme tak zjednodušeně."
"exist","exist","neexistuje","existovat","impf"," The fact is, the Okada-Shingen does not exist in isolation."," Okada - Šingen neexistuje jako něco izolovaného."
"think","think","uvažují","uvažovat","impf"," There are young men like us in all walks of life - in politics, in the military - who think the same way."," Kam se podíváš, všude - mezi politiky, v armádě - najdeš mladé lidi, jako jsme my, a uvažují stejně."
"care","care","záleží","záležet","impf"," It just so happens that some of us care deeply about art and wish to see it responding to the world of today."," Některým z nás také shodou okolností hluboce záleží na umění a rádi bychom, aby odráželo dnešní svět."
"walking","walk","šel","jít","impf"," I was walking somewhere, making my way through what was left of our old pleasure district, looking from under my umbrella at those skeletal remains."," Někam jsem šel, cestou jsem procházel zbytky naší zábavní čtvrti a zpod deštníku jsem pokukoval po trčících kostrách domů."
"walking","walk","procházel","procházet","impf"," I was walking somewhere, making my way through what was left of our old pleasure district, looking from under my umbrella at those skeletal remains."," Někam jsem šel, cestou jsem procházel zbytky naší zábavní čtvrti a zpod deštníku jsem pokukoval po trčících kostrách domů."
"paid","pay","nevěnoval","věnovat","impf"," I remember there were workmen wandering around that day, and so at first I paid no attention to the figure standing looking at one of the burnt-out buildings."," Mezi nimi bloumali nějací dělníci, takže jsem zpočátku ani nevěnoval pozornost člověku, který si prohlížel jednu z vyhořelých budov."
"Do","do","nedělej","dělat","impf"," ' Do n't worry about your mother, Ichiro."," "" S mámou si nedělej starosti, Ičiró."
"understand","understand","nepochopí","pochopit","pf"," ' Women never understand men drinking, ' he remarked."," "" Ženské nikdy nepochopí, proč my chlapi pijem, "" podotkl."
"drinking","drink","pijem","pít","impf"," ' Women never understand men drinking, ' he remarked."," "" Ženské nikdy nepochopí, proč my chlapi pijem, "" podotkl."
"remarked","remark","podotkl","podotknout","pf"," ' Women never understand men drinking, ' he remarked."," "" Ženské nikdy nepochopí, proč my chlapi pijem, "" podotkl."
"tasted","taste","ochutnal","ochutnat","pf"," ' Well, it 's time a man like you tasted a little sake."," "" No, je na čase, aby silák jako ty ochutnal trochu saké."
"said","say","prohlásil","prohlásit","pf"," Then suddenly he said very loudly :"," Pak náhle velice hlasitě prohlásil :"
"seen","see","Neviděl","vidět","impf"," I had not seen Ichiro since Setsuko 's visit to my home over a year ago - he had not been present at Noriko 's wedding on account of a virus - and I was struck by how much he had grown in that time."," Neviděl jsem ho od poslední návštěvy - v době Noričiny svatby ležel s virozou - a opravdu mě překvapilo, jak za tu dobu vyrostl."
"struck","strike","překvapilo","překvapit","pf"," I had not seen Ichiro since Setsuko 's visit to my home over a year ago - he had not been present at Noriko 's wedding on account of a virus - and I was struck by how much he had grown in that time."," Neviděl jsem ho od poslední návštěvy - v době Noričiny svatby ležel s virozou - a opravdu mě překvapilo, jak za tu dobu vyrostl."
"grown","grow","vyrostl","vyrůst","pf"," I had not seen Ichiro since Setsuko 's visit to my home over a year ago - he had not been present at Noriko 's wedding on account of a virus - and I was struck by how much he had grown in that time."," Neviděl jsem ho od poslední návštěvy - v době Noričiny svatby ležel s virozou - a opravdu mě překvapilo, jak za tu dobu vyrostl."
"expect","expect","předpokládal","předpokládat","impf"," But then I would expect as much of a company like Nippon Electrics."," Ovšem u společnosti Nippon Electrics bych něco podobného předpokládal."
"speaks","speak","hovoří","hovořit","impf"," Suichi always speaks highly of KNC. '"," Suiči vždycky hovoří o KNC s velkým uznáním. """
"avoided","avoid","vyhnul","vyhnout","pf"," ' For instance, Obasan, ' I went on, ' think how cleverly he avoided the war."," "" Vezměte si, například, jak chytře se vyhnul válce, "" pokračoval jsem."
"went","go","pokračoval","pokračovat","impf"," ' For instance, Obasan, ' I went on, ' think how cleverly he avoided the war."," "" Vezměte si, například, jak chytře se vyhnul válce, "" pokračoval jsem."
"happening","happen","přišli","přijít","pf"," While others were losing so much, Shintaro just went on working in that little studio of his as though nothing was happening. '"," "" Zatímco ostatní o tolik přišli, Šintaró si v tom svém ateliérku klidně pracoval, jako by se nechumelilo. """
"went","go","pracoval","pracovat","impf"," While others were losing so much, Shintaro just went on working in that little studio of his as though nothing was happening. '"," "" Zatímco ostatní o tolik přišli, Šintaró si v tom svém ateliérku klidně pracoval, jako by se nechumelilo. """
"working","work","pracoval","pracovat","impf"," While others were losing so much, Shintaro just went on working in that little studio of his as though nothing was happening. '"," "" Zatímco ostatní o tolik přišli, Šintaró si v tom svém ateliérku klidně pracoval, jako by se nechumelilo. """
"called","call","povolali","povolat","pf"," ' Bad leg or not, everyone was being called up."," "" Kulhá nekulhá, povolali všechny."
"understanding","understand","pochopili","pochopit","pf"," for instance, we Japanese have already come a long way in understanding such things as democracy and individual rights."," Za těch pár let jsme do značné míry pochopili, co je to demokracie a práva jednotlivce."
"look","look","hledí","hledět","impf"," This is why firms like ours can look forward with the greatest confidence. '"," Proto hledí podniky, jako je náš, s takovým optimismem vpřed. """
"said","say","řekla","říci","pf"," ' Indeed, Taro-san, ' Setsuko said."," "" Máš pravdu, Taró - sane, "" řekla Secuko."
"fear","fear","bál","bát","impf"," If you were less talented, I would fear for your future after leaving me."," Kdybys neměl takové nadání, bál bych se o tebe."
"contemplated","contemplate","neuvažoval","uvažovat","impf"," The villa has been my home for so long, I never seriously contemplated it ceasing to be so. '"," Usedlost už byla mým domovem tak dlouho, že jsem o odchodu nikdy ani vážně neuvažoval. """
"say","say","řekl","říci","pf"," Well, as I say, Ono, were you less talented, there would be cause for worry. But you are a clever young man. '"," No, jak už jsem řekl, Ono, kdybys neměl takové nadání, dělal bych si starosti."
"staring","stare","zírala","zírat","impf"," Noriko, I realized, had been staring at me in astonishment."," Noriko na mě užasle zírala."
"tried","try","snažili","snažit","impf"," Before long, a few more years, and the likes of us will be able to hold our heads high about what we tried to do."," Za pár let lidé jako my dva budou moci opět hrdě zvednout hlavu a pyšnit se tím, co jsme se snažili dokázat."
"hope","hope","doufám","doufat","impf"," I simply hope I live as long as that."," Jen doufám, že se toho dočkám i já."
"see","see","viděl","vidět","impf"," It 's my wish to see my life 's efforts vindicated. '"," Rád bych viděl, že jsem nežil naplano. """
"finding","find","sehnal","sehnat","pf"," He had thus experienced little difficulty finding work - mainly small tutoring jobs - or the materials to recommence his own painting."," Proto bez obtíží sehnal práci - povětšinou soukromou výuku - i materiál, aby mohl začít sám malovat."
"pleased","please","potěšilo","potěšit","pf"," Now, it may seem somewhat perverse of me to say so, but I was pleased - and indeed rather proud - to hear Kuroda 's career was progressing well."," Možná vám to ode mě bude připadat zvrácené, ale mě potěšilo - dokonce jsem pocítil i jistou hrdost - že se Kurodovi vede tak dobře."
"proved","prove","Ukázalo","ukázat","pf"," But in fact the mood I found him in that evening proved to be typical of his general mood these days;"," Ukázalo se však, že se těch nálad už nezbaví."
"did","do","udělat","udělat","pf"," ' If I spend the whole day moping, how did all these repairs get done? '"," "" Jestli celý den bloumám sklesle po domě, kdo potom stihl udělat všechny ty opravy? """
"done","do","udělat","udělat","pf"," ' If I spend the whole day moping, how did all these repairs get done? '"," "" Jestli celý den bloumám sklesle po domě, kdo potom stihl udělat všechny ty opravy? """
"help","help","pomáhali","pomáhat","impf"," ' He had men in to help with all the difficult parts, ' Noriko said."," "" Se složitějšími opravami mu pomáhali řemeslníci, "" řekla Noriko."
"said","say","řekla","říci","pf"," ' He had men in to help with all the difficult parts, ' Noriko said."," "" Se složitějšími opravami mu pomáhali řemeslníci, "" řekla Noriko."
"believe","believe","nevěříš","věřit","impf"," ' You do n't seem to believe me, Setsuko."," "" Ty mi asi nevěříš, Secuko."
"receiving","receive","dostal","dostat","pf"," After receiving the news of Matsuda 's death late yesterday morning, I made myself a light lunch, then went out for a little exercise."," Když jsem včera před polednem dostal zprávu o Macudově smrti, udělal jsem si lehký oběd a vydal jsem se na kratší procházku."
"made","make","udělal","udělat","pf"," After receiving the news of Matsuda 's death late yesterday morning, I made myself a light lunch, then went out for a little exercise."," Když jsem včera před polednem dostal zprávu o Macudově smrti, udělal jsem si lehký oběd a vydal jsem se na kratší procházku."
"began","begin","začínaly","začínat","impf"," The sky was a clear blue, and a little way down the bank, along where the new apartment blocks began, I could see two small boys playing with fishing poles at the water 's edge."," Obloha zářila jasnou modří a kousek dál po břehu, kde začínaly nové domy, si u vody hráli dva kluci s rybářskými pruty."
"playing","play","hráli","hrát","impf"," The sky was a clear blue, and a little way down the bank, along where the new apartment blocks began, I could see two small boys playing with fishing poles at the water 's edge."," Obloha zářila jasnou modří a kousek dál po břehu, kde začínaly nové domy, si u vody hráli dva kluci s rybářskými pruty."
"recall","recall","vzpomínáte","vzpomínat","impf"," Here and there around the park, you will no doubt recall passing certain isolated patches of grass, none larger than a school yard, visible through the trees as you walk down any of those avenues."," Určitě si vzpomínáte, že jste tu a tam v parku viděli mezi stromy probleskovat opuštěné travnaté plochy, ne větší než školní dvorek."
"abandoned","abandon","opustil","opustit","pf"," It is as though those who planned the park had become confused and abandoned some scheme or other half-completed."," Působí dojmem, jako by architekt náhle podlehl zmatku a svůj záměr opustil nebo ho nechal nedokončený."
"abandoned","abandon","nechal","nechat","pf"," It is as though those who planned the park had become confused and abandoned some scheme or other half-completed."," Působí dojmem, jako by architekt náhle podlehl zmatku a svůj záměr opustil nebo ho nechal nedokončený."
"bought","buy","koupil","koupit","pf"," Some years ago, Akira Sugimura - he whose house I had bought shortly after his death - had the most ambitious of plans concerning Kawabe Park."," Před lety pojal Akira Sugimura - jeho dům jsem krátce po jeho smrti koupil - nesmírně velkorysý záměr."
"doubt","doubt","Pochybuji","pochybovat","impf"," I doubt if it would have been brought off without you."," "" Pochybuji, že bychom se bez tebe byli vzali."
"heard","hear","Slyšel","slyšet","impf"," I heard it was something of a freak raid. '"," Slyšel jsem, že šlo o nějaký nehlášený nálet. """
"hurt","hurt","raněn","ranit","pf"," Hardly anyone else was hurt."," Téměř nikdo nebyl raněn."
"say","say","říkáš","říkat","impf"," It was as you say, a cruel thing. '"," Jak říkáš - kruté a nespravedlivé. """
"surprised","surprise","překvapuje","překvapovat","impf"," How typical that he himself should be the most surprised by the esteem accorded to him."," Pro senseiovu skromnou povahu je typické, že ho takové uznání značně překvapuje."
"said","say","říci","říci","pf"," In fact, it may be said that respected enormously as he is by the public at large, it is we here at this table who alone know the extent to which that respect still falls short."," Dokonce se dá říci, že ať si ho široká veřejnost považuje sebevíc, my kolem tohoto stolu jediní víme, že tato váženost ani zdaleka nedosahuje míry jeho zásluh."
"look","look","podíval","podívat","pf"," I would beg you to look once more at my new paintings and reconsider them."," Chtěl bych vás poprosit, abyste se ještě jednou podíval na mé nové obrazy a znovu o nich popřemýšlel."
"return","return","vrátíme","vrátit","pf"," Perhaps, in fact, Sensei will allow me when we return to explain my intentions in each picture. '"," Až se vrátíme domů, mohl bych vám, když dovolíte, u každého vysvětlit svůj záměr. """
"allow","allow","dovolíte","dovolit","pf"," Perhaps, in fact, Sensei will allow me when we return to explain my intentions in each picture. '"," Až se vrátíme domů, mohl bych vám, když dovolíte, u každého vysvětlit svůj záměr. """
"explain","explain","vysvětlit","vysvětlit","pf"," Perhaps, in fact, Sensei will allow me when we return to explain my intentions in each picture. '"," Až se vrátíme domů, mohl bych vám, když dovolíte, u každého vysvětlit svůj záměr. """
"gave","give","nedával","dávat","impf"," He still gave no sign of having heard me. So I continued :"," Stále ještě nedával najevo, že mě slyší."
"heard","hear","slyší","slyšet","impf"," He still gave no sign of having heard me. So I continued :"," Stále ještě nedával najevo, že mě slyší."
"said","say","řekl","říci","pf"," ' No, Sensei, ' Shintaro said, all the time smiling and bowing."," "" Ne, mistře, "" řekl Šintaró a stále se klaněl a usmíval."
"smiling","smile","usmíval","usmívat","impf"," ' No, Sensei, ' Shintaro said, all the time smiling and bowing."," "" Ne, mistře, "" řekl Šintaró a stále se klaněl a usmíval."
"thanking","thank","poděkovali","poděkovat","pf"," But we could not remain at home any longer without thanking you. '"," Ale nemohli jsme jen tak sedět doma, aniž jsme vám poděkovali. """
"Come","come","Pojďte","jít","impf"," ' Come on inside."," "" Pojďte přece dál."
"believe","believe","Myslím","myslet","impf"," I believe Setsuko was just making some tea. '"," Myslím, že Secuko právě vaří čaj. """
"making","make","vaří","vařit","impf"," I believe Setsuko was just making some tea. '"," Myslím, že Secuko právě vaří čaj. """
"sold","sell","prodávat","prodávat","impf"," It was one of my pupils who first brought it to my attention that Akira Sugimura 's house, a year after his death, was to be sold off."," Pak mě jeden z mých žáků upozornil, že se má prodávat dům Akiry Sugimury, který před rokem zemřel."
"buy","buy","koupit","koupit","pf"," That I should buy such a house seemed absurd, and I put the suggestion down to the exaggerated respect my pupils always had for me."," Připadalo mi absurdní, že bych měl koupit takové sídlo, a návrh jsem připisoval přehnané úctě, jakou ke mně žáci chovali."
