"recall","recall","vzpomínám","vzpomínat","impf"," I can still recall the deep satisfaction I felt when I learnt the Sugimuras - after the most thorough investigation - had deemed me the most worthy of the house they so prized."," Ještě dnes si vzpomínám, jak hluboký pocit zadostiučinění mě zaplavil, když si Sugimurovi po velice důkladném šetření vybrali jako nejvhodnějšího kupce pro svůj drahocenný dům právě mě."
"lived","live","bydleli","bydlet","impf"," and all of us who lived in it came to find it most conducive to relaxation and calm."," Všem, co jsme v ní bydleli, se zdá, že nám její atmosféra pomáhá uvolnit se a najít klid."
"find","find","najít","najít","pf"," and all of us who lived in it came to find it most conducive to relaxation and calm."," Všem, co jsme v ní bydleli, se zdá, že nám její atmosféra pomáhá uvolnit se a najít klid."
"see","see","dívá","dívat","impf"," You see, Ono-san, I 've noticed Mori-san looking at my work more and more closely this past year."," Víš, Ono - sane, všiml jsem si, že se Mori - san dívá na mou práci stále pozorněji."
"looking","look","dívá","dívat","impf"," You see, Ono-san, I 've noticed Mori-san looking at my work more and more closely this past year."," Víš, Ono - sane, všiml jsem si, že se Mori - san dívá na mou práci stále pozorněji."
"exhibit","exhibit","vystavovat","vystavovat","impf"," Who knows, sometime in the future, I may even be permitted to exhibit alongside yourself and Mori-san. '"," Kdo ví, možná že někdy v budoucnosti budu smět vystavovat vedle tebe a Mori - sana. """
"looked","look","pohlédl","pohlédnout","pf"," Then at last he looked across to me and laughed selfconsciously."," Nakonec na mě přece jen pohlédl a rozpačitě se zasmál."
"laughed","laugh","zasmál","zasmát","pf"," Then at last he looked across to me and laughed selfconsciously."," Nakonec na mě přece jen pohlédl a rozpačitě se zasmál."
"changed","change","změnilo","změnit","pf"," ' Many things have changed since the old days, Shintaro, ' I pointed out the other night down at Mrs Kawakami 's."," "" Od těch dob se mnoho změnilo, Šintaró, "" odpověděl jsem mu teď u paní Kawakamiové."
"retired","retire","Odešel","odejít","pf"," ' I 'm retired now, I do n't have so many connections. '"," "" Odešel jsem na penzi a už nemám takové styky. """
"surprised","surprise","překvapil","překvapit","pf"," It may be that if I chose to put it to the test, I would again be surprised by the extent of my influence."," Možná, že kdybych to zkusil, samotného by mě dosah mého vlivu překvapil."
"say","say","řekl","říci","pf"," As I say, I have never had a keen awareness of my own standing."," Jak už jsem řekl, nikdy jsem o svém společenském postavení nijak nehloubal."
"looking","look","pohlédl","pohlédnout","pf"," I glared at her for a moment, but she went on looking at the garden, a weary expression on her face."," Rozhořčeně jsem na ni pohlédl, ale ona unaveně upírala oči do zahrady."
"turned","turn","Odvrátil","odvrátit","pf"," I turned away and gave a sigh."," Odvrátil jsem se a povzdechl si."
"laugh","laugh","zasmáli","zasmát","pf"," Your mother at least could say such things and we would laugh together. '"," Tvoje matka alespoň plácla něco, čemu jsme se oba zasmáli. """
"talk","talk","hovořím","hovořit","impf"," It 's to this end, Tortoise, I talk of the need for a new approach. '"," Právě proto hovořím o potřebě nového přístupu. """
"tell","tell","řekl","říci","pf"," ' To tell you the truth, Ono-san, ' he said, ' someone in my humble position is always trying new approaches."," "" Abych ti pravdu řekl, Ono - sane, "" ozval se posléze, "" člověk v mém skrovném postavení vždycky zkouší nové přístupy."
"said","say","řekl","říci","pf"," ' To tell you the truth, Ono-san, ' he said, ' someone in my humble position is always trying new approaches."," "" Abych ti pravdu řekl, Ono - sane, "" ozval se posléze, "" člověk v mém skrovném postavení vždycky zkouší nové přístupy."
"trying","try","zkouší","zkoušet","impf"," ' To tell you the truth, Ono-san, ' he said, ' someone in my humble position is always trying new approaches."," "" Abych ti pravdu řekl, Ono - sane, "" ozval se posléze, "" člověk v mém skrovném postavení vždycky zkouší nové přístupy."
"believe","believe","myslím","myslet","impf"," But over this past year, I believe I 'm beginning to find the right path at last."," Ale myslím, že během uplynulého roku jsem začal objevovat tu pravou cestu."
"beginning","begin","začal","začít","pf"," But over this past year, I believe I 'm beginning to find the right path at last."," Ale myslím, že během uplynulého roku jsem začal objevovat tu pravou cestu."
"meant","mean","Chtěl","chtít","impf"," I 'd meant to write and express my apologies."," Chtěl jsem se ti písemně omluvit."
"remember","remember","pamatuji","pamatovat","impf"," ' I can remember when you and Michiko-san were brought together. '"," "" Ještě si pamatuji, jak jste se vy dva sešli. """
"nodding","nod","přikývl","přikývnout","pf"," He gave a laugh, nodding to himself."," Uchechtl se a pro sebe si přikývl."
"think","think","Nedomníváš","domnívat","impf"," ' So you do not think you will be able to bring me those paintings of yours. '"," "" Nedomníváš se tedy, že bys mi ty obrazy mohl přinést. """
"bring","bring","přinést","přinést","pf"," ' So you do not think you will be able to bring me those paintings of yours. '"," "" Nedomníváš se tedy, že bys mi ty obrazy mohl přinést. """
"see","see","Chápu","chápat","impf"," T see."," "" Chápu."
"considered","consider","uvážil","uvážit","pf"," Of course, you have considered your future in the event of your leaving my patronage. '"," Zřejmě jsi tedy již uvážil, co podnikneš, až opustíš můj dům. """
"leaving","leave","opustíš","opustit","pf"," Of course, you have considered your future in the event of your leaving my patronage. '"," Zřejmě jsi tedy již uvážil, co podnikneš, až opustíš můj dům. """
"understand","understand","pochopí","pochopit","pf"," ' It had been my hope that Sensei would understand my position and continue to support me in pursuing my career. '"," "" Doufal jsem, že sensei pochopí moje stanovisko a bude mě i nadále podporovat. """
"support","support","podporovat","podporovat","impf"," ' It had been my hope that Sensei would understand my position and continue to support me in pursuing my career. '"," "" Doufal jsem, že sensei pochopí moje stanovisko a bude mě i nadále podporovat. """
"went","go","pokračoval","pokračovat","impf"," He remained silent, so eventually I went on :"," Mlčel, pokračoval jsem tedy."
"cause","cause","způsobil","způsobit","pf"," ' Sensei, it would cause me the greatest pain to leave the villa."," "" Sensei, odchod od vás by mi způsobil velkou bolest."
"displaying","display","vystavovali","vystavovat","impf"," Indeed, such was its reputation that in its latter years, most of the city 's leading artists were displaying their latest works there alongside those of the newer talents."," Dosáhly dokonce takového významu, že tu v pozdějších letech po boku mladších talentů vystavovali svá nejnovější díla přední umělci."
"said","say","řekl","říci","pf"," ' I was made a little curious by your reply, Mr Ono, ' Matsuda said."," "" Vaše odpověď vzbudila mou zvědavost, pane Ono, "" řekl Macuda."
"discover","discover","zjistím","zjistit","pf"," ' So I thought I 'd call by and discover what it was all about. '"," "" Napadlo mě, že se u vás zastavím a zjistím, oč vlastně jde. """
"take","take","přijmout","přijmout","pf"," T believe he is about to take up an appointment at the new Uemachi College, where he will teach art."," "" Nejspíš chce přijmout místo na nově zakládané akademii Uemači, kde bude vyučovat výtvarnému umění."
"teach","teach","vyučovat","vyučovat","impf"," T believe he is about to take up an appointment at the new Uemachi College, where he will teach art."," "" Nejspíš chce přijmout místo na nově zakládané akademii Uemači, kde bude vyučovat výtvarnému umění."
"asked","ask","požádala","požádat","pf"," I was kindly asked by the college to advise on the appointments board. '"," Škola mě laskavě požádala, abych radil komisi pro přijímání nových pracovníků. """
"advise","advise","radil","radit","impf"," I was kindly asked by the college to advise on the appointments board. '"," Škola mě laskavě požádala, abych radil komisi pro přijímání nových pracovníků. """
"gone","go","Odjela","odjet","pf"," And it seems she must have gone home to her husband to speculate over the failure of her sister 's proposal."," Odjela domů, a s manželem zřejmě přemítali, proč ze sestřina sňatku sešlo."
"speculate","speculate","přemítali","přemítat","impf"," And it seems she must have gone home to her husband to speculate over the failure of her sister 's proposal."," Odjela domů, a s manželem zřejmě přemítali, proč ze sestřina sňatku sešlo."
"staying","stay","Zůstane","zůstat","pf"," ' Is Oji staying the night? '"," "" Zůstane tu odží na noc? """
"going","go","pojede","jet","impf"," ' No, Oji 's going back to his own house soon. '"," "" Ne, odží brzo pojede zpátky domů. """
"remember","remember","vzpomínáš","vzpomínat","impf"," Oji has a large house all to himself, remember. '"," Odží má veliký dům sám pro sebe, vzpomínáš? """
"come","come","Přijde","přijít","pf"," ' Will Oji come to say goodbye at the station tomorrow? '"," "" Přijde se odží zítra rozloučit na nádraží? """
"laughing","laugh","smáli","smát","impf"," They stood on the doorsteps of that glass-fronted building, laughing together in the sunshine."," Stáli na sluncem zalitých schodech před skleněným průčelím, a společně se něčemu smáli."
"watched","watch","Pozoroval","pozorovat","impf"," I smiled to myself as I watched these young office workers from my bench."," Pozoroval jsem je a sám pro sebe jsem se usmíval."
"smiled","smile","usmíval","usmívat","impf"," I smiled to myself as I watched these young office workers from my bench."," Pozoroval jsem je a sám pro sebe jsem se usmíval."
"worrying","worry","znepokojuje","znepokojovat","impf"," ' If we 're worrying about Miss Noriko 's future, perhaps you 'd best seek him out, painful as it may be. '"," "" Pokud tě budoucnost slečny Noriko tak znepokojuje, udělal bys nejlépe, kdybys ho vyhledal, jakkoli to může být trapné. """
"seek","seek","vyhledal","vyhledat","pf"," ' If we 're worrying about Miss Noriko 's future, perhaps you 'd best seek him out, painful as it may be. '"," "" Pokud tě budoucnost slečny Noriko tak znepokojuje, udělal bys nejlépe, kdybys ho vyhledal, jakkoli to může být trapné. """
"see","see","Chápu","chápat","impf"," ' I see."," "" Chápu."
"sliding","slide","klouzal","klouzat","impf"," In any case, he seemed not to share our fondness for sitting on the veranda, preferring instead to run at great speed up and down its length, sometimes sliding along the polished boards."," V žádném případě ho nelákalo vysedávat na polštářích jako my a raději pobíhal po verandě a chvílemi se klouzal po navoskovaných prknech."
"refusing","refuse","odmítla","odmítnout","pf"," In fact, my grandson and I went by ourselves, Noriko refusing to come and Setsuko again volunteering to remain at home."," Vydali jsme se s vnukem sami, protože Noriko odmítla a Secuko dobrovolně zůstala doma s ní."
"remain","remain","zůstala","zůstat","pf"," In fact, my grandson and I went by ourselves, Noriko refusing to come and Setsuko again volunteering to remain at home."," Vydali jsme se s vnukem sami, protože Noriko odmítla a Secuko dobrovolně zůstala doma s ní."
"waited","wait","čekal","čekat","impf"," Later, as I waited at the terminus for a tram to take me up the steep hill and back into the city, I felt a certain comfort in recalling Matsuda 's assurance that he would have ' only the best of things to report from the past '."," Když jsem pak čekal pod strmým svahem na tramvaj, abych odjel zpátky do města, vzpomněl jsem si na Macudova slova, že o mé minulosti může mluvit "" jen v dobrém "", a pocítil jsem jistou úlevu."
"recalling","recall","vzpomněl","vzpomenout","pf"," Later, as I waited at the terminus for a tram to take me up the steep hill and back into the city, I felt a certain comfort in recalling Matsuda 's assurance that he would have ' only the best of things to report from the past '."," Když jsem pak čekal pod strmým svahem na tramvaj, abych odjel zpátky do města, vzpomněl jsem si na Macudova slova, že o mé minulosti může mluvit "" jen v dobrém "", a pocítil jsem jistou úlevu."
"felt","feel","pocítil","pocítit","pf"," Later, as I waited at the terminus for a tram to take me up the steep hill and back into the city, I felt a certain comfort in recalling Matsuda 's assurance that he would have ' only the best of things to report from the past '."," Když jsem pak čekal pod strmým svahem na tramvaj, abych odjel zpátky do města, vzpomněl jsem si na Macudova slova, že o mé minulosti může mluvit "" jen v dobrém "", a pocítil jsem jistou úlevu."
"visit","visit","navštívil","navštívit","pf"," Of course, I could have been reasonably confident of this without my having gone to visit him."," Mohl jsem to vcelku oprávněně předpokládat, aniž bych ho byl navštívil."
"acknowledged","acknowledge","přiznal","přiznat","pf"," Indeed, I acknowledged as much during the negotiations, just as you suggested. '"," A během miai jsem to také přiznal, přesně jak jsi mi doporučovala. """
"suggested","suggest","doporučovala","doporučovat","impf"," Indeed, I acknowledged as much during the negotiations, just as you suggested. '"," A během miai jsem to také přiznal, přesně jak jsi mi doporučovala. """
"told","tell","nevyprávěla","vyprávět","impf"," ' Noriko has n't told you about the miai?"," "" Copak ti Noriko nevyprávěla o miai?"
"done","do","udělal","udělat","pf"," I dare say I would have done so in any case, but I was nevertheless grateful for your advice last year. '"," Byl bych to udělal tak jako tak, ale přesto jsem ti byl loni za tvou radu vděčný. """
"admit","admit","přiznat","přiznat","pf"," These occasions are not, of course, easy for any prospective bride - it seems unfair to ask a young woman to make judgements so crucial to her future happiness while under such scrutiny herself - but I must admit I had not expected Noriko to take the tension quite so badly."," Taková setkání nejsou pochopitelně snadná pro kteroukoli nastávající nevěstu - je nespravedlivé chtít po mladé ženě, aby se rozhodovala o svém budoucím štěstí, když je zároveň sama podrobována tak zevrubnému zkoumání, ale musím přiznat, že jsem si ani nepředstavil, jak ten tlak na Noriko dolehne."
"looking","look","hleděl","hledět","impf"," I remained silent, looking at the floor before me."," Mlčel jsem a hleděl na podlahu před sebou."
"continued","continue","pokračoval","pokračovat","impf"," ' Artists ', my father 's voice continued, ' live in squalor and poverty."," "" Umělci, "" pokračoval otec, "" žijí ve špíně a v chudobě."
"inhabit","inhabit","Obývají","obývat","impf"," They inhabit a world which gives them every temptation to become weak-willed and depraved."," Obývají svět, který je ze všech stran svádí k nepravostem a slabé vůli."
"summon","summon","svolal","svolat","pf"," One such room, which filled with a clear light through much of the day, was reserved for special occasions, and I remember how from time to time Mori-san would summon all his pupils - there were ten of us - into that room whenever he had completed a new painting."," Jedna z nich, kam většinu dne dopadalo jasné světlo, zůstala vyhrazena pro zvláštní příležitosti a sem Mori - san čas od času svolal všech svých deset žáků, když dokončil nový obraz."
"completed","complete","dokončil","dokončit","pf"," One such room, which filled with a clear light through much of the day, was reserved for special occasions, and I remember how from time to time Mori-san would summon all his pupils - there were ten of us - into that room whenever he had completed a new painting."," Jedna z nich, kam většinu dne dopadalo jasné světlo, zůstala vyhrazena pro zvláštní příležitosti a sem Mori - san čas od času svolal všech svých deset žáků, když dokončil nový obraz."
"recall","recall","Pamatuji","pamatovat","impf"," I recall how before we stepped inside, each of us would pause at the threshold and gasp in admiration at the picture mounted at the centre of the floor."," Pamatuji si, jak se každý z nás zastavil na prahu a vydechl v obdivu nad dílem, vystaveným uprostřed pokoje."
"looked","look","vyhledal","vyhledat","pf"," Do n't worry, I looked it up in the newspaper."," Neboj se, vyhledal jsem si ten film v novinách."
"thought","think","myslel","myslet","impf"," ' In fact, I thought we should all go."," "" Vlastně jsem si myslel, že bychom mohli jít všichni společně."
"go","go","jít","jít","impf"," ' In fact, I thought we should all go."," "" Vlastně jsem si myslel, že bychom mohli jít všichni společně."
"speak","speak","řekl","říci","pf"," A family outing, so to speak. '"," Rodinná vycházka, abych tak řekl. """
"saw","see","Neviděli","vidět","impf"," It must be three years since we last saw each other. '"," Neviděli jsme se aspoň tři roky. """
"avoid","avoid","vyhýbat","vyhýbat","impf"," It was n't my intention to avoid you."," Nesnažil jsem se ti vyhýbat."
"meaning","mean","Chtěl","chtít","impf"," I 'd been meaning for some time to come out and pay a visit. But what with one thing and another ... '"," Chtěl jsem se zastavit, ale přišlo do toho to a ono ... """
"come","come","přišlo","přijít","pf"," I 'd been meaning for some time to come out and pay a visit. But what with one thing and another ... '"," Chtěl jsem se zastavit, ale přišlo do toho to a ono ... """
"forgive","forgive","prominout","prominout","pf"," You must forgive me, of course, for failing to attend Michiko-san 's funeral."," Musíš mi prominout, že jsem Mičiko - san nepřišel na pohřeb."
"attend","attend","nepřišel","přijít","pf"," You must forgive me, of course, for failing to attend Michiko-san 's funeral."," Musíš mi prominout, že jsem Mičiko - san nepřišel na pohřeb."
"describe","describe","popsat","popsat","pf"," It is hard to describe the feeling, for it was quite different from the sort of elation one feels from smaller triumphs - and, as I say, quite different from anything I had experienced during the celebrations at the Migi-Hidari."," Dá se těžko popsat, protože se naprosto liší od stavů euforie, jaké člověk mívá z drobnějších úspěchů - a jak jsem už naznačil, mé pocity v Migi - Hidari při oslavě se zcela lišily."
"handled","handle","zvládl","zvládnout","pf"," I could not help noticing the marked contrast between the assured way Dr Saito had responded to the slightly awkward situation, and the nervous, clumsy way the Miyake family had handled things from start to finish last year."," Nemohl jsem si nevšimnout, jak klidně pan doktor Saitó zvládl tuto mírně trapnou situaci, a chtě nechtě jsem srovnával jeho počínání s nervozitou a nemotorností, jíž se od začátku do konce jednání vyznačovala rodina Mijakových."
"think","think","měli","mít","impf"," Sometimes I think there are many who should be giving their lives in apology who are too cowardly to face up to their responsibilities."," Někdy mě napadá, že by se podobně měli omluvit i mnozí jiní, ale jsou asi příliš zbabělí, než aby si svou odpovědnost přiznali."
"show","show","Uveď","uvést","pf"," ' Please show them in, ' I had said."," "" Uveď ji, prosím tě, dovnitř, "" požádal jsem ji."
"bother","bother","neobtěžovali","obtěžovat","impf"," ' But they insist they wo n't bother you by coming in. '"," "" Odmítají vejít, aby prý tě neobtěžovali. """
"saw","see","uviděli","uvidět","pf"," As soon as they saw me, they began bowing and giggling."," Sotva mě uviděli, začali se klanět a chichotat."
"began","begin","začali","začít","pf"," As soon as they saw me, they began bowing and giggling."," Sotva mě uviděli, začali se klanět a chichotat."
"step","step","Pojďte","jít","impf"," ' Please step up, ' I said, but they continued simply to bow and giggle."," "" Pojďte dál, prosím vás, "" řekl jsem, ale oni se pouze dál klaněli a pochichtávali."
"said","say","řekl","říci","pf"," ' Please step up, ' I said, but they continued simply to bow and giggle."," "" Pojďte dál, prosím vás, "" řekl jsem, ale oni se pouze dál klaněli a pochichtávali."
"Step","step","Pojďte","jít","impf"," Step up to the tatami. '"," Pojďte dál. """
"learning","learn","učí","učit","impf"," At this moment, our country is like a young boy learning to walk and run."," Naše země zatím připomíná chlapce, který se učí chodit a běhat."
"walk","walk","chodit","chodit","impf"," At this moment, our country is like a young boy learning to walk and run."," Naše země zatím připomíná chlapce, který se učí chodit a běhat."
"run","run","běhat","běhat","impf"," At this moment, our country is like a young boy learning to walk and run."," Naše země zatím připomíná chlapce, který se učí chodit a běhat."
"prevent","prevent","bránit","bránit","impf"," One does n't wish to prevent him and keep him locked indoors. Do n't you think so, Mr Ono?"," Člověk jim v tom přece nemůže bránit a zavírat je doma, co soudíte, pane Ono?"
"keep","keep","bránit","bránit","impf"," One does n't wish to prevent him and keep him locked indoors. Do n't you think so, Mr Ono?"," Člověk jim v tom přece nemůže bránit a zavírat je doma, co soudíte, pane Ono?"
"think","think","soudíte","soudit","impf"," One does n't wish to prevent him and keep him locked indoors. Do n't you think so, Mr Ono?"," Člověk jim v tom přece nemůže bránit a zavírat je doma, co soudíte, pane Ono?"
"given","give","poskytovat","poskytovat","impf"," There were windows along the length of the room, and these should have given us a good light to work by;"," Po celé délce místnosti se táhla okna a měla nám vlastně poskytovat dostatek světla k práci."
"allow","allow","nedovoloval","dovolovat","impf"," The other problem with the place was the fact that the restaurateur downstairs would not allow us to remain after six o'clock in the evening when his customers would begin to come in."," Navíc nám restauratér z přízemí nedovoloval zůstávat po šesté večer, kdy začínali přicházet jeho zákazníci."
"remain","remain","zůstávat","zůstávat","impf"," The other problem with the place was the fact that the restaurateur downstairs would not allow us to remain after six o'clock in the evening when his customers would begin to come in."," Navíc nám restauratér z přízemí nedovoloval zůstávat po šesté večer, kdy začínali přicházet jeho zákazníci."
"begin","begin","začínali","začínat","impf"," The other problem with the place was the fact that the restaurateur downstairs would not allow us to remain after six o'clock in the evening when his customers would begin to come in."," Navíc nám restauratér z přízemí nedovoloval zůstávat po šesté večer, kdy začínali přicházet jeho zákazníci."
"come","come","přicházet","přicházet","impf"," The other problem with the place was the fact that the restaurateur downstairs would not allow us to remain after six o'clock in the evening when his customers would begin to come in."," Navíc nám restauratér z přízemí nedovoloval zůstávat po šesté večer, kdy začínali přicházet jeho zákazníci."
"took","take","trvá","trvat","impf"," It seemed to me that he took an inordinate amount of time negotiating his way through the objects on the floor;"," Připadalo mi, že mu ta cesta nepořádkem na podlaze trvá mimořádně dlouho."
"hear","hear","zaslechl","zaslechnout","pf"," at times, I would hear him mumbling to himself and the sound of his feet pushing away a jar or box."," Občas jsem zaslechl, jak si cosi pro sebe mumlá a nohou odsunuje kbelík nebo krabici."
"thought","think","zdálo","zdát","impf"," Indeed, I once or twice thought Mori-san was actually searching for something - perhaps more of his early prints - amidst the chaotic piles, but eventually he seated himself back on the old wooden chest and drew a sigh."," Dokonce se mi několikrát zdálo, že snad Mori - san mezi chaoticky rozházenými hromadami něco hledá - snad další prvotiny - ale nakonec se usadil znovu na staré dřevěné truhle a povzdechl si."
"searching","search","hledá","hledat","impf"," Indeed, I once or twice thought Mori-san was actually searching for something - perhaps more of his early prints - amidst the chaotic piles, but eventually he seated himself back on the old wooden chest and drew a sigh."," Dokonce se mi několikrát zdálo, že snad Mori - san mezi chaoticky rozházenými hromadami něco hledá - snad další prvotiny - ale nakonec se usadil znovu na staré dřevěné truhle a povzdechl si."
