"hear","hear","zaslechl","zaslechnout","pf"," He could hear, a long way off, the sound of approaching feet and arguing voices."," Kdesi v dálce zaslechl zvuk přibližujících se kroků a rozhádaných hlasů."
"prepared","prepare","připraven","připravit","pf"," But he had been prepared for that, too."," Ale i na to byl připraven."
"like","like","Chtěl","chtít","impf"," ‘ Would you like another banana? ’ he said."," "" Chtěl byste ještě jeden banán? """
"given","give","dal","dát","pf"," If men were meant to walk twenty-one miles at a step I am sure God would have given us longer legs ..."," Kdyby člověk opravdu potřeboval ujít sedm mil jedním krokem, jistě by nám dal Stvořitel delší nohy ..."
"said","say","odpověděl","odpovědět","pf"," ‘ I am not sure, ’ said Trymon coldly."," "" Nevím, mistře, "" odpověděl Trémon odměřeně."
"disciplined","discipline","potrestán","potrestat","pf"," ‘ The librarian will be disciplined, of course. ’"," "" Za to by měl být knihovník samozřejmě potrestán. """
"looked","look","podíval","podívat","pf"," Galder looked sideways at him."," Galder se na něj úkosem podíval."
"remember","remember","nepamatuju","pamatovat","impf"," I ca n't remember any other spells, they 're too frightened to stay in the same head as you! ’"," Jenže takhle si žádná jiná zaklínadla nepamatuju, protože mají strach zůstat s vámi v jedné hlavě! """
"stay","stay","zůstat","zůstat","pf"," I ca n't remember any other spells, they 're too frightened to stay in the same head as you! ’"," Jenže takhle si žádná jiná zaklínadla nepamatuju, protože mají strach zůstat s vámi v jedné hlavě! """
"want","want","chci","chtít","impf"," ‘ I just want to go home!"," "" Já chci domů, rozumíte?"
"do","do","nejde","jít","impf"," I mean, I do n't mind about the magic, I 'm probably not, you know, the right sort of material for a wizard, I just want to go home! — ’"," Já - mně ani tak nejde o to, že jsem se nenaučil čarovat, asi na to nejsem ten pravý, ale chci prostě domů! """
"go","go","nejde","jít","impf"," I mean, I do n't mind about the magic, I 'm probably not, you know, the right sort of material for a wizard, I just want to go home! — ’"," Já - mně ani tak nejde o to, že jsem se nenaučil čarovat, asi na to nejsem ten pravý, ale chci prostě domů! """
"mean","mean","chci","chtít","impf"," I mean, I do n't mind about the magic, I 'm probably not, you know, the right sort of material for a wizard, I just want to go home! — ’"," Já - mně ani tak nejde o to, že jsem se nenaučil čarovat, asi na to nejsem ten pravý, ale chci prostě domů! """
"want","want","chci","chtít","impf"," I mean, I do n't mind about the magic, I 'm probably not, you know, the right sort of material for a wizard, I just want to go home! — ’"," Já - mně ani tak nejde o to, že jsem se nenaučil čarovat, asi na to nejsem ten pravý, ale chci prostě domů! """
"jumped","jump","vyskočila","vyskočit","pf"," With great presence of mind she ran to the edge of Old Grandad 's bottom lip and jumped, rolling as she hit the earth."," S velkou duchapřítomností se rozběhla k Pradědovu dolnímu rtu, vyskočila ven, dopadla na zem a několikrát se překulila."
"followed","follow","následovali","následovat","impf"," The men followed her, cursing as they landed among the debris."," Muži ji následovali a s kletbami padali do kamenné suti a trnitých křovin."
"trying","try","pokusil","pokusit","pf"," Like a fat man trying to do press-ups the old troll pushed himself upwards."," Starý trol vstával jako tlusťoch, který se pokusil udělat dřep a teď se snaží vztyčit."
"do","do","udělat","udělat","pf"," Like a fat man trying to do press-ups the old troll pushed himself upwards."," Starý trol vstával jako tlusťoch, který se pokusil udělat dřep a teď se snaží vztyčit."
"trying","try","snaží","snažit","impf"," Like a fat man trying to do press-ups the old troll pushed himself upwards."," Starý trol vstával jako tlusťoch, který se pokusil udělat dřep a teď se snaží vztyčit."
"pushed","push","snaží","snažit","impf"," Like a fat man trying to do press-ups the old troll pushed himself upwards."," Starý trol vstával jako tlusťoch, který se pokusil udělat dřep a teď se snaží vztyčit."
"lying","lie","leželi","ležet","impf"," This was n't apparent from where the prisoners were lying."," To všechno samozřejmě nebylo z místa, kde leželi zajatci, vidět."
"grabbed","grab","chytil","chytit","pf"," Weems grabbed Gancia 's arm."," Weems chytil Ganciu za ruku."
"see","see","neviděl","vidět","impf"," Rincewind could n't see all this, of course, since his own eyes were daylight issue only, but he did see the whole dark landscape shake itself slowly and then begin to rise impossibly against the stars."," To všechno Mrakoplaš, jehož oči byly zvyklé na denní světlo, neviděl, ale viděl, jak se černý obrys pahorku pomalu otřásl a začal se zvedat."
"see","see","neviděl","vidět","impf"," Rincewind could n't see all this, of course, since his own eyes were daylight issue only, but he did see the whole dark landscape shake itself slowly and then begin to rise impossibly against the stars."," To všechno Mrakoplaš, jehož oči byly zvyklé na denní světlo, neviděl, ale viděl, jak se černý obrys pahorku pomalu otřásl a začal se zvedat."
"see","see","viděl","vidět","impf"," Rincewind could n't see all this, of course, since his own eyes were daylight issue only, but he did see the whole dark landscape shake itself slowly and then begin to rise impossibly against the stars."," To všechno Mrakoplaš, jehož oči byly zvyklé na denní světlo, neviděl, ale viděl, jak se černý obrys pahorku pomalu otřásl a začal se zvedat."
"see","see","viděl","vidět","impf"," Rincewind could n't see all this, of course, since his own eyes were daylight issue only, but he did see the whole dark landscape shake itself slowly and then begin to rise impossibly against the stars."," To všechno Mrakoplaš, jehož oči byly zvyklé na denní světlo, neviděl, ale viděl, jak se černý obrys pahorku pomalu otřásl a začal se zvedat."
"shake","shake","otřásl","otřást","pf"," Rincewind could n't see all this, of course, since his own eyes were daylight issue only, but he did see the whole dark landscape shake itself slowly and then begin to rise impossibly against the stars."," To všechno Mrakoplaš, jehož oči byly zvyklé na denní světlo, neviděl, ale viděl, jak se černý obrys pahorku pomalu otřásl a začal se zvedat."
"begin","begin","začal","začít","pf"," Rincewind could n't see all this, of course, since his own eyes were daylight issue only, but he did see the whole dark landscape shake itself slowly and then begin to rise impossibly against the stars."," To všechno Mrakoplaš, jehož oči byly zvyklé na denní světlo, neviděl, ale viděl, jak se černý obrys pahorku pomalu otřásl a začal se zvedat."
"rise","rise","zvedat","zvedat","impf"," Rincewind could n't see all this, of course, since his own eyes were daylight issue only, but he did see the whole dark landscape shake itself slowly and then begin to rise impossibly against the stars."," To všechno Mrakoplaš, jehož oči byly zvyklé na denní světlo, neviděl, ale viděl, jak se černý obrys pahorku pomalu otřásl a začal se zvedat."
"rose","rise","vstalo","vstát","pf"," The sun rose."," Slunce už vstalo."
"Thank","thank","Děkuji","děkovat","impf"," ‘ Thank you, ’ said Twoflower."," "" Děkuji vám, "" kývl na něj Dvoukvítek."
"think","think","Mám","mít","impf"," ‘ I think my back'sh gone again, ’ complained Cohen, as Bethan helped him to his feet."," "" Mám počit, že mě už žaše vžaly žáda, "" stěžoval si Cohen, když mu Bethan pomáhala na nohy."
"complained","complain","stěžoval","stěžovat","impf"," ‘ I think my back'sh gone again, ’ complained Cohen, as Bethan helped him to his feet."," "" Mám počit, že mě už žaše vžaly žáda, "" stěžoval si Cohen, když mu Bethan pomáhala na nohy."
"helped","help","pomáhala","pomáhat","impf"," ‘ I think my back'sh gone again, ’ complained Cohen, as Bethan helped him to his feet."," "" Mám počit, že mě už žaše vžaly žáda, "" stěžoval si Cohen, když mu Bethan pomáhala na nohy."
"do","do","uděláme","udělat","pf"," ‘ What do we do with this man? ’ said Bethan."," "" A co uděláme s tím mužem? "" zeptala se Bethan."
"do","do","uděláme","udělat","pf"," ‘ What do we do with this man? ’ said Bethan."," "" A co uděláme s tím mužem? "" zeptala se Bethan."
"tell","tell","řekneme","říci","pf"," ‘ We take hish knife and tell him to bugger off, ’ said Cohen."," "" Šebereme mu nůž a řekneme mu, aby vodprejšknul, "" zamračil se Cohen."
"said","say","řekneme","říci","pf"," ‘ We take hish knife and tell him to bugger off, ’ said Cohen."," "" Šebereme mu nůž a řekneme mu, aby vodprejšknul, "" zamračil se Cohen."
"Thank","thank","Děkuju","děkovat","impf"," Thank you, sir! ’ said Weems, and bolted towards the cavemouth."," Děkuju vám, pane! "" vypravil ze sebe Weems a vrhl se k ústí jeskyně."
"leave","leave","nechte","nechat","pf"," But leave the axe behind. ’"," Ale tu sekeru nechte raději doma. """
"opened","open","otevřel","otevřít","pf"," When Cohen opened his mouth little pinpoints of bright light illuminated all the shadows."," Když Cohen otevřel ústa, objevila se ve všech okolních stínech veselá prasátka."
"want","want","chceš","chtít","impf"," ‘ What do you want, grandad? ’ he snarled."," "" Co chceš, dědku? """
"smiled","smile","usmál","usmát","pf"," Cohen paused until he had the man 's full attention, and then he smiled."," Cohen mlčel, dokud se k němu muž úplně neotočil, a pak se usmál."
"unveiling","unveil","odhalil","odhalit","pf"," It was a slow, lazy smile, unveiling about 300 carats of mouth jewellery that seemed to light up the room."," Byl to takový pomalý, líný úsměv, který odhalil asi tři sta karátů z pokladu, který měl Cohen v ústech, a v místnosti se rozsvětlilo."
"said","say","prohlásil","prohlásit","pf"," ‘ I will count to three, ’ he said, in a friendly tone of voice."," "" Teď napočítám do tří, "" prohlásil přátelským tónem."
"slept","sleep","spalo","spát","impf"," Approximately sixty-seven, maybe sixty-eight, per cent of the city slept."," Takže město spalo zhruba z šedesáti sedmi, možná šedesáti osmi procent."
"formed","form","tvořila","tvořit","impf"," Ice formed on the walls."," Na zdech se tvořila námraza."
"tried","try","pokoušel","pokoušet","impf"," He looked blankly at the book while Twoflower bustled around unheeded and Cohen tried in vain to lever the rings off the stone wizards."," Nepřítomně zíral do Oktáva, zatímco Dvoukvítek nadšeně zkoumal ochoz věže a Cohen se pokoušel stáhnout kamenným mágům z rukou prsteny."
"do","do","udělat","udělat","pf"," He had to do something, he reminded himself."," Mrakoplaš si uvědomil, že měl ještě něco udělat."
"turned","turn","Obrátil","obrátit","pf"," He turned over the page."," Obrátil další stranu."
"caused","cause","Způsobil","způsobit","pf"," ‘ You 've caused us a lot of trouble, young Rincewind, ’ the voice went on."," "" Způsobil jsi nám hodně starostí, mladý Mrakoplaši, "" pokračoval hlas."
"went","go","pokračoval","pokračovat","impf"," ‘ You 've caused us a lot of trouble, young Rincewind, ’ the voice went on."," "" Způsobil jsi nám hodně starostí, mladý Mrakoplaši, "" pokračoval hlas."
"said","say","odpověděl","odpovědět","pf"," ‘ I often do n't know where my Luggage is, that 's what being a tourist is all about, ’ said Twoflower."," "" Jedním ze základních znaků turisty je, že často neví, kde má zavazadla, "" odpověděl jí Dvoukvítek."
"wanders","wander","prochází","procházet","impf"," ‘ Anyway, it often wanders off by itself."," "" Často se prochází samo."
"began","begin","začalo","začít","pf"," It began to dawn on the mob that nothing was actually happening, and that Rincewind was in no condition to hurl insults, let alone magical fire."," Davu pomalu začalo docházet, že se nic neděje a že Mrakoplaš jim není schopný vrhnout do tváře ani nadávku, natož aby na ně vrhl nějaká magická zaklínadla."
"hurl","hurl","vrhnout","vrhnout","pf"," It began to dawn on the mob that nothing was actually happening, and that Rincewind was in no condition to hurl insults, let alone magical fire."," Davu pomalu začalo docházet, že se nic neděje a že Mrakoplaš jim není schopný vrhnout do tváře ani nadávku, natož aby na ně vrhl nějaká magická zaklínadla."
"hurl","hurl","vrhl","vrhnout","pf"," It began to dawn on the mob that nothing was actually happening, and that Rincewind was in no condition to hurl insults, let alone magical fire."," Davu pomalu začalo docházet, že se nic neděje a že Mrakoplaš jim není schopný vrhnout do tváře ani nadávku, natož aby na ně vrhl nějaká magická zaklínadla."
"advanced","advance","postupovat","postupovat","impf"," They advanced, watching his hands cautiously."," Začali pomalu postupovat kupředu a ostražitě pozorovali jeho ruce."
"watching","watch","pozorovali","pozorovat","impf"," They advanced, watching his hands cautiously."," Začali pomalu postupovat kupředu a ostražitě pozorovali jeho ruce."
"see","see","vidět","vidět","impf"," ‘ But you can still see the stars, ’ said Twoflower, ‘ the other stars, I mean."," "" Ale hvězdy jsou stále ještě vidět, "" upozorňoval je Dvoukvítek."
"trying","try","pokoušela","pokoušet","impf"," A group of star people and citizens were trying to batter them down."," Skupina hvězdonošů spojená s obyčejnými lidmi se je pokoušela vyrazit těžkým kůlem."
"get","get","nedostaneme","dostat","pf"," ‘ We 'll never get in."," "" Nikdy se dovnitř nedostaneme."
"going","go","jdeš","jít","impf"," Where are you going? ’"," Kam jdeš? """
"sitting","sit","seděl","sedět","impf"," The Head Librarian was sitting on top of his desk, quietly peeling an orange, and was well aware of that."," Hlavní knihovník seděl na svém stole, tiše loupal pomeranč a byl si nebezpečí plně vědom."
"looking","look","Hledám","hledat","impf"," ‘ I 'm looking for anything we 've got on the Pyramid of Tshut, ’ said Trymon."," "" Hledám cokoliv, co se týká pyramidy v Tsortu, "" obrátil se k němu Trémon."
"think","think","Neměli","mít","impf"," ‘ Do you think we 'd better go and look for him? ’"," "" Neměli bychom se po něm jít podívat? """
"Do","do","jít","jít","impf"," ‘ Do you think we 'd better go and look for him? ’"," "" Neměli bychom se po něm jít podívat? """
"go","go","jít","jít","impf"," ‘ Do you think we 'd better go and look for him? ’"," "" Neměli bychom se po něm jít podívat? """
"look","look","podívat","podívat","pf"," ‘ Do you think we 'd better go and look for him? ’"," "" Neměli bychom se po něm jít podívat? """
"said","say","odpověděl","odpovědět","pf"," ‘ He 's not a terribly good wizard, actually, ’ said Twoflower, drawing nearer the fire."," "" No, on zas není tak skvělý čaroděj, "" odpověděl mu Dvoukvítek a přisedl si blíž k ohni."
"shut","shut","zavřela","zavřít","pf"," As the sunlight hit it the book snapped shut and started to fall back to the tower."," Ve chvíli, kdy se knihy dotkly první sluneční paprsky, zavřela se a začala padat dolů k ochozu věže."
"started","start","začala","začít","pf"," As the sunlight hit it the book snapped shut and started to fall back to the tower."," Ve chvíli, kdy se knihy dotkly první sluneční paprsky, zavřela se a začala padat dolů k ochozu věže."
"fall","fall","padat","padat","impf"," As the sunlight hit it the book snapped shut and started to fall back to the tower."," Ve chvíli, kdy se knihy dotkly první sluneční paprsky, zavřela se a začala padat dolů k ochozu věže."
"realized","realize","uvědomilo","uvědomit","pf"," And many of the observers realized that dropping towards them was the single most magical thing on the Discworld."," Mnoho přihlížejících si uvědomilo, že samotný ten pád je nejkouzelnější věc na celé Zeměploše."
"elevated","elevate","pozvedl","pozvednout","pf"," He was n't good or evil or cruel or extreme in any way but one, which was that he had elevated greyness to the status of a fine art and cultivated a mind that was as bleak and pitiless and logical as the slopes of Hell."," Nebyl ani dobrý, ani zlý, ani krutý nebo výjimečný jakýmkoliv způsobem, snad s výjimkou jediné věci, pozvedl šeď a bezvýraznost na úroveň jemného umění a vypěstoval si mysl, která byla beznadějná, nemilosrdná a logická jako úbočí pekla."
"lit","light","zapálili","zapálit","pf"," ‘ Yes, because, you see, you 've lit it on his tongue. ’"," "" Jasně, protože vy jste mu ho zapálili rovnou na jazyku! """
"moved","move","pohnula","pohnout","pf"," Then the floor moved."," Pak se zem pohnula."
"happened","happen","odehrálo","odehrát","pf"," He nearly did n't awake at all, in fact a few decades later none of this could have happened."," Kdyby se všechno odehrálo o pár desítek let později, byl by se už asi nevzbudil vůbec a příběh by byl skončil jinak."
"remember","remember","nevzpomínal","vzpomínat","impf"," He could n't remember why he was in a hayloft, or why he was wearing someone else 's coat, but he did wake up with one idea right in the forefront of his mind."," Vůbec si nevzpomínal, proč leží na seníku, ani proč má cizí kabát, zato v hlavě mu seděla jediná utkvělá myšlenka."
"wearing","wear","má","mít","impf"," He could n't remember why he was in a hayloft, or why he was wearing someone else 's coat, but he did wake up with one idea right in the forefront of his mind."," Vůbec si nevzpomínal, proč leží na seníku, ani proč má cizí kabát, zato v hlavě mu seděla jediná utkvělá myšlenka."
"send","send","posílali","posílat","impf"," Rich merchants who have spent many years abroad send back home for specially-stoppered and sealed bottles of the stuff, which brings tears to their eyes."," Bohatí kupci, kteří žili dlouhá léta v zahraničí, si posílali domů pro speciálně zajištěné a zapečetěné lahve morporského vzduchu, pak si je v daleké cizině otvírali a čichali tu sílu, která jim vháněla slzy do očí."
"describe","describe","popsat","popsat","pf"," There is only really one way to describe the effect the smell of Ankh-Morpork has on the visiting nose, and that is by analogy."," Je jediný způsob, jak popsat účinek, který měl ankh - morporský vzduch na nos náhodného návštěvníka, a to zase jen pomocí přirovnání."
"take","take","Vezměte","vzít","pf"," Now take a chameleon."," Vezměte chameleona."
"Put","put","Položte","položit","pf"," Put the chameleon on the tartan."," Položte ho na tartan."
"trust","trust","věř","věřit","impf"," ‘ I know this thing, trust me."," "" Já tu věc znám, věř mi."
"said","say","prohlásil","prohlásit","pf"," ‘ Hurry up, ’ he said."," "" Pospěš si, "" prohlásil."
"think","think","Mám","mít","impf"," ‘ I think it 's going to go. ’"," "" Mám pocit, že každou chvilku vyrazí. """
"said","say","prohlásil","prohlásit","pf"," ‘ Stars are small lights in the sky, ’ said Twoflower."," "" Hvězdy jsou malá světýlka vysoko na obloze, "" prohlásil Dvoukvítek."
"say","say","neřekl","říci","pf"," ‘ I did n't say anything! ’"," "" Já jsem nic neřekl! """
"yelled","yell","vykřikla","vykřiknout","pf"," ‘ Yes you did, you silly man! ’ yelled Bethan."," "" Samozřejmě, že ano, ty hlupáku! "" vykřikla na něj Bethan."
"saw","see","Viděli","vidět","impf"," ‘ We saw your lips going up and down and everything! ’"," "" Viděli jsme přece, jak hýbeš pusou! """
"shut","shut","zavřel","zavřít","pf"," Rincewind shut his eyes."," Mrakoplaš zavřel oči."
"feel","feel","Cítil","cítit","impf"," Inside his mind he could feel the Spell scuttling off to hide behind his conscience, and muttering to itself."," Cítil, jak se mu hluboko v mozku pomalu šourá Zaklínadlo, něco si brumlá a pokouší se ukrýt za jeho vědomí."
"hide","hide","ukrýt","ukrýt","pf"," Inside his mind he could feel the Spell scuttling off to hide behind his conscience, and muttering to itself."," Cítil, jak se mu hluboko v mozku pomalu šourá Zaklínadlo, něco si brumlá a pokouší se ukrýt za jeho vědomí."
"said","say","odpověděl","odpovědět","pf"," ‘ All right, all right, ’ he said."," "" Dobře, dobře, "" odpověděl."
"need","need","Nemusíš","muset","impf"," ‘ No need to shout."," "" Nemusíš hned křičet."
"shout","shout","křičet","křičet","impf"," ‘ No need to shout."," "" Nemusíš hned křičet."
"said","say","prohlásil","prohlásit","pf"," ‘ Shometimesh we jusht have to take rishks, ’ he said."," "" Občaš proště mušíme riškovat, "" prohlásil."
"took","take","Trvalo","trvat","impf"," It took them half an hour to get down."," Trvalo jim přes půl hodiny, než se dostali dolů."
"took","take","dostali","dostat","pf"," It took them half an hour to get down."," Trvalo jim přes půl hodiny, než se dostali dolů."
"get","get","dostali","dostat","pf"," It took them half an hour to get down."," Trvalo jim přes půl hodiny, než se dostali dolů."
"need","need","nepotřebuješ","potřebovat","impf"," ‘ You do n't need to take pictures, you can just remember it! ’ he shouted."," "" Vždyť ty obrázky vůbec nepotřebuješ, stačí, když si to budeš všechno pamatovat! "" vykřikl zoufale."
"take","take","nepotřebuješ","potřebovat","impf"," ‘ You do n't need to take pictures, you can just remember it! ’ he shouted."," "" Vždyť ty obrázky vůbec nepotřebuješ, stačí, když si to budeš všechno pamatovat! "" vykřikl zoufale."
"remember","remember","pamatovat","pamatovat","impf"," ‘ You do n't need to take pictures, you can just remember it! ’ he shouted."," "" Vždyť ty obrázky vůbec nepotřebuješ, stačí, když si to budeš všechno pamatovat! "" vykřikl zoufale."
"shouted","shout","vykřikl","vykřiknout","pf"," ‘ You do n't need to take pictures, you can just remember it! ’ he shouted."," "" Vždyť ty obrázky vůbec nepotřebuješ, stačí, když si to budeš všechno pamatovat! "" vykřikl zoufale."
"said","say","odpověděl","odpovědět","pf"," ‘ It 's not the same, ’ said Twoflower calmly."," "" Když to není ono, "" odpověděl Dvoukvítek nevzrušeně."
"hope","hope","doufám","doufat","impf"," ‘ Oh, I do hope you 're not going. ’"," "" Ach, doufám, že už neodcházíte. """
"going","go","neodcházíte","odcházet","impf"," ‘ Oh, I do hope you 're not going. ’"," "" Ach, doufám, že už neodcházíte. """
"wore","wear","neměl","mít","impf"," Despite the snow he wore nothing more than a studded leather holdall and a pair of boots that could have easily accommodated a second pair of feet."," Navzdory zimě na sobě neměl nic jiného než jakýsi kožešinový pytel a pár bot, do kterých by se bez potíží vešel ještě jeden pár nohou."
"looked","look","díval","dívat","impf"," Rincewind looked carefully at the bed."," Mrakoplaš se na postel díval s nedůvěrou."
"said","say","prohlásil","prohlásit","pf"," A voice by Rincewind 's knee said :"," Hlas někde u Mrakoplašova kolena prohlásil :"
"persuaded","persuade","přemluveny","přemluvit","pf"," Thus it was that the sun and moon orbited the Disc because they were persuaded not to fall down, but did n't actually fly away because of uncertainty."," Tak například Slunce a Měsíc obíhaly Plochu proto, že byly přemluveny, aby nespadly a neuletěly do kosmu, protože měly strach z Nejistoty."
"fall","fall","nespadly","spadnout","pf"," Thus it was that the sun and moon orbited the Disc because they were persuaded not to fall down, but did n't actually fly away because of uncertainty."," Tak například Slunce a Měsíc obíhaly Plochu proto, že byly přemluveny, aby nespadly a neuletěly do kosmu, protože měly strach z Nejistoty."
"grow","grow","růst","růst","impf"," Charm allowed trees to grow and bloody-mindedness kept them up, and so on."," Nadpřirozeno umožňovalo stromům růst a Nasranost je udržovala ve vztyčené poloze a tak dál."
"kept","keep","udržovala","udržovat","impf"," Charm allowed trees to grow and bloody-mindedness kept them up, and so on."," Nadpřirozeno umožňovalo stromům růst a Nasranost je udržovala ve vztyčené poloze a tak dál."
"wish","wish","Chtěl","chtít","impf"," I wish I had a bronze torc for every user who did n't read the manual. ’"," Chtěl bych mít bronzový náramek za každého uživatele, který se vůbec neunavuje tím, aby alespoň nahlédl do manuálu. """
"asked","ask","zeptal","zeptat","pf"," ‘ What use is it, then, exactly? ’ asked Rincewind."," "" A k čemu to přesně je? "" zeptal se Mrakoplaš."
"use","use","použít","použít","pf"," ‘ You can use it to – to tell you what time of year it is, ’ said Belafon."," "" No, můžeš to použít ... s pomocí těch kamenů můžeš přesně určit roční dobu a čas, "" odpověděl Belafon."
"said","say","odpověděl","odpovědět","pf"," ‘ You can use it to – to tell you what time of year it is, ’ said Belafon."," "" No, můžeš to použít ... s pomocí těch kamenů můžeš přesně určit roční dobu a čas, "" odpověděl Belafon."
